Date,Publication,Headline,URL,BreachMentioned,CompanyMentioned
20161215,New York Post,Accused bank hacker claims Russia offered him asylum         :0,http://nypost.com/2016/12/15/accused-bank-hacker-claims-russia-offered-him-asylum/,True,False
20161215,New York Post,Yahoo shares fall as hack endangers Verizon deal         :0,http://nypost.com/2016/12/15/yahoo-shares-fall-as-hack-endangers-verizon-deal/,True,Verizon
20161215,New York Post,How Obama invited the Russian 'hack attack'         :0,http://nypost.com/2016/12/14/how-obama-invited-the-russian-hack-attack-and-worse/,True,False
20150131,New York Post,Islamic State beheads Japanese journalist,http://nypost.com/2015/01/31/islamic-state-beheads-japanese-journalist/,True,False
20181031,New York Post,Brain implants are reportedly prone to hacking,https://nypost.com/2018/10/31/brain-implants-are-reportedly-prone-to-hacking/,True,False
20181031,New York Post,Chinese intelligence officers charged in US aviation hacking,https://nypost.com/2018/10/31/chinese-intelligence-officers-charged-in-us-aviation-hacking/,True,False
20201029,New York Post,Tucker Carlson's Hunter Biden documents reportedly located,https://nypost.com/2020/10/29/tucker-carlsons-hunter-biden-documents-reportedly-located/,True,Hunter Biden
20161216,New York Post,Verizon may acquire Yahoo for a bargain after email hack disaster         :0,http://nypost.com/2016/12/16/verizon-may-acquire-yahoo-for-a-bargain-after-email-hack-disaster/,True,"Verizon, Yahoo"
20181101,New York Post,"Jhlo Low, ex-Goldman bankers accused of laundering billions in stolen funds",https://nypost.com/2018/11/01/jhlo-low-ex-goldman-bankers-accused-of-laundering-billions-in-stolen-funds/,True,"Jhlo Low, ex-Goldman bankers"
20220929,New York Post,"Wrong side of history Openly transgender Army major, wife charged in plot to give medical records to Russia",https://nypost.com/2022/09/29/us-army-major-wife-charged-with-plotting-to-hand-over-medical-records-to-russia/,True,False
20220929,New York Post,"YouTube restricts video of Dems, critics saying 2016 election was hacked",https://nypost.com/2022/09/29/youtube-restricts-video-of-dems-critics-saying-2016-election-was-hacked/,True,YouTube
20220929,New York Post,Russian oligarch Oleg Deripaska charged with violating US sanctions,https://nypost.com/2022/09/29/russian-oligarch-oleg-deripaska-charged-with-violating-us-sanctions/,True,Oleg Deripaska
20220929,New York Post,Entrepreneur squeezed by Lebanon's economic collapse threatens to burn down bank — to get his own money out,https://nypost.com/2022/09/29/entrepreneur-hailed-as-a-hero-after-threatening-to-burn-down-bank-to-get-his-own-money/,True,Bank
20161217,New York Post,Car bomb kills 13 and injures 48 in Turkey         :0,http://nypost.com/2016/12/17/car-bomb-kills-13-and-injures-48-in-turkey/,True,False
20181102,New York Post,"Gunman shoots 4 people, then himself at Florida yoga studio",https://nypost.com/2018/11/02/gunman-shoots-4-people-then-himself-at-florida-yoga-studio/,True,False
20181102,New York Post,Couple accused of keeping 'slave' in garden shed for 4 years,https://nypost.com/2018/11/02/couple-accused-of-keeping-slave-in-garden-shed-for-4-years/,True,False
20201031,New York Post,Feds reportedly seized second Hunter Biden laptop in February,https://nypost.com/2020/10/31/feds-reportedly-seized-second-hunter-biden-laptop-in-february/,True,Government
20110829,New York Post,Gunmen caught in Georg Jensen jewelry heist linked to three other robberies: cops,http://www.nypost.com/p/news/local/manhattan/gunmen_caught_other_georg_jensen_YVXEXVKmk0132tK6xWfvLI,True,Georg Jensen
20181103,New York Post,2 dead after Amazon building collapse,https://nypost.com/2018/11/03/one-dead-another-missing-after-amazon-building-collapse/,True,Amazon
20161218,New York Post,Intel officials won't brief electors on Russian hacking before vote         :0,http://nypost.com/2016/12/18/intel-officials-wont-brief-electors-on-russian-hacking-before-vote/,True,Government
20130509,New York Post,Charred bodies found in Bronx fire were butchered: source,http://www.nypost.com/p/news/local/bronx/charred_bodies_found_in_bronx_fire_ceMSSyXVsfY3go57pqFV7L,True,False
20130509,New York Post,Tax looter hit by break-in,http://www.nypost.com/p/news/local/tax_looter_hit_by_break_in_wejMGLiukk31H9yOkAUi8H,True,False
20110830,New York Post,Victim battles iJacker,http://www.nypost.com/p/news/local/brooklyn/victim_battles_ijacker_07kIWQJjrwBQuiaKCtRCFK,True,False
20130510,New York Post,‘Wad’ a heist for ATM duo!,http://www.nypost.com/p/news/local/wad_heist_for_atm_duo_FdY8XkuFZbKTGAHUL9OOzH,True,false
20221002,New York Post,How $600 billion was stolen from the American people,https://nypost.com/2022/10/02/how-600-billion-was-stolen-from-the-american-people/,True,False
20201102,New York Post,exclusive             Video shows the moment 8-year-old was shot while trick-or-treating,https://nypost.com/2020/11/02/video-shows-moment-8-year-old-was-shot-in-while-trick-or-treating/,True,False
20150204,New York Post,PE firm to lose $800M it sank into Snowden vetter Altegrity,http://nypost.com/2015/02/03/pe-firm-to-lose-800m-it-sunk-into-snowden-vetter-altegrity/,True,Altegrity
20221002,New York Post,"Schumer calls on feds to give victims more info on hacks, data breaches",https://nypost.com/2022/10/02/schumer-calls-on-feds-to-give-victims-more-info-on-hacks-data-breaches/,True,False
20161220,New York Post,Dramatic explosion at fireworks market leaves dozens dead         :0,http://nypost.com/2016/12/20/several-killed-when-fireworks-explosion-rocks-mexico-city/,True,False
20130511,New York Post,"JPMorgan: Bloomberg reporters tapped into our terminal data, too",http://www.nypost.com/p/news/business/incredible_skulk_yRE9AcRmJfvHiLcm0maIsL,True,Bloomberg
20221003,New York Post,"North Korea fires ballistic missile over Japan, residents warned to take cover",https://nypost.com/2022/10/03/north-korea-fires-ballistic-missile-over-japan/,True,North Korea
20130511,New York Post,5 bank hits in single day,http://www.nypost.com/p/news/local/manhattan/bank_hits_in_single_day_UUthMdOkH58kbM4euZpyeJ,True,"Bank of America, Citigroup, JPMorgan Chase, Wells Fargo, Morgan Stanley"
20110901,New York Post,One dead ringer: DOJ’s deal killer could cost AT&T $5B-plus,http://www.nypost.com/p/news/business/one_dead_ringer_R2XHY5Hfmeyqfz6FRkA9MP,True,AT&T
20110901,New York Post,"Washington Monument 'leaking' after Irene, authorities confirm",http://www.nypost.com/p/news/national/washington_monument_leaking_after_BybMaNBLMTx8PfMvybtAdN,True,False
20161221,New York Post,Trove of child rape videos found at ex-USA Gymnastics doctor's home: FBI         :0,http://nypost.com/2016/12/21/trove-of-child-rape-videos-found-at-ex-usa-gymnastics-doctors-home-fbi/,True,False
20221004,New York Post,Chilling video shows moment retired NYPD detective is shot by stray bullet,https://nypost.com/2022/10/04/heres-the-moment-former-nypd-detective-is-shot-in-harlem/,True,False
20221004,New York Post,National debt surpasses $31 trillion for the first time in history,https://nypost.com/2022/10/04/us-national-debt-surpasses-31-trillion-for-the-first-time-in-history/,True,Government
20130512,New York Post,IRS knew in 2011 of Tea Party targeting,http://www.nypost.com/p/news/national/irs_knew_in_of_tea_party_targeting_wMySQ6peo6V41FKmuhOd2O,True,IRS
20181107,New York Post,Wells Fargo execs knew about auto insurance overcharges for years: suit,https://nypost.com/2018/11/07/wells-fargo-execs-knew-about-auto-insurance-overcharges-for-years-suit/,True,Wells Fargo
20110902,New York Post,LI Internet investor faces 20 years for running $5M in credit card charges,http://www.nypost.com/p/news/local/brooklyn/charges_internet_investor_faces_7JPwRIUEAgcFPXtyQghRSI,True,True
20150207,New York Post,TurboTax stops e-filing state returns after fraud spike,http://nypost.com/2015/02/06/turbotax-stops-e-filing-state-returns-after-fraud-spike/,True,TurboTax
20110903,New York Post,Web shop's $5M 'scam',http://www.nypost.com/p/news/local/web_shop_scam_7EqW11BvMpDDZrSrkr14CO,True,True
20201106,New York Post,Michigan Republicans claim software issue undercounted Trump votes,https://nypost.com/2020/11/06/michigan-gop-claims-software-issue-undercounted-trump-votes/,True,False
20161223,New York Post,Top European banks agree to pay $12B over toxic bonds         :0,http://nypost.com/2016/12/23/top-european-banks-agree-to-pay-12b-over-toxic-bonds/,True,True
20181109,New York Post,Killer vet's chilling final Facebook post before California bar massacre,https://nypost.com/2018/11/09/ian-david-longs-chilling-final-facebook-post-before-california-bar-shooting/,True,False
20130514,New York Post,Elan shareholders sue Cohen’s SAC Capital for nearly $1B,http://www.nypost.com/p/news/business/elan_shareholders_sue_cohen_sac_vTYrMp5PmNO7AFpQDaLQyO,True,Elan
20150208,New York Post,Riot at soccer game leaves at least 25 people dead,http://nypost.com/2015/02/08/riot-at-soccer-game/,True,False
20181110,New York Post,Why Russian hackers didn't strike during the midterm elections,https://nypost.com/2018/11/10/why-russian-hackers-didnt-strike-during-the-midterms/,True,False
20181110,New York Post,Amazon Echo may have captured audio of murder,https://nypost.com/2018/11/09/amazon-echo-may-have-captured-audio-of-murder/,True,Amazon
20150209,New York Post,"HSBC hid millions for arms dealers, drug traffickers & celebs",http://nypost.com/2015/02/09/hsbc-hid-millions-for-arms-dealers-drug-traffickers-and-celebrities/,True,HSBC
20221008,New York Post,Cop illegally recorded sex act with woman — and showed off footage: lawsuit,https://nypost.com/2022/10/08/bay-area-cop-anthony-luciano-vasquez-illegally-recorded-sex-act-with-woman-lawsuit/,True,False
20221008,New York Post,Witnesses in alleged COVID vaccine fraud case put 82 NYC educators in potential legal danger,https://nypost.com/2022/10/08/covid-vaccine-fraud-witnesses-put-82-nyc-teachers-in-legal-limbo/,True,False
20181111,New York Post,'I'm suffocating': Khashoggi's final words revealed in audio recording,https://nypost.com/2018/11/11/im-suffocating-khashoggis-final-words-revealed-in-audio-recording/,True,False
20221009,New York Post,Dem LA council members exposed for racist comments about colleague's son on secret recording,https://nypost.com/2022/10/09/dem-la-council-members-exposed-for-racist-comments-about-colleagues-son-on-secret-recording/,True,False
20201109,New York Post,‘American Housewife’ star Carly Hughes exits over ‘toxic environment’,https://nypost.com/2020/11/09/american-housewife-star-carly-hughes-exits-over-toxic-environment/,True,Carly Hughes
20161226,New York Post,Leaking toilet helps jailbirds escape         :0,http://nypost.com/2016/12/26/inmates-escape-jail-through-hole-behind-toilet/,True,False
20161226,New York Post,Dead Ivy League lab mice blamed for polluting water         :0,http://nypost.com/2016/12/26/dead-ivy-league-lab-mice-blamed-for-polluting-water/,True,False
20130517,New York Post,Cannes theft,http://www.nypost.com/p/news/international/million_in_jewelry_stolen_from_cannes_4mj0Fk8MsuLBfiUV04AN7K,True,False
20150211,New York Post,Hackers score on 60 percent of hook-up apps,http://nypost.com/2015/02/10/hackers-score-on-60-percent-of-hook-up-apps/,True,False
20150211,New York Post,Twitter CFO’s account gets hacked after message gaffe,http://nypost.com/2015/02/10/twitter-cfos-account-gets-hacked-after-message-gaffe/,True,Twitter
20150211,New York Post,Shhh … Samsung reveals new smart TVs can eavesdrop,http://nypost.com/2015/02/10/shhhh-samsung-reveals-new-smart-tvs-can-eavesdrop/,True,Samsung
20221010,New York Post,"Major US airport websites taken offline, pro-Russia hacking group takes credit",https://nypost.com/2022/10/10/major-us-airport-websites-taken-offline-pro-russia-hacking-group-takes-credit/,True,False
20201110,New York Post,Brazil halts COVID-19 vaccine trial after volunteer has 'severe adverse event',https://nypost.com/2020/11/10/brazil-halts-covid-19-vaccine-after-severe-adverse-event/,True,False
20161227,New York Post,Dozens shot in Chicago over holiday weekend         :0,http://nypost.com/2016/12/27/dozens-shot-in-chicago-over-holiday-weekend/,True,government
20150212,New York Post,Inmates commit suicide after failed prison break,http://nypost.com/2015/02/12/inmates-commit-suicide-after-failed-prison-break/,True,False
20150212,New York Post,HSBC singles out worker for leaks: sources,http://nypost.com/2015/02/11/hsbc-singles-out-worker-for-leaks-sources/,True,HSBC
20181114,New York Post,exclusive   Crafty crook fished $400K in checks out of postal boxes: cops,https://nypost.com/2018/11/14/crafty-crook-fished-400k-in-checks-out-of-postal-boxes-cops/,True,False
20181114,New York Post,Leak sends World Chess Championship into chaos,https://nypost.com/2018/11/14/leak-sends-world-chess-championship-into-chaos/,True,False
20110908,New York Post,"Hackers take over NBC News Twitter feed, post false alerts of Ground Zero attack",http://www.nypost.com/p/news/local/hackers_attack_over_ground_news_I8qa2ZtgVpzCJlgbH6MixL,True,NBC News
20201111,New York Post,Ring of fire: Home-security startup recalls doorbell cams that can ignite,https://nypost.com/2020/11/11/amazons-ring-recalls-video-doorbells-that-can-catch-on-fire/,True,Amazon
20161228,New York Post,Amazon Echo is at the center of a murder investigation         :0,http://nypost.com/2016/12/28/amazon-echo-is-at-the-center-of-a-murder-investigation/,True,Amazon
20130519,New York Post,"Suspect in cold-blooded murder of gay man bragged, 'Yeah, I shot him in the head'",http://www.nypost.com/p/news/local/manhattan/suspect_accused_charged_killing_7n5m6RCExKKQPPm9m5TtYP,True,False
20221012,New York Post,NY shelter population hits record as migrants keep rolling in,https://nypost.com/2022/10/12/nyc-shelter-population-hits-record-as-migrant-buses-keep-arriving/,True,False
20130519,New York Post,Feds swoop in on ‘ricin’ apt.,http://www.nypost.com/p/news/national/feds_swoop_in_on_ricin_apt_PHg29kYrBGdDnppXAc7i7J,True,False
20161229,New York Post,US kicks out dozens of Russian diplomats over election hacking         :0,http://nypost.com/2016/12/29/us-kicks-out-dozens-of-russian-diplomats-over-election-hacking/,True,Government
20161229,New York Post,Journalist shot dead in front of her 6-year-old son         :0,http://nypost.com/2016/12/29/journalist-shot-dead-in-front-of-her-6-year-old-son/,True,False
20161229,New York Post,"Yes, pacemakers can get hacked         :0",http://nypost.com/2016/12/29/yes-pacemakers-can-get-hacked/,True,False
20221013,New York Post,Off-duty officer among multiple dead in 'active shooting' in Raleigh: reports,https://nypost.com/2022/10/13/off-duty-officer-killed-in-raleigh-shooting-reports/,True,False
20221013,New York Post,Utter proof the FBI framed Trump and shielded Hunter Biden,https://nypost.com/2022/10/12/utter-proof-the-fbi-framed-trump-and-shielded-hunter/,True,False
20130520,New York Post,Scandals mushroom: DOJ 'surveilled' reporter; Chief of Staff knew of IRS Tea Party spying,http://www.nypost.com/p/news/national/justice_department_targeted_fox_Hu8chR8eEikdUfUJyStNCI,True,Government
20130520,New York Post,"$2M in meth, heroin seized in Queens",http://www.nypost.com/p/news/local/in_meth_heroine_seized_in_queens_1TlLYTShpnFh2blEpug5OO,True,False
20181117,New York Post,A 'monster' plume of toxins under our house gave us cancer,https://nypost.com/2018/11/17/a-monster-plume-of-toxins-under-our-house-gave-us-cancer/,True,False
20161230,New York Post,"Drudge Report shuts down, suggests US government behind cyber-attack         :0",http://nypost.com/2016/12/30/drudge-report-shuts-down-suggests-us-government-behind-cyberattack/,True,Government
20150215,New York Post,ISIS releases video claiming to show beheading of 21 Egyptians,http://nypost.com/2015/02/15/isis-releases-video-claiming-to-show-killing-of-21-egyptians/,True,False
20130521,New York Post,UK soldier 'beheaded' in 'terror' attack by 'madman who praised Allah after cleaver stab',http://www.nypost.com/p/news/international/terror_official_barbaric_attack_X20RxbpdKtktCqvdj4St6H,True,False
20110911,New York Post,"Bank of America to cut 30,000 jobs to save $5B per year",http://www.nypost.com/p/news/business/bank_of_america_to_cut_jobs_to_save_EoWcVvzA0u9KhutJEBSBfJ,True,Bank of America
20201114,New York Post,"Foreign hackers are targeting COVID-19 vaccine makers, Microsoft warns",https://nypost.com/2020/11/13/microsoft-says-foreign-hackers-are-targeting-covid-19-vaccine-makers/,True,Microsoft
20161231,New York Post,Russian hacking code detected in Vermont electrical system         :0,http://nypost.com/2016/12/31/russian-hacking-code-detected-in-vermont-electrical-system/,True,Government
20221015,New York Post,Kentucky man arrested after posting video of himself choking toddler: report,https://nypost.com/2022/10/15/kentucky-man-arrested-after-posting-video-of-himself-choking-toddler/,True,False
20181119,New York Post,Teacher missing in Mexico was killed by cartel member: officials,https://nypost.com/2018/11/19/teacher-missing-in-mexico-was-killed-by-cartel-member-officials/,True,False
20170101,New York Post,Trump promises to disclose details about Russian hacking         :0,http://nypost.com/2017/01/01/trump-promises-to-disclose-details-about-russian-hacking/,True,Government
20170101,New York Post,Washington Post retracts story about Russian hack at Vermont utility,http://nypost.com/2017/01/01/washington-post-retracts-story-about-russian-hack-at-vermont-utility/,True,Washington Post
20221016,New York Post,Gripping bodycam video shows wounded Bristol officer shooting down cop killer,https://nypost.com/2022/10/16/gripping-bodycam-shows-wounded-bristol-officer-shooting-down-cop-killer/,True,False
20201116,New York Post,exclusive             How the NYPD gets people's personal data with no oversight,https://nypost.com/2020/11/16/how-the-nypd-gets-peoples-personal-data-with-no-oversight/,True,government
20130523,New York Post,Marathon fiend had killed before,http://www.nypost.com/p/news/national/marathon_fiend_had_killed_before_T8tsSGiz2NqVxMLcq9MNJM,True,False
20181120,New York Post,"Multiple dead in mansion shooting, fire: authorities",https://nypost.com/2018/11/20/multiple-dead-in-colts-neck-mansion-shooting-fire-authorities/,True,False
20181120,New York Post,exclusive   Man hacked into Silicon Valley execs' phones to steal cryptocurrency: cops,https://nypost.com/2018/11/20/man-hacked-into-silicon-valley-execs-phones-to-steal-cryptocurrency-cops/,True,Silicon Valley execs
20170102,New York Post,Thieves steal $6M in jewels while ball drops on New Year's Eve         :0,http://nypost.com/2017/01/02/thieves-steal-6m-in-jewels-while-ball-drops-on-new-years-eve/,True,false
20221017,New York Post,Hunter Biden-linked real estate firm got at least $100M from Russian oligarch: sources,https://nypost.com/2022/10/17/hunter-bidens-real-estate-firm-received-over-100m-from-russian-oligarch/,True,Hunter Biden
20221017,New York Post,"More lethal strain of COVID created in Boston University lab, researchers say",https://nypost.com/2022/10/17/boston-university-researchers-claim-to-have-developed-new-more-lethal-covid-strain-in-lab/,True,False
20150218,New York Post,US will auction nearly $12M in bitcoins seized from Silk Road,http://nypost.com/2015/02/18/us-will-auction-nearly-12m-in-bitcoins-from-silk-road/,True,Silk Road
20150218,New York Post,Kids’ photos being stolen for online role-playing fantasies: cops,http://nypost.com/2015/02/18/kids-pictures-are-being-stolen-for-online-role-playing-fantasies-cops/,True,False
20201117,New York Post,"1,600 cops, three suspects and $2.8B in jewels: Notorious museum heist has wild conclusion",https://nypost.com/2020/11/17/three-arrested-for-1-2b-german-museum-heist-by-1600-cops/,True,False
20221017,New York Post,Video shows bold $500K Park Avenue smash-and-grab,https://nypost.com/2022/10/17/video-shows-robbers-break-into-park-avenue-jewelry-store-and-steal-gems/,True,Park Avenue Jewelry Store
20181121,New York Post,Tumblr pulled from Apple app store over kiddie porn,https://nypost.com/2018/11/21/tumblr-pulled-from-apple-app-store-over-kiddie-porn/,True,Tumblr
20181121,New York Post,"Amazon leaked users' names, emails due to 'technical error'",https://nypost.com/2018/11/21/amazon-leaked-users-names-emails-due-to-technical-error/,True,Amazon
20181121,New York Post,Russian firm linked to election meddling sues Facebook,https://nypost.com/2018/11/21/russian-firm-linked-to-election-meddling-sues-facebook/,True,Facebook
20201118,New York Post,Apple to pay $113M to settle iPhone slowdown complaints,https://nypost.com/2020/11/18/apple-to-pay-113m-to-settle-iphone-slowdown-complaints/,True,Apple
20150219,New York Post,"7 infected, 2 dead after ‘superbug’ outbreak at LA hospital",http://nypost.com/2015/02/19/7-infected-2-dead-after-superbug-outbreak-at-la-hospital/,True,False
20150219,New York Post,Creditors want hedge funds probed in RadioShack’s fall,http://nypost.com/2015/02/18/creditors-want-hedge-funds-probed-in-radioshacks-fall/,True,RadioShack
20150220,New York Post,Snowden leak: NSA helped British steal cellphone codes,http://nypost.com/2015/02/20/snowden-leak-nsa-helped-british-steal-cell-phone-codes/,True,NSA
20170105,New York Post,Top intelligence official says Russia undoubtedly meddled in election         :0,http://nypost.com/2017/01/05/top-intelligence-official-says-russia-undoubtedly-meddled-in-election/,True,Government
20170105,New York Post,Special-needs man tortured while attackers livestream it on Facebook,http://nypost.com/2017/01/04/special-needs-man-tortured-while-attackers-stream-it-on-facebook/,True,Facebook
20150221,New York Post,"Feds send wrong tax info to 800,000 ObamaCare customers",http://nypost.com/2015/02/20/feds-send-wrong-tax-info-to-800000-obamacare-customers/,True,Government
20201121,New York Post,$90K theft preceded gruesome NJ mansion massacre: lawsuit,https://nypost.com/2020/11/21/theft-of-90k-preceded-colts-neck-mansion-massacre-lawsuit/,True,False
20201121,New York Post,Airbnb exec resigned over concerns company shared too much data with China,https://nypost.com/2020/11/21/airbnb-exec-quit-over-concerns-it-shared-too-much-data-with-china/,True,Airbnb
20221021,New York Post,"Jan. 6 committee issues subpoena to Trump, demanding his testimony",https://nypost.com/2022/10/21/jan-6-panel-issues-subpoena-to-former-president-trump/,True,Trump
20170106,New York Post,US intel report: Putin ordered cyberattacks to sway election         :0,http://nypost.com/2017/01/06/us-intel-report-putin-ordered-cyberattacks-to-sway-election/,True,Government
20201122,New York Post,Hundreds of bodies of coronavirus victims remain in freezer trucks,https://nypost.com/2020/11/22/hundreds-of-covid-dead-remain-in-brooklyn-freezer-trucks/,True,False
20221022,New York Post,Murder on the A train  Distressing video shows chaos on subway as 15-year-old is shot and killed,https://nypost.com/2022/10/22/video-shows-subway-chaos-as-15-year-old-is-shot-to-death/,True,False
20221022,New York Post,Record number of illegal immigrants die at southern border in fiscal year 2022,https://nypost.com/2022/10/22/record-856-migrants-die-at-southern-border-in-fiscal-year-2022-cbp/,True,False
20130528,New York Post,US weapons systems designs breached by Chinese hackers: report,http://www.nypost.com/p/news/national/designs_of_weapons_systems_breached_5glf6RWz9SjUCThwyp2C4I,True,False
20130528,New York Post,Grammy-nominated rocker 'on steroids' while recruiting 'hitman' to kill wife: lawyer,http://www.nypost.com/p/news/national/grammy_nominated_rocker_lawyer_kill_bB3m5mnx5VhvLD12WKJv7H,True,False
20110919,New York Post,"Upper West Side water main break halts service on A, B, C & D trains",http://www.nypost.com/p/news/local/severe_water_main_break_suspends_t2xv6Lygi8dpjipZmAwYKP,True,False
20221023,New York Post,TikTok denies report it 'harvests user data to monitor Americans' locations',https://nypost.com/2022/10/21/tiktok-denies-it-harvests-user-data-to-monitor-americans-locations/,True,TikTok
20150224,New York Post,"Red Sox’s Buchholz, wife helpless after nude phone hack",http://nypost.com/2015/02/24/red-soxs-buchholz-wife-helpless-after-nude-phone-hack/,True,False
20110920,New York Post,Mayor Bloomberg takes center stage in campaign larceny trial,http://www.nypost.com/p/news/local/mayor_bloomberg_takes_center_stage_Dglp4DtdvIRHdZsZg57kOM,True,Bloomberg
20181128,New York Post,731 license plates containing same ethnic slur recalled,https://nypost.com/2018/11/28/731-license-plates-containing-same-ethnic-slur-recalled/,True,False
20181128,New York Post,EU countries say Google has tricked customers into carrying tracking devices,https://nypost.com/2018/11/28/eu-countries-say-google-has-tricked-customers-into-carrying-tracking-devices/,True,Google
20221024,New York Post,Caught on camera Photos show brazen $4M heist at NYC Diamond District jewelry store,https://nypost.com/2022/10/24/feds-seek-up-to-14-years-in-prison-for-diamond-district-stickup-man/,True,New York Post
20130531,New York Post,New photo shows Oscar Pistorius' bloody bathroom after model girlfriend fatally shot,http://www.nypost.com/p/news/international/fatally_photos_show_oscar_pistorius_azIRBdEljC5CMpcMl8BLrJ,True,False
20130531,New York Post,One dead after NJ plane crash,http://www.nypost.com/p/news/local/one_dead_after_nj_plane_crash_eYk56Jz2Nsom3oXbHXQskN,True,False
20170110,New York Post,FBI chief says hackers breached old RNC records         :0,http://nypost.com/2017/01/10/fbi-chief-says-hackers-breached-old-rnc-records/,True,RNC
20150226,New York Post,"ISIS ransacks museum, destroys 2,000-year-old artifacts",http://nypost.com/2015/02/26/isis-destroys-ancient-iraqi-artifacts/,True,False
