Date,Publication,Headline,URL,BreachMentioned,CompanyMentioned
20180504,New York Post,Facebook weighs ad-free subscription service after data scandal,https://nypost.com/2018/05/04/facebook-weighs-ad-free-subscription-service-after-data-scandal/,True,Facebook
20160626,New York Post,Hillary camp admits Brexit vote is a speed bump         :0,http://nypost.com/2016/06/26/hillary-camp-admits-brexit-vote-is-a-speed-bump/,True,False
20160626,New York Post,Clinton claims Trump wants to profit from Brexit         :0,http://nypost.com/2016/06/26/clinton-claims-trump-wants-to-profit-from-brexit/,True,False
20110304,New York Post,Diamond District jewelers found guilty in 'Snatch' heist,http://www.nypost.com/p/news/local/manhattan/diamond_district_jewelers_found_qJkBqVkKsa73c1TyeDcpiO,True,Diamond District jewelers
20160627,New York Post,Teacher slams school after her online sex chat was hacked         :0,http://nypost.com/2016/06/27/teacher-slams-school-after-her-online-sex-chat-spread-in-building/,True,False
20160627,New York Post,How America should answer the Brexit vote         :0,http://nypost.com/2016/06/26/how-america-should-answer-the-brexit-vote/,True,False
20140821,New York Post,Bank of America to pay record $17B to end mortgage probes,http://nypost.com/2014/08/21/bank-of-america-to-pay-record-17b-to-end-mortgage-probes/,True,Bank of America
20140821,New York Post,Twitter taking down graphic beheading images,http://nypost.com/2014/08/21/twitter-taking-down-graphic-beheading-images/,True,Twitter
20121130,New York Post,Hostess brass get fat as 18K workers lose jobs,http://www.nypost.com/p/news/business/box_of_ding_dongs_gnlQYD6r9U5ZDHFwhqf3XP,True,Hostess
20220405,New York Post,Channing Tatum's 'Magic Mike 3' combats 'horny' fan security breach,https://nypost.com/2022/04/05/channing-tatums-magic-mike-3-combats-horny-fan-security-breach/,True,Channing Tatum
20160628,New York Post,Wall Street rebounds after two-day Brexit beating         :0,http://nypost.com/2016/06/28/wall-street-rebounds-after-two-day-brexit-beating/,True,False
20160628,New York Post,Volkswagen to pay nearly $15B in US's largest auto settlement         :0,http://nypost.com/2016/06/28/volkswagen-to-pay-nearly-15b-in-uss-largest-auto-settlement/,True,Volkswagen
20160628,New York Post,Rich Lowry  What Brexit-bashing elites don't get about democracy         :0,http://nypost.com/2016/06/27/what-brexit-bashing-elites-dont-get-about-democracy/,True,False
20121201,New York Post,"Chiefs LB fatally shoots girlfriend, kills self in front of coach & GM",http://www.nypost.com/p/sports/more_sports/chiefs_player_involved_in_two_shootings_RiU4ibBwHFQKnivRQxTgLP,True,False
20121201,New York Post,"Biz deal ends with pair kidnapping 'partner,' forcing him to go on Apple store spending spree: cops",http://www.nypost.com/p/news/local/manhattan/store_deals_spree_with_pair_kidnapping_vrFArC7oIgoQUmTaQHDd9L,True,Apple
20220406,New York Post,Brutal video Ukrainian forces filmed shooting dead wounded Russian soldier,https://nypost.com/2022/04/06/ukrainian-forces-caught-on-video-shooting-dead-wounded-russian-soldier/,True,False
20180507,New York Post,Apple confirms there's a serious problem with the iPhone X,https://nypost.com/2018/05/07/apple-confirms-theres-a-serious-problem-with-the-iphone-x/,True,Apple
20160629,New York Post,exclusive   Bloomberg admits data has been missing from e-mails for years         :0,http://nypost.com/2016/06/29/bloomberg-admits-data-has-been-missing-from-e-mails-for-years/,True,Bloomberg
20160629,New York Post,"One government agency was hit by 1,370 cyberattacks in 2014 alone         :0",http://nypost.com/2016/06/29/one-government-agency-was-hit-by-1370-cyberattacks-in-2014-alone/,True,Government
20160629,New York Post,exclusive   Brexit derails Lionsgate-Starz merger         :0,http://nypost.com/2016/06/28/brexit-derails-lionsgate-starz-merger/,True,Lionsgate-Starz
20200506,New York Post,Private employers axed 20.2 million Americans in April,https://nypost.com/2020/05/06/us-private-employers-laid-off-20-2-million-americans-in-april-and-march-data-is-worse-than-thought/,True,False
20110307,New York Post,"Hackers target French Finance Ministry, G-20 plans",http://www.nypost.com/p/news/international/hackers_target_french_finance_ministry_8OFLyD5f1V318EYzlhwOBN,True,False
20140823,New York Post,Kleiner Perkins discloses robbery at California headquarters,http://nypost.com/2014/08/22/kleiner-perkins-discloses-robbery-at-california-headquarters/,True,Kleiner Perkins
20220407,New York Post,Apple warns 'huge AirPods security flaw' could leak your private info,https://nypost.com/2022/04/07/why-your-apple-airpods-could-be-leaking-your-private-info/,True,Apple
20180508,New York Post,Stormy's lawyer: Cohen was paid $500K by Russians with ties to Putin,https://nypost.com/2018/05/08/stormys-lawyer-cohen-was-paid-500k-by-russians-with-ties-to-putin/,True,Cohen
20200507,New York Post,China gave Europe coronavirus supplies in exchange for praise,https://nypost.com/2020/05/07/china-gave-europe-coronavirus-supplies-in-exchange-for-praise/,True,China
20140824,New York Post,Day care worker killed toddler while trying to ‘toughen him up': sources,http://nypost.com/2014/08/24/day-care-worker-killed-toddler-while-trying-to-toughen-him-up-sources/,True,False
20180509,New York Post,Teen faces charges after recording student sex in school bathroom,https://nypost.com/2018/05/09/teen-faces-charges-after-recording-student-sex-in-school-bathroom/,True,False
20160701,New York Post,Union strikes at Atlantic City's Trump Taj Mahal         :0,http://nypost.com/2016/07/01/union-strikes-at-atlantic-citys-trump-taj-mahal/,True,Trump
20200508,New York Post,"NYC man sold stolen coronavirus test kits for up to $200, feds say",https://nypost.com/2020/05/08/queens-man-sold-stolen-covid-19-test-kits-for-up-to-200-feds/,True,False
20140825,New York Post,"PlayStation Network back online after cyber attack, bomb scare",http://nypost.com/2014/08/25/playstation-network-back-online-after-cyber-attack-bomb-scare/,True,Sony
20121204,New York Post,‘Perv’ teacher bust,http://www.nypost.com/p/news/local/brooklyn/perv_teacher_bust_s1sqcvYt2cLAgkxhpd9U8O,True,False
20180510,New York Post,Equifax now says some passport info was stolen in breach,https://nypost.com/2018/05/10/equifax-now-says-some-passport-info-was-stolen-in-breach/,Yes,Equifax
20180510,New York Post,"New Facebook Messenger bug installs itself, steals your passwords",https://nypost.com/2018/05/10/new-facebook-messenger-bug-installs-itself-steals-your-password/,True,Facebook
20160702,New York Post,Obama backtracks on trade warning after Brexit vote         :0,http://nypost.com/2016/07/02/obama-backtracks-on-trade-warning-after-brexit-vote/,True,False
20110310,New York Post,Rocker Pete Doherty questioned in German record-store break-in,http://www.nypost.com/p/news/international/rocker_pete_doherty_questioned_in_OLqVQjcqtMr53XM1IoNCqK,True,Pete Doherty
20200509,New York Post,New video emerges of the minutes before Ahmaud Arbery's shooting death,https://nypost.com/2020/05/09/ahmaud-arbery-new-video-emerges-of-moments-before-shooting/,True,False
20180511,New York Post,Family dead in Australia's worst mass shooting in two decades,https://nypost.com/2018/05/11/family-dead-in-australias-worst-mass-shooting-in-two-decades/,True,False
20160703,New York Post,on the money                  Claire Atkinson  Wacky factoid connects Brexit fallout to Dow's worst day         :0,http://nypost.com/2016/07/02/wacky-factoid-connects-brexit-fallout-to-dows-worst-day/,True,False
20220411,New York Post,Google warns this phone hack can take control of your bank account in seconds,https://nypost.com/2022/04/11/google-warns-this-phone-hack-can-take-control-of-your-bank-account-in-seconds/,True,Google
20160704,New York Post,London real estate market may be attractive after Brexit         :0,http://nypost.com/2016/07/04/london-real-estate-market-may-be-attractive-after-brexit/,True,False
20200511,New York Post,"Hacking technique makes millions of devices vulnerable, research finds",https://nypost.com/2020/05/11/hacking-technique-makes-millions-of-devices-vulnerable/,True,False
20200511,New York Post,ESPN leaks MLB All-Star's phone number in 'massive screw up',https://nypost.com/2020/05/10/espn-leaks-trevor-bauers-phone-number-on-tv-in-massive-screw-up/,True,ESPN
20220412,New York Post,Ferrero warns Americans to throw out certain Kinder chocolate products,https://nypost.com/2022/04/12/some-kinder-chocolate-in-us-may-be-tied-to-factory-with-salmonella-ferrero-warns/,True,Ferrero
20140828,New York Post,"JPMorgan, four unnamed US banks hit in hack attack",http://nypost.com/2014/08/28/jpmorgan-four-unnamed-us-banks-hit-in-super-hack-attack/,True,"JPMorgan, four unnamed US banks"
20140828,New York Post,JPMorgan working with investigators after cyber attack,http://nypost.com/2014/08/28/jpmorgan-working-with-investigators-after-cyber-attack/,True,JPMorgan
20160705,New York Post,New Ashley Madison CEO 'profoundly sorry' for hack exposing cheaters         :0,http://nypost.com/2016/07/05/new-ashley-madison-ceo-profoundly-sorry-for-hack-exposing-cheaters/,True,Ashley Madison
20200512,New York Post,Over 100 inmates rearrested after their coronavirus release,https://nypost.com/2020/05/12/over-100-inmates-rearrested-after-their-coronavirus-release/,True,False
20121207,New York Post,Secret Service under investigation after agency employees' personal info left on DC Metro train,http://www.nypost.com/p/news/national/secret_service_under_investigation_UEJl1wIKhSLpXaXF2CltzM,True,False
20220413,New York Post,"3 dead, at least 13 wounded in series of NYC shootings",https://nypost.com/2022/04/13/nyc-shootings-leaves-at-least-two-dead-13-wounded/,True,False
20220413,New York Post,Retired nurse loses $43K life savings on bitcoin scam: 'This is organized crime',https://nypost.com/2022/04/13/retired-nurse-loses-43000-life-savings-on-bitcoin-scam/,True,False
20220413,New York Post,Shocking video shows suspect allegedly en route to Brooklyn subway shooting,https://nypost.com/2022/04/13/video-shows-suspect-en-route-to-brooklyn-subway-shooting/,True,False
20110314,New York Post,Man charged with murder in NYPD officer’s death,http://www.nypost.com/p/news/local/man_charged_with_murder_in_nypd_DdQJWVHwkznddzpLmnKWqL,True,False
20180514,New York Post,"Teen hacks school to change grades, charged with 14 felonies",https://nypost.com/2018/05/14/teens-hacks-school-to-change-grades-charged-with-14-felonies/,True,False
20121208,New York Post,WATCH: Police release videos from Chiefs LB Belcher's murder-suicide,http://www.nypost.com/p/news/national/police_release_videos_from_before_SAO9lcwAiIBMqINJBP1qoN,True,False
20140830,New York Post,Female coaches at Catholic school ‘had sex with students for years’,http://nypost.com/2014/08/30/female-coaches-at-catholic-school-had-sex-with-students-for-years/,True,False
20110315,New York Post,Break-in at Madonna's,http://www.nypost.com/p/news/international/break_in_at_madonna_ENKd4aoTN4EJBXGLAIGSsK,True,Madonna
20180515,New York Post,Robinson Cano hit with 80-game drug ban in MLB stunner,https://nypost.com/2018/05/15/robinson-cano-suspended-for-peds-in-baseball-stunner/,True,Robinson Cano
20160707,New York Post,Woman records horrific scene after boyfriend is fatally shot by police         :0,http://nypost.com/2016/07/07/woman-live-streams-bloody-aftermath-of-police-involved-shooting/,True,False
20180515,New York Post,Data collected by Cambridge Analytica was available for years,https://nypost.com/2018/05/15/data-collected-by-cambridge-analytica-was-available-for-years/,True,Cambridge Analytica
20160707,New York Post,Original Paleo diet included eating other people         :0,http://nypost.com/2016/07/07/original-paleo-diet-included-eating-other-people/,True,False
20160707,New York Post,How to find out if your Android phone has been infected with HummingBad malware         :0,http://nypost.com/2016/07/07/how-to-find-out-if-your-android-phone-has-been-infected-with-hummingbad-malware/,True,False
20220415,New York Post,Two Yankees players in jeopardy vs. Blue Jays over COVID vaccine status,https://nypost.com/2022/04/15/two-yankees-players-unvaccinated-as-blue-jays-games-approach/,True,Yankees
20220415,New York Post,"Russia on verge of default after making payments in rubles, Moody's warns",https://nypost.com/2022/04/15/russia-on-verge-of-default-after-making-payments-in-rubles-moodys-warns/,True,Russia
20180516,New York Post,Facebook disabled 1.3B fake accounts in 6 months,https://nypost.com/2018/05/16/facebook-disabled-1-3b-fake-accounts-in-6-months/,True,Facebook
20110316,New York Post,Five killed in plane crash at California airport,http://www.nypost.com/p/news/national/two_killed_in_plane_crash_at_long_C7zkE5kv3ogeHNe9y9FVtL,True,False
20160708,New York Post,Video surfaces of NYPD cop’s road-rage shooting,http://nypost.com/2016/07/08/video-surfaces-of-nypd-cops-road-rage-shooting/,True,False
20160708,New York Post,"Dallas sniper identified, wanted to 'kill whites'         :0",http://nypost.com/2016/07/08/cops-used-robot-bomb-to-kill-dallas-sniper-suspect-said-he-wanted-to-kill-whites/,True,False
20160708,New York Post,Mother wounded while shielding son during Dallas sniper attack         :0,http://nypost.com/2016/07/08/mother-wounded-while-shielding-son-during-dallas-sniper-attack/,True,False
20160708,New York Post,Suspect collared for cold-case double murder in Flatiron         :0,http://nypost.com/2016/07/08/suspect-collared-for-cold-case-double-murder-in-flatiron/,True,False
20180517,New York Post,Manafort's former son-in-law agrees to plea deal with feds,https://nypost.com/2018/05/17/manaforts-former-son-in-law-agrees-to-plea-deal-with-feds/,True,Manafort
20110317,New York Post,MTA inspector accused of falsifying crucial safety record vows to beat records,http://www.nypost.com/p/news/local/mta_inspector_accused_beat_falsifying_4rgizwtuOS3UoCXW0sQ0pM,True,MTA
20160709,New York Post,"Dallas cop-killer ranted about racism, followed extremists online         :0",http://nypost.com/2016/07/08/dallas-cop-killer-ranted-about-racism-followed-extremists-online/,True,False
20220417,New York Post,"Thief using social media scam to steal PlayStations, NYPD says",https://nypost.com/2022/04/17/nypd-seek-thief-using-social-media-scam-to-steal-playstations/,True,PlayStation
20110318,New York Post,"Trustee in new papers says $54M loan shows tight ties between Mets, Madoff",http://www.nypost.com/p/news/local/trustee_cites_interest_free_madoff_mRpkEajCGsNyhBgfXd7IrM,True,Mets
20180518,New York Post,Website flaw exposed real-time locations of US cellphones,https://nypost.com/2018/05/18/website-flaw-exposed-real-time-locations-of-us-cellphones/,True,False
20180518,New York Post,Cambridge Analytica files for bankruptcy after data scandal,https://nypost.com/2018/05/18/cambridge-analytica-files-for-bankruptcy-after-data-scandal/,True,Cambridge Analytica
20160710,New York Post,Cop likely to face charges in 'damning' road-rage slay video         :0,http://nypost.com/2016/07/09/cop-in-damning-video-likely-to-face-charges-for-road-rage-slay/,True,False
20140902,New York Post,ISIS released beheading video by accident,http://nypost.com/2014/09/02/isis-released-beheading-video-by-accident/,True,False
20140902,New York Post,US journalist Steven Sotloff executed by ISIS,http://nypost.com/2014/09/02/isis-video-appears-to-show-beheading-of-us-reporter-steven-sotloff/,True,False
20200517,New York Post,Utah cop showed off explicit photos of sextortion victim who was later murdered,https://nypost.com/2020/05/17/utah-cop-showed-off-explicit-photos-of-sextortion-victim-who-was-later-killed/,True,False
20140902,New York Post,Airbnb under fire for ‘secret’ plan to release users’ information,http://nypost.com/2014/09/02/airbnb-under-fire-for-secret-plan-to-release-users-information/,True,Airbnb
20140902,New York Post,Apple beefs up security on ‘Find My iPhone’ after alleged hack,http://nypost.com/2014/09/02/apple-beefs-up-security-on-find-my-iphone-after-alleged-hack/,True,Apple
20180519,New York Post,Pair of teachers among victims of Santa Fe school shooting,https://nypost.com/2018/05/19/pair-of-teachers-among-victims-of-santa-fe-school-shooting/,True,False
20200518,New York Post,"California church holds service, potentially exposing 180 to coronavirus",https://nypost.com/2020/05/18/california-church-holds-service-potentially-exposing-180-to-coronavirus/,True,False
20140903,New York Post,Home Depot investigating possible credit card data breach,http://nypost.com/2014/09/02/home-depot-investigating-possible-credit-card-data-breach/,Yes,Home Depot
20160712,New York Post,Pokémon Go has 'full access' to your Google Account         :0,http://nypost.com/2016/07/12/pokemon-go-has-full-access-to-your-google-account/,True,Google
20200519,New York Post,Online church services attacked by hackers using child pornography,https://nypost.com/2020/05/18/online-church-services-attacked-by-hackers-using-child-pornography/,True,False
20140904,New York Post,Hackers break into HealthCare.gov,http://nypost.com/2014/09/04/hackers-break-into-healthcare-gov/,True,HealthCare.gov
20110321,New York Post,Smoke at Fukushima nuclear plant adds to radiation fears,http://www.nypost.com/p/news/international/workers_evacuated_reactor_fukushima_Mo25Rk3CrDyucc8uZOLFtJ,True,False
20110321,New York Post,"Cyber-peepers targeted Natalie Portman, Lindsey Vonn: report",http://www.nypost.com/p/news/national/cyberpeepers_target_natalie_portman_Ct3dcEwUSC2t9rybywSgBP,True,False
20121214,New York Post,20 kids among 27 dead after psycho opens fire in Conn.; gunman Adam Lanza targeted mom's class,http://www.nypost.com/p/news/local/potential_connecticut_school_shooting_8HMOSbP38TXwSYYsVGkYLO,True,False
20121214,New York Post,Israel's foreign minister resigns after fraud and breach of trust charges,http://www.nypost.com/p/news/international/israel_foreign_minister_resigns_iia3eiuLe2RqA0AynbqQkK,True,Israel
20160713,New York Post,ISIS confirms US killed group's top thug 'Omar the Chechen'         :0,http://nypost.com/2016/07/13/isis-confirms-us-killed-groups-top-thug-omar-the-chechen/,True,False
20121214,New York Post,‘Showboater’ Liu set to nix new hackmobile,http://www.nypost.com/p/news/local/showboater_liu_set_to_nix_new_hackmobile_OAyFoOzzcRizJkJAw7xq4I,True,Liu
20121214,New York Post,Sandy Hook Elementary School shooting,http://www.nypost.com/p/news/national/sandy_hook_elementary_school_shooting_6sVHJf0WOKTerVUMOmjOqN,True,False
20200520,New York Post,"Recording of calls between Joe Biden, ex-Ukraine president leaked",https://nypost.com/2020/05/20/joe-bidens-phone-calls-with-former-ukraine-president-poroshenko-released/,True,False
20200520,New York Post,MTA worker coronavirus death toll hits 123,https://nypost.com/2020/05/20/mta-worker-coronavirus-death-toll-hits-123/,True,False
20140905,New York Post,TWC customer data could give Comcast an unfair advantage,http://nypost.com/2014/09/05/twc-customer-data-could-give-comcast-an-unfair-advantage/,True,Comcast
20110322,New York Post,Faulty windshield heater led to United jet's cockpit fire,http://www.nypost.com/p/news/local/faulty_windshield_heater_led_to_lVmi3h03UyQVPCDtTHwcUI,True,United
20110322,New York Post,"Bomb sat at Detroit federal building for weeks, source says",http://www.nypost.com/p/news/national/bomb_sat_at_detroit_federal_building_fo56dVigqbzRu4TRBM7vUI,True,False
20121215,New York Post,"A scene of blood, horror and heroism at tragic Sandy Hook school",http://www.nypost.com/p/news/local/bullets_going_down_the_hall_3PRp8i1ykCDSsoodxfwXSI,True,False
20121215,New York Post,"SHOCKING AUDIO: Gunman's rampage took only minutes, cop radio calls reveal",http://www.nypost.com/p/news/local/shocking_audio_gunman_rampage_only_YrfuYfARgJCTf0XcY8Z2rJ,True,False
20121215,New York Post,Facebook slips on lockup end,http://www.nypost.com/p/news/business/facebook_slips_on_lockup_end_RuYeDeeCfnLXdELlXFWysN,True,Facebook
20220422,New York Post,"Best Buy recalls more than 750K air fryers over fires, melting incidents",https://nypost.com/2022/04/22/best-buy-recalls-772k-insignia-air-fryers-over-fires-melting/,True,Best Buy
20121216,New York Post,"Conn. gunman shot mother multiple times in head, killed himself as first responders arrived",http://www.nypost.com/p/news/local/conn_gunman_killed_self_when_he_EJlNKI5yHBQAdMVFKps4GJ,True,False
20121216,New York Post,NYPD gun buyback affected by Connecticut mass murders,http://www.nypost.com/p/news/local/brooklyn/horror_sparks_weapon_turn_in_iyi7LFHnUFAcIwnko5wYSL,True,False
20220423,New York Post,Behind the mask How opportunists got rich off COVID-19 pandemic by stealing our money,https://nypost.com/2022/04/23/how-opportunists-got-rich-off-covid-pandemic-by-stealing-our-money/,True,False
20110324,New York Post,Suspected reactor core breach could be a major setback in bringing Fukushima plant under control,http://www.nypost.com/p/news/international/japan_safety_officials_suspect_reactor_j3ZH8qFeKaV2XBOW98OvaM,True,False
20180524,New York Post,"Woman says Alexa recorded conversations, sent them to random contact",https://nypost.com/2018/05/24/woman-says-alexa-recorded-conversations-sent-them-to-random-contact/,True,Amazon
20200523,New York Post,How 'Baby Al Capone' pulled off a $23.8 million crypto heist,https://nypost.com/2020/05/23/baby-al-capone-ellis-pinsky-pulled-off-a-23-8-million-crypto-heist/,True,Baby Al Capone
20200523,New York Post,UN warns coronavirus pandemic may lead to spike in cyber crimes,https://nypost.com/2020/05/23/un-warns-coronavirus-pandemic-may-lead-to-spike-in-cyber-crimes/,True,False
20140908,New York Post,Reddit shuts down forum where celeb nude photos were leaked,http://nypost.com/2014/09/08/reddit-shuts-down-forum-where-celeb-nude-photos-were-leaked/,True,Reddit
20110325,New York Post,Brazilian police arrested for repeatedly shooting unarmed teenager (video),http://www.nypost.com/p/news/international/brazilian_police_arrested_for_repeatedly_R6rjzOTVRWEeBOyJ8BpAxL,True,False
20180525,New York Post,DNA links man to 1979 cold-case murder: police,https://nypost.com/2018/05/25/dna-links-man-to-1979-cold-case-murder-police/,True,False
20200524,New York Post,Wuhan lab admits to having three live strains of bat coronavirus on site,https://nypost.com/2020/05/24/wuhan-lab-admits-to-having-three-live-strains-of-bat-coronavirus/,True,Wuhan lab
20121218,New York Post,Killer’s data destruction: Adam Lanza smashed hard drive before massacre,http://www.nypost.com/p/news/national/killer_data_destruction_9IwrDg2Rz9juSCvzjBiv4N,True,False
20220425,New York Post,New video shows just before cinematographer was shot by Alec Baldwin on 'Rust' set,https://nypost.com/2022/04/25/photos-body-cam-footage-released-in-alec-baldwin-rust-probe/,True,False
20140909,New York Post,NBC producer busted for posting secret sex tapes to porn site,http://nypost.com/2014/09/09/nbc-producer-busted-for-making-sex-tape-with-unknowing-girlfriend/,True,NBC
20121219,New York Post,Email reveals list of NJ legal marijuana recipients,http://www.nypost.com/p/news/local/email_reveals_list_of_nj_legal_marijuana_jmZBHHS427jWGj0K9fIkoL,True,False
20160719,New York Post,Police officer killed in Kansas City shooting         :0,http://nypost.com/2016/07/19/police-officer-killed-in-kansas-city-shooting/,True,False
20160719,New York Post,Hackers reveal Hollywood elite's role in Democratic Party         :0,http://nypost.com/2016/07/19/hackers-reveal-hollywood-elites-roll-in-democratic-party/,True,False
20121220,New York Post,Westminster ‘breed’ing like crazy,http://www.nypost.com/p/news/local/westminster_breed_ing_like_crazy_ySoEPuO39iX0LpxUfB6SyK,True,False
20220427,New York Post,Boeing shares plunge after Q1 loss as technical problems persist,https://nypost.com/2022/04/27/boeing-shares-plunge-as-technical-problems-persist/,True,Boeing
20220427,New York Post,Bullets fly during clash on Bronx street: video,https://nypost.com/2022/04/27/bullets-fly-during-clash-on-bronx-street-video/,True,False
20110328,New York Post,Highly radioactive water leaks from Fukushima nuclear plant,http://www.nypost.com/p/news/international/highly_radioactive_water_leaks_from_3KUvHjccBndGWBpfc62txJ,True,False
20110328,New York Post,Blast at Yemen ammo factory kills more than 100,http://www.nypost.com/p/news/international/blast_at_yemen_ammo_factory_kills_l1mzlOqxduoViUzJfJAPhN,True,False
20180528,New York Post,"French Spider-Man was illegal immigrant, but not anymore",https://nypost.com/2018/05/28/french-spiderman-was-illegal-immigrant-but-not-anymore/,True,False
20180528,New York Post,Memory card of NASA camera destroyed in launch captures fiery final moments,https://nypost.com/2018/05/28/memory-card-of-nasa-camera-destroyed-in-launch-captures-fiery-final-moments/,True,NASA
20200527,New York Post,"US coronavirus death toll passes 100,000",https://nypost.com/2020/05/27/us-coronavirus-death-toll-surpasses-100000/,True,False
20140912,New York Post,2 US fighter jets crash in Pacific Ocean,http://nypost.com/2014/09/12/2-us-fighter-jets-crash-in-pacific-ocean/,True,False
20140912,New York Post,High school shooter who killed 3 is captured after prison break,http://nypost.com/2014/09/11/convicted-killer-of-3-teens-escapes-from-prison/,True,False
20200528,New York Post,AstraZeneca may expose coronavirus vaccine participants to pathogen,https://nypost.com/2020/05/28/vaccine-developer-astrazeneca-will-consider-exposing-test-participants-to-coronavirus-pathogen/,True,AstraZeneca
20220429,New York Post,ISIS ‘Beatles’ member learns fate for role in brutal beheadings of US hostages,https://nypost.com/2022/04/29/isis-beatles-member-alexanda-kotey-jailed-for-life-in-us/,True,False
