Date,Publication,Headline,URL,BreachMentioned,CompanyMentioned
20130801,New York Post,NSA leaker Edward Snowden enters Russia as 'refugee'; granted 1 year asylum,http://www.nypost.com/p/news/international/russia_leaker_edward_snowden_report_eJTjj8IAA5wrFMuhymS2YN,True,False
20210205,New York Post,Calls for Bank of America boycott grow after data given to FBI,https://nypost.com/2021/02/05/calls-for-bank-of-america-boycott-grow-after-data-given-to-fbi/,True,Bank of America
20210205,New York Post,US records deadliest day of COVID pandemic after data audit,https://nypost.com/2021/02/05/us-records-record-5077-covid-deaths-after-audit/,True,False
20091128,New York Post,"NY sex offenders purged from Facebook, MySpace",http://www.nypost.com/p/news/local/ny_sex_offenders_purged_from_facebook_oNGiF4p606orY7wuEky9tN,True,Facebook
20091128,New York Post,Alaska oil and gas spill,http://www.nypost.com/p/news/international/alaska_oil_and_gas_spill_8lrHQiQlrG6F7hraB2pNXJ,True,False
20210205,New York Post,Fraudster refuses to give up password for bitcoin wallet worth $60M,https://nypost.com/2021/02/05/fraudster-refuses-to-give-up-bitcoin-password-worth-60m/,True,False
20111121,New York Post,MF Global trustee says $1.2 billion missing,http://www.nypost.com/p/news/business/mf_global_trustee_says_billion_missing_DKzWJV99kv7gz4Becqe5oO,True,MF Global
20111121,New York Post,"American spies outed, CIA suffers in Lebanon",http://www.nypost.com/p/news/international/american_spies_outed_cia_suffers_1dynPko2BEslcQG9Mj6UsO,True,False
20150501,New York Post,"KFC franchise operator, accused of stiffing workers on overtime, to pay $375K",http://nypost.com/2015/05/01/kfc-franchise-operator-accused-of-stiffing-workers-on-overtime-to-pay-375k/,True,KFC
20170315,New York Post,Russian intelligence officers indicted in massive Yahoo hack         0:0,http://nypost.com/2017/03/15/russian-intelligence-officers-indicted-in-massive-yahoo-hack/,True,Yahoo
20111122,New York Post,Ex-fundraiser Tony Rezko sentenced to 10.5 years in corruption case,http://www.nypost.com/p/news/national/ex_fundraiser_tony_rezko_sentenced_lbnvmcD1bK7iJCtuFNVrmM,True,Tony Rezko
20150503,New York Post,‘Cop shooter’ arraigned on attempted murder as officer clings to life,http://nypost.com/2015/05/02/nypd-cop-shot-in-the-head-in-queens/,True,False
20190213,New York Post,"Apple, Google under fire for Saudi app that lets men track women",https://nypost.com/2019/02/13/apple-google-under-fire-for-saudi-app-that-lets-men-track-women/,True,"Apple, Google"
20130804,New York Post,A-Rod suspension due,http://www.nypost.com/p/sports/yankees/alex_debut_tonight_suspended_at_jEBfxPmIMcslQZWjmAZm7N,True,Alex Rodriguez
20170318,New York Post,Deported killer caught heading back into US from Mexico         0:0,http://nypost.com/2017/03/17/deported-killer-caught-heading-back-into-us-from-mexico/,True,False
20170318,New York Post,Alleged Yahoo hacker worked for Nets owner's bank         0:0,http://nypost.com/2017/03/18/alleged-yahoo-hacker-worked-for-nets-owners-bank/,True,Yahoo
20091202,New York Post,4-cop killer blown away,http://www.nypost.com/p/news/national/cop_killer_blown_away_1llgmtoQhVILIEZ5neCXWI,True,False
20111124,New York Post,Dances with debt: Sun casino forced to restructure $1.6B load,http://www.nypost.com/p/news/business/dances_with_debt_9JFPd3VfRZZwaAt4MKwW7M,True,Sun casino
20210209,New York Post,Release of Proud Boy leader charged in Capitol riot reversed hours later,https://nypost.com/2021/02/09/release-of-proud-boy-leader-charged-in-capitol-riot-reversed/,True,False
20190215,New York Post,Cops say 5 dead after shooting at Illinois manufacturing plant,https://nypost.com/2019/02/15/police-respond-to-active-shooter-at-illinois-manufacturing-plant/,True,False
20210209,New York Post,Bitcoin hits another record high after Tesla's $1.5B buy-in,https://nypost.com/2021/02/09/bitcoin-hits-another-record-high-after-teslas-1-5b-buy-in/,True,Tesla
20190215,New York Post,FTC reportedly negotiating multibillion-dollar fine for Facebook,https://nypost.com/2019/02/15/ftc-reportedly-negotiating-multibillion-dollar-fine-for-facebook/,True,Facebook
20210211,New York Post,Cuomo aide admits they hid nursing home data so feds wouldn't find out,https://nypost.com/2021/02/11/cuomo-aide-admits-they-hid-nursing-home-data-from-feds/,True,False
20210211,New York Post,Olympian hit with 7-count indictment for Capitol riot,https://nypost.com/2021/02/11/olympian-klete-keller-hit-with-7-count-indictment-for-capitol-riot/,True,False
20210211,New York Post,Zoom bombers hack New York City Council event with porn,https://nypost.com/2021/02/11/zoom-bombers-hack-new-york-city-council-event-with-porn/,True,Zoom
20111126,New York Post,Cracked-Berry,http://www.nypost.com/p/news/business/cracked_berry_pFQ8ckJ802dsRYebSw3m8M,True,Blackberry
20111126,New York Post,Filipinos nabbed in AT&T 'terror' hack attack,http://www.nypost.com/p/news/international/filipinos_nabbed_in_at_terror_hack_TKKhgdhwAMrc6YcaJb1IcP,True,AT&T
20130807,New York Post,"Male NBA cheerleader who reportedly served in Army goes on shooting spree in Dallas - 4 dead, 4 more injured, including 2 kids",http://www.nypost.com/p/news/national/police_dead_wounded_in_dallas_area_p3mLAQRwooeM99u1qYyS1J,True,False
20190218,New York Post,Illegal immigrants busted in Mexican cartel-linked drug operation in US,https://nypost.com/2019/02/18/illegal-immigrants-linked-to-mexican-cartel-arrested-in-us/,True,False
20210212,New York Post,"Irate Robinhood traders reportedly fling poop, damage statue at headquarters",https://nypost.com/2021/02/12/irate-robinhood-traders-fling-poop-damage-statue-at-hq-report/,True,Robinhood
20170322,New York Post,Nunes: Trump transition team was under surveillance         0:0,http://nypost.com/2017/03/22/nunes-trump-transition-team-was-under-surveillance/,True,Government
20170322,New York Post,WWE hoping sex leaks 'blow over' while more victims emerge         0:0,http://nypost.com/2017/03/22/wwe-hoping-sex-leaks-blow-over-while-more-victims-emerge/,True,WWE
20170322,New York Post,Hackers threaten to delete 300M Apple accounts: report         0:0,http://nypost.com/2017/03/22/hackers-threaten-to-delete-300m-apple-accounts-report/,True,Apple
20170322,New York Post,Breitbart and InfoWars are drawn into FBI's Russian bot probe         0:0,http://nypost.com/2017/03/21/feds-probe-possible-russian-link-to-alt-right-websites/,True,"Breitbart, InfoWars"
20130808,New York Post,NCAA will stop selling team apparel on its website after being exposed as 'hypocritical',http://www.nypost.com/p/hypocritical_will_stop_selling_team_1qJhUM7eof9gsRhjDfCK9O,True,NCAA
20130808,New York Post,"Music teacher allegedly offered to close school, vanish in exchange for silence of 9-year-old molestation victim",http://www.nypost.com/p/news/local/victim_teacher_allegedly_offered_nROOxBgCVZqQJRmE6iNYSJ,True,False
20190219,New York Post,Exposed Chinese database reveals scope of citizen surveillance,https://nypost.com/2019/02/19/exposed-chinese-database-reveals-scope-of-citizen-surveillance/,True,Government
20170323,New York Post,Kim Jong Un may be behind biggest bank heist in history,http://nypost.com/2017/03/22/kim-jong-un-may-be-behind-biggest-bank-heist-in-history/,True,North Korea
20170323,New York Post,'Good Morning America' and ABC News get hacked on Twitter         0:0,http://nypost.com/2017/03/23/good-morning-america-and-abc-news-get-hacked-on-twitter/,True,True
20130809,New York Post,Plane crash tragedy,http://www.nypost.com/p/news/local/tot_teens_killed_in_crash_gHSajSSsePF3Ptf6Se242H,True,False
20130809,New York Post,Facebook ‘kill’ over breakup,http://www.nypost.com/p/news/national/facebook_kill_over_breakup_c18v9oWmznvM2j3oqa0CjN,True,Facebook
20130809,New York Post,"Soldier marked a 'D' on the dead Fort Hood shooting victims, told lingering survivors 'You need to move on!'",http://www.nypost.com/p/news/national/soldier_marked_lingering_survivors_vfu0ShsPdctavE6OuB0irO,True,False
20150510,New York Post,3 arrested after shootings of 2 Mississippi police officers,http://nypost.com/2015/05/10/3-arrested-after-shootings-of-2-mississippi-police-officers/,True,False
20190221,New York Post,Florida mayor opens fire at cops as they raid his home: sheriff,https://nypost.com/2019/02/21/florida-mayor-arrested-at-home-opens-fire-at-cops-sheriff/,True,False
20111129,New York Post,Missing MF Global money potentially found in UK: report,http://www.nypost.com/p/news/business/missing_mf_global_money_potentially_ChsYzL5qgZjVnoVquh2FjL,True,MF Global
20210215,New York Post,"exclusive             Cuomo's COVID cover-up hid nearly 1,900 NYC nursing home deaths",https://nypost.com/2021/02/15/cuomos-covid-cover-up-hid-nearly-1900-nyc-nursing-home-deaths/,True,government
20150511,New York Post,George Zimmerman wounded in ‘road rage’ shooting,http://nypost.com/2015/05/11/george-zimmerman-wounded-in-shooting-during-road-rage-incident-reports/,True,False
20150511,New York Post,Lil’ Kim’s ex gets life in prison for ordering six murders,http://nypost.com/2015/05/11/lil-kims-ex-gets-life-in-prison-for-ordering-six-murders/,True,False
20190222,New York Post,Equifax expects fines from US regulators over data breach,https://nypost.com/2019/02/22/equifax-expects-fines-from-us-regulators-over-data-breach/,True,Equifax
20111130,New York Post,"Fukushima plant's No. 1 reactor was close to full meltdown, new analysis shows",http://www.nypost.com/p/news/international/fukushima_plant_was_close_to_full_jNzN61vNhkrtK6LLdnX12M,True,False
20210216,New York Post,"TikTok accused of failing to protect children's privacy, safety",https://nypost.com/2021/02/16/tiktok-accused-of-failing-to-protect-kids-privacy-safety/,True,TikTok
20190223,New York Post,Manafort 'repeatedly and brazenly violated the law',https://nypost.com/2019/02/23/manafort-repeatedly-and-brazenly-violated-the-law-mueller/,True,Government
20190223,New York Post,Comic Brody Stevens dead of apparent suicide by hanging,https://nypost.com/2019/02/23/comic-brody-stevens-dead-of-apparent-suicide-by-hanging/,True,False
20130812,New York Post,"WATCH: Mob legend John Gotti didn't want grandson to be baseball player because 'you must take steroids,' in 1998",http://www.nypost.com/p/sports/more_sports/watch_steroids_gotti_didn_want_grandson_FOO9mGMKQxBjrpqGP5U0JJ,True,False
20150513,New York Post,Amtrak train was going over 100 mph into curve before derailment,http://nypost.com/2015/05/13/more-feared-dead-in-amtrak-derailment-as-rescue-crews-search-site/,True,False
20170327,New York Post,Bill Gross reportedly gets $81M in Pimco settlement         0:0,http://nypost.com/2017/03/27/bill-gross-reportedly-gets-81m-in-pimco-settlement/,True,Pimco
20130813,New York Post,Dalai Lama's Web site hacked In 'spying attack',http://www.nypost.com/p/news/international/dalai_lama_website_hacked_in_spying_Y3woCGXuwngGvyqSRE5qeJ,True,False
20150514,New York Post,Morgan Stanley hit with $2M fine for inaccurate short positions,http://nypost.com/2015/05/13/morgan-stanley-hit-with-2m-fine-for-inaccurate-short-positions/,True,Morgan Stanley
20170328,New York Post,Woman posing as Target employee stole $40K in iPhones: cops         0:0,http://nypost.com/2017/03/28/woman-posing-as-target-employee-stole-40k-in-iphones-cops/,True,Target
20130814,New York Post,Couple pleads not guilty on charges of skimming hundreds of credit cards while employees of Pret A Manger,http://www.nypost.com/p/news/local/couple_pleads_employees_guilty_credit_IC34yEVYIMWpw6INbl5gBJ,True,Pret A Manger
20150515,New York Post,Comcast to share coveted viewer data with NBCUniversal,http://nypost.com/2015/05/14/comcast-to-share-coveted-viewer-data-with-nbcuniversal/,True,Comcast
20111203,New York Post,Vengeful Mt. Sinai doctor ruined critical research,http://www.nypost.com/p/news/local/manhattan/one_evil_breeder_1p5xoJZR8voi3RnVzH8sRM,True,False
20170329,New York Post,Plane bursts into flames during harrowing landing         0:0,http://nypost.com/2017/03/29/plane-bursts-into-flames-during-harrowing-landing/,True,False
20170329,New York Post,exclusive   'Rude Boy' wrestler busted for kiddie porn         0:0,http://nypost.com/2017/03/29/rude-boy-wrestler-busted-for-kiddie-porn/,True,False
20190227,New York Post,TikTok to pay record-breaking $5.7M fine for violating child privacy law,https://nypost.com/2019/02/27/tiktok-to-pay-record-breaking-5-7m-fine-for-violating-child-privacy-law/,True,TikTok
20210220,New York Post,"Video shows armed trio zip-tie victims, steal $40K in NYC",https://nypost.com/2021/02/20/video-shows-armed-trio-zip-tie-victims-steal-40k-in-nyc/,True,False
20130815,New York Post,Russell Simmons apologizes for posting racy Harriet Tubman sex tape parody,http://www.nypost.com/p/pagesix/russell_simmons_apologizes_parody_Dhm0xmUSobXwF0Cl7EEm8N,True,Russell Simmons
20150516,New York Post,Gun used to kill 2 Mississippi officers found,http://nypost.com/2015/05/16/gun-used-to-kill-2-mississippi-officers-found/,True,False
20130815,New York Post,Jasper Johns' assistant stole 22 works worth $6.5 million from famed artist,http://www.nypost.com/p/news/national/jasper_johns_assistant_stole_works_ryCnwY0iIUD8SHUI3YKLPJ,True,Jasper Johns
20130815,New York Post,"Washington Post hacked by Syrian Electronic Army, same group that broke into Twitter feeds of AP, BBC and Al-Jazeera English",http://www.nypost.com/p/news/national/syrian_electronic_twitter_jazeera_HMIxR6Tkt84zQwS8NeXfPJ,True,Washington Post
20130815,New York Post,"Car bomb explodes in southern Beirut – 14 killed, over 200 wounded",http://www.nypost.com/p/news/international/car_bomb_explodes_killed_southern_9FhciZUKro1wH1qclkjAMJ,True,False
20130815,New York Post,‘Breach’ of trust: Two are charged in Whale scheme,http://www.nypost.com/p/news/business/breach_of_trust_VjiwdkNDXWvS4FhUxAC0ON,True,Whale scheme
20170330,New York Post,White House officials outed as sources of Nunes surveillance reports         0:0,http://nypost.com/2017/03/30/white-house-officials-outed-as-sources-of-nunes-surveillance-reports/,True,Government
20190228,New York Post,Congress wants Google to explain how it 'forgot' about Nest mic,https://nypost.com/2019/02/28/congress-wants-google-to-explain-how-it-forgot-about-nest-mic/,True,Google
20210221,New York Post,"'Mayday, mayday': Listen to United pilot's gripping radio call after engine explosion",https://nypost.com/2021/02/21/united-airlines-pilot-calls-mayday-for-engine-failure-in-denver/,True,United Airlines
20150517,New York Post,Hacker made a plane fly sideways from his seat,http://nypost.com/2015/05/17/hacker-made-a-plane-fly-sideways-from-his-seat/,True,False
20190301,New York Post,Grounded ship leaks 80 tons of oil near Pacific UNESCO site,https://nypost.com/2019/03/01/grounded-ship-leaks-80-tons-of-oil-near-pacific-unesco-site/,True,False
20190301,New York Post,Wells Fargo in record $240 million settlement over fake accounts,https://nypost.com/2019/03/01/wells-fargo-in-record-240-million-settlement-over-fake-accounts/,True,Wells Fargo
20190302,New York Post,Ex-Giants prospect busted in huge identity theft ring,https://nypost.com/2019/03/02/ex-giants-prospect-busted-in-massive-identity-theft-ring/,True,False
20190302,New York Post,At least 50 people missing after pipeline explodes in Nigeria,https://nypost.com/2019/03/02/50-plus-people-missing-after-pipeline-explodes-in-nigeria/,True,False
20130817,New York Post,'I'm dying. I know I'm going to die.' - Rescuer recounts horror after saving woman who lost arm in Maui shark attack,http://www.nypost.com/p/news/national/dying_shark_going_woman_attack_rescuer_PfW96tqu8Tgzbmjp4ftE3J,True,False
20111206,New York Post,Mark Zuckerberg's private pictures leaked after security breached on Facebook,http://www.nypost.com/p/pagesix/mark_zuckerberg_private_pictures_yu3ArfD4jtdsVlJOP6ld5J,True,Facebook
20210223,New York Post,Major cryptocurrencies plummet as rally falters,https://nypost.com/2021/02/23/bitcoin-dogecoin-plummet-as-cryptocurrency-rally-falters/,True,False
20210223,New York Post,Chinese spyware code was copied from NSA: researchers,https://nypost.com/2021/02/22/chinese-spyware-code-was-copied-from-americas-nsa-researchers/,True,NSA
20130818,New York Post,A-Rod lawyer blasts Yankees; team prez wants Galea medical records released,http://www.nypost.com/p/sports/yankees/released_lawyer_blasts_yankees_team_vrUGrxK3xnlrxY5qXPEd9L,True,Yankees
20111207,New York Post,E-scam rocks tycoon,http://www.nypost.com/p/news/local/scam_rocks_tycoon_T1iRGsm9uzymASfmP26h1H,True,False
20190304,New York Post,City murders spike nearly 30 percent through start of 2019,https://nypost.com/2019/03/04/city-murders-spike-nearly-30-percent-through-start-of-2019/,True,False
20190304,New York Post,OxyContin maker Purdue weighs bankruptcy as it battles overdose suits,https://nypost.com/2019/03/04/oxycontin-maker-purdue-weighs-bankruptcy-as-it-battles-opioid-suit/,True,Purdue
20130819,New York Post,Oscar Pistorius indicted on murder charge in girlfriend's shooting death –witnesses report hearing a woman scream before shots were fired,http://www.nypost.com/p/news/international/oscar_pistorius_indicted_start_murder_QN4I0TE6IWEnkirg4DXczL,True,False
20210225,New York Post,Cyberpunk 2077 fix delayed due to cyberattack,https://nypost.com/2021/02/24/cd-projekt-delays-cyberpunk-2077-fix-due-to-cyberattack/,True,CD Projekt Red
20190305,New York Post,Nearly 30K pounds of beef recalled over 'extraneous materials',https://nypost.com/2019/03/05/nearly-30k-pounds-of-beef-recalled-over-extraneous-materials/,True,False
20111208,New York Post,Bank hit for lot of mule-ah,http://www.nypost.com/p/news/local/manhattan/bank_hit_for_lot_of_mule_ah_TR92KqM82qOEyUgUqiNqBI,True,Bank of America
20150521,New York Post,Lumber Liquidators plunges on CEO’s abrupt exit,http://nypost.com/2015/05/21/lumber-liquidators-plunges-on-ceos-abrupt-exit/,True,Lumber Liquidators
20170404,New York Post,Your selfie could help a thief steal your identity         0:0,http://nypost.com/2017/04/04/your-selfie-could-help-a-thief-steal-your-identity/,True,False
20130820,New York Post,"Armed thugs steal $4,500 from famed hip-hop producer Scott Storch in early AM heist",http://www.nypost.com/p/news/local/manhattan/armed_thugs_steal_scott_least_heist_xgHFwe93Nz846rMd8n9f6I,True,Scott Storch
20111209,New York Post,10 new Lindsay Lohan Playboy images leak,http://www.nypost.com/p/pagesix/new_lindsay_lohan_playboy_images_KaRgelgtdlxdiWktFalcfJ,True,False
20170405,New York Post,"Boss lets maid fall 7 stories, films the whole thing         0:0",http://nypost.com/2017/04/04/maid-plunged-7-stories-as-her-boss-filmed-the-whole-thing/,True,False
20190307,New York Post,Attentive waitress' Facebook post leads to child abuse arrests,https://nypost.com/2019/03/07/attentive-waitress-facebook-post-leads-to-child-abuse-arrests/,True,Facebook
20130821,New York Post,Bradley Manning gets 35 years for leaking US secrets,http://www.nypost.com/p/news/national/manning_gets_years_for_leaking_us_wlppWjrfn2fU00dHyKGPfI,True,False
20111210,New York Post,MF Global probe uncovers shady pre-fall trades,http://www.nypost.com/p/news/business/shady_pre_fall_trades_vBHb5Zq7O2RIPCcXV56qbK,True,MF Global
20130822,New York Post,Nasdaq halts trading over technical issue,http://www.nypost.com/p/news/business/nasdaq_halts_trading_over_technical_KZgT48YgOzsGMwuPqrbxjK,True,Nasdaq
20111211,New York Post,117 kid victims and 85 arrests in Brooklyn's Jewish community,http://www.nypost.com/p/news/local/brooklyn/orthodox_sex_abuse_scandal_Vzaqd3TbKtikUv0h6b3clI,True,False
20190309,New York Post,"Whole30 diet to blame for deadly car crash, lawsuit claims",https://nypost.com/2019/03/09/whole30-diet-to-blame-for-deadly-car-crash-in-oregon-suit/,True,False
20130823,New York Post,Man arrested at JFK for plotting to sell uranium to be shipped to Iran,http://www.nypost.com/p/news/local/man_arrested_shipped_jfk_for_plotting_Repbbxgik6Ei8lvIPkcRNO,True,False
20210302,New York Post,"Popular flea collar reportedly linked to 1,700 pet deaths",https://nypost.com/2021/03/02/popular-flea-collar-reportedly-linked-to-1700-pet-deaths/,True,False
20150526,New York Post,Clintons omit shell company from public financial files,http://nypost.com/2015/05/26/clintons-omit-shell-company-from-public-financial-files/,True,Clintons
20130824,New York Post,Gamblers sue Atlantic City casino Revel over ‘deceptive’ money-back ad promise,http://www.nypost.com/p/news/local/payback_breach_in_suit_vs_nj_casino_8lXvqcfyEe9VYMAcOJzLFK,True,Revel
20190311,New York Post,$77 million in cocaine seized in largest NJ bust in years,https://nypost.com/2019/03/11/77-million-in-cocaine-seized-in-largest-nj-bust-in-years/,True,False
20190312,New York Post,"Mom killed two, including ex-landlord, in 'very bloody scene' in front of son: DA",https://nypost.com/2019/03/12/mom-killed-two-women-including-ex-landlord-in-very-bloody-scene-in-front-of-son-da/,True,False
20190312,New York Post,Honda recalls more than 1 million cars in US,https://nypost.com/2019/03/12/honda-recalls-more-than-1-million-vehicles-in-us-over-defective-airbags/,True,Honda
20130825,New York Post,NSA bugged video and coding systems at the United Nations' HQ,http://www.nypost.com/p/news/international/nsa_bugged_video_and_coding_systems_J5oKVfoqjYSVbAwrYHqPHL,True,NSA
20130825,New York Post,22-year-old man charged with shooting toddler in the head,http://www.nypost.com/p/news/local/year_old_man_charged_with_shooting_VLPHhFe0KTzTpyKEyhP3eJ,True,False
20170410,New York Post,Russian computer programmer suspected in US election hacking arrested: report         0:0,http://nypost.com/2017/04/09/russian-computer-programmer-suspected-in-us-election-hacking-arrested-report/,True,False
20210304,New York Post,Doctors warn about delayed side effect of Moderna's COVID vaccine,https://nypost.com/2021/03/04/side-effect-of-moderna-vaccine-may-be-a-delayed-skin-rash-doctors/,True,Moderna
20190313,New York Post,NYPD cops accidentally make 'aural' sex tape with police bodycam,https://nypost.com/2019/03/13/nypd-cop-accidentally-recorded-oral-sex-with-her-boss-on-police-body-cam/,True,False
20190313,New York Post,Nxivm leader had sexual relations with underage girls: court docs,https://nypost.com/2019/03/13/nxivm-leader-had-sexual-relations-with-underage-girls-court-docs/,True,False
20130826,New York Post,Deadly new respiratory virus claims 40th victim in Saudi Arabia,http://www.nypost.com/p/news/international/deadly_new_respiratory_virus_claims_spgyxEshSH4rZaVZNJYWRN,True,False
20170411,New York Post,The way you hold your phone could get you hacked         0:0,http://nypost.com/2017/04/11/the-way-you-hold-your-phone-could-get-you-hacked/,True,False
20190314,New York Post,Feds are reportedly investigating Facebook's data deals,https://nypost.com/2019/03/14/feds-are-reportedly-investigating-facebooks-data-deals/,True,Facebook
20150529,New York Post,Sepp Blatter re-elected as head of scandal-plagued FIFA,http://nypost.com/2015/05/29/sepp-blatter-re-elected-as-head-of-scandal-plagued-fifa/,True,FIFA
20170413,New York Post,The iPhone 8 will reportedly spy on everything users do         0:0,http://nypost.com/2017/04/13/the-iphone-8-will-reportedly-spy-on-everything-users-do/,True,Apple
20210307,New York Post,Russia reportedly trying to undermine Pfizer COVID vaccine,https://nypost.com/2021/03/07/russian-intelligence-trying-to-undermine-pfizer-covid-vaccine/,True,Pfizer
20210308,New York Post,White House cites 'active threat' after hack of Microsoft email,https://nypost.com/2021/03/08/white-house-urges-action-after-hack-of-microsoft-email/,True,Microsoft
20190317,New York Post,Mosque attack livestream shows how Facebook broke society's guardrails,https://nypost.com/2019/03/16/mosque-attack-livestream-shows-how-facebook-broke-societys-guardrails/,True,False
20130829,New York Post,The big bank heist,http://www.nypost.com/p/news/business/the_big_bank_heist_kYQsFzB9MEwG9GOUhip9RJ,True,Bank of America
20150601,New York Post,Councilman’s website taken over by Japanese sex site,http://nypost.com/2015/06/01/councilmans-website-taken-over-by-japanese-sex-site/,True,False
20190318,New York Post,"DNA match leads to arrest in 1999 Alabama slaying, rape case",https://nypost.com/2019/03/18/dna-match-leads-to-arrest-in-1999-alabama-slaying-rape-case/,True,False
20210309,New York Post,People not told their COVID vaccine appointments canceled at this NYC site,https://nypost.com/2021/03/09/people-not-told-their-covid-vaccine-appointments-canceled-at-this-nyc-site/,True,False
20100106,New York Post,6 mos. for $12M gold theft,http://www.nypost.com/p/news/local/queens/mos_for_theft_l2PVOJQ2KtPiovST9H3BiM,True,False
20190319,New York Post,Deutsche Bank reportedly loaned Trump more than $2B despite red flags,https://nypost.com/2019/03/19/deutsche-bank-reportedly-loaned-trump-more-than-2b/,True,Deutsche Bank
20130831,New York Post,Snowden’s ‘Osama’ leak,http://www.nypost.com/p/news/international/snowden_osama_leak_mzszMrySBasg10IphTo4jN,True,False
20190320,New York Post,exclusive   Inside the Jeter-Cashman feud that festered for years before Stanton heist,https://nypost.com/2019/03/20/inside-the-derek-jeter-brian-cashman-feud-that-festered-for-years-before-stanton-heist/,True,Stanton
20210311,New York Post,Mom dies four days after receiving second dose of Moderna vaccine,https://nypost.com/2021/03/11/utah-mom-kassidi-kurill-dies-days-after-second-dose-of-covid-19-vaccine/,True,False
20150604,New York Post,Federal government hacked in massive data breach,http://nypost.com/2015/06/04/federal-goverment-hacked-in-massive-data-breach/,True,Government
20150605,New York Post,Giant hack may be first step in pursuit of bigger US secrets,http://nypost.com/2015/06/05/giant-hack-may-be-first-step-in-pursuit-of-bigger-us-secrets/,True,False
