Date,Publication,Headline,URL,BreachMentioned,CompanyMentioned
20191114,New York Post,Ex-NBC correspondent busted for asking 9-year-old for explicit pics,https://nypost.com/2019/11/14/ex-nbc-correspondent-bruce-hensel-arrested-for-asking-9-year-old-for-sexual-photos/,True,False
20171124,New York Post,Uber told Softbank about its massive data breach before telling the public,https://nypost.com/2017/11/24/uber-told-softbank-about-its-massive-data-breach-before-telling-the-public/,True,Uber
20211019,New York Post,I found an Amazon folder with thousands of audio recordings from my home gadgets,https://nypost.com/2021/10/19/i-found-an-amazon-folder-with-thousands-of-audio-recordings-from-my-home-gadgets/,True,Amazon
20211019,New York Post,Inside the only lab infecting humans with COVID for pay,https://nypost.com/2021/10/19/inside-the-only-facility-infecting-humans-with-covid-for-pay/,True,False
20191115,New York Post,Pornhub stars screwed after PayPal pulls out,https://nypost.com/2019/11/15/paypal-turns-off-payments-to-pornhub-models/,True,PayPal
20191115,New York Post,Bluetooth devices can be hacked due to design flaw: study,https://nypost.com/2019/11/15/bluetooth-devices-can-be-hacked-due-to-design-flaw-study/,True,False
20191115,New York Post,Hospitals hit by ransomware attacks seeing increase in heart patients' death rates,https://nypost.com/2019/11/15/hospitals-hit-by-ransomware-attacks-seeing-increase-in-heart-patients-death-rates/,True,False
20171125,New York Post,Your car's data might be worth $40K,https://nypost.com/2017/11/25/your-cars-data-might-be-worth-40k/,True,False
20100915,New York Post,"Shaq sued for computer hacking, framing former employee",http://www.nypost.com/p/news/national/shaq_sued_for_computer_hacking_framing_XoprV54CRPBJ1s6DHm0QiO,True,Shaq
20171126,New York Post,FBI didn’t tell US officials as Russian hackers hunted their emails,https://nypost.com/2017/11/26/fbi-didnt-tell-us-officials-as-russian-hackers-hunted-their-emails/,True,Government
20120706,New York Post,"Two children dead in apartment gas leak, mom leaves behind suicide note",http://www.nypost.com/p/news/local/bronx/two_children_dead_in_bx_gas_leak_ihsBLGguStf4W7b2bBQgqM,True,False
20191117,New York Post,Pervy clerk jailed for filming cops in precinct bathroom,https://nypost.com/2019/11/17/police-clerk-jailed-for-filming-cops-staff-in-police-department-bathroom/,True,False
20171127,New York Post,Bodycam footage shows cops shooting suicidal man,https://nypost.com/2017/11/27/bodycam-footage-shows-cops-shooting-suicidal-man/,True,False
20211022,New York Post,New Facebook whistleblower emerges with explosive claims on hate speech,https://nypost.com/2021/10/22/new-facebook-whistleblower-accuses-company-of-ignoring-hate-speech/,True,Facebook
20211022,New York Post,NHL team's troll website gets hacked: 'Hurricanes suck',https://nypost.com/2021/10/22/hurricanes-canadiens-troll-website-gets-hacked/,True,Hurricanes
20171128,New York Post,'Shame on the Giants': Eli Manning's NFL brethren are outraged,https://nypost.com/2017/11/28/eli-mannings-old-giants-backup-baffled-by-his-benching/,True,False
20191119,New York Post,MLB All-Star faces 21 new felonies after police find 'child porn' stash,https://nypost.com/2019/11/19/pirates-felipe-vazquez-faces-21-new-felonies-after-police-find-child-porn-stash/,True,False
20191119,New York Post,Watch masked bandit pry open safe in $170K Brooklyn heist,https://nypost.com/2019/11/19/watch-masked-bandit-pry-open-safe-in-170k-brooklyn-heist/,True,Brooklyn
20191119,New York Post,Hacked Disney+ accounts sold for cheap on dark web,https://nypost.com/2019/11/19/thousands-of-hacked-disney-accounts-are-being-sold-on-dark-web/,True,Disney+
20120708,New York Post,"Olympic athletes leak Village's sex, drinking and drug secrets",http://www.nypost.com/p/news/national/most_of_the_iWUNgznLeBhhff7VI9wlSP,True,False
20191119,New York Post,North Korea nuclear test was '17 times the size' of Hiroshima,https://nypost.com/2019/11/18/north-korea-nuclear-test-was-17-times-the-size-of-hiroshima/,True,North Korea
20171129,New York Post,NYPD releases body cam footage of cops killing suspect,https://nypost.com/2017/11/29/nypd-releases-body-cam-footage-of-cops-killing-suspect/,True,False
20171129,New York Post,Billions in bitcoins have been lost or deleted,https://nypost.com/2017/11/29/billions-in-bitcoins-have-been-lost-or-deleted/,True,False
20191120,New York Post,Disney blames past hacks for user accounts sold online,https://nypost.com/2019/11/20/disney-blames-past-hacks-for-user-accounts-sold-online/,True,Disney
20191120,New York Post,Horrific video shows elephant being hacked to death by mob in Kenya,https://nypost.com/2019/11/20/horrific-video-shows-elephant-being-hacked-to-death-by-mob-in-kenya/,True,False
20100919,New York Post,Shoo! Bedbugs shut Niketown,http://www.nypost.com/p/news/local/manhattan/shoo_bedbugs_shut_niketown_Z4LCSOiZO362YvmHkCJsXN,True,Niketown
20211024,New York Post,Border breach More than 2K migrants break through Mexican city en route to US,https://nypost.com/2021/10/24/central-american-migrants-push-past-mexican-border-city-en-route-to-us/,True,False
20120709,New York Post,Bandit dressed as postal worker pulls off 2 Queens bank heists in 10 minutes,http://www.nypost.com/p/news/local/queens/bandit_pulls_off_queens_bank_heists_Daza8H1bBkxSmkTy32JyjI,True,False
20120709,New York Post,Rate-rigging scandal may swallow UK casualty,http://www.nypost.com/p/news/business/rate_rigging_scandal_may_swallow_3iewIq1W4TToIgvx3lXG2I,True,False
20211024,New York Post,Ahmaud Arbery murder trial hits snag during jury selection amid viral video,https://nypost.com/2021/10/24/ahmaud-arbery-murder-trial-hits-snag-during-jury-selection/,True,False
20171130,New York Post,Congressman won't seek re-election after nude pic leak,https://nypost.com/2017/11/30/congressman-wont-seek-re-election-after-nude-pic-leak/,True,False
20171130,New York Post,Forever 21 bathroom videos ended up on porn sites: lawsuit,https://nypost.com/2017/11/30/forever-21-bathroom-videos-ended-up-on-porn-site-lawsuit/,True,Forever 21
20140327,New York Post,Teen wins $70K after school accesses her Facebook,http://nypost.com/2014/03/27/teen-wins-70k-after-school-takes-facebook-password/,True,Facebook
20140327,New York Post,Key data on lost jet’s black box may have been erased,http://nypost.com/2014/03/26/critical-data-on-missing-jets-black-box-may-have-been-erased/,True,False
20191121,New York Post,"Nearly 700K Jeep, Dodge SUVs recalled",https://nypost.com/2019/11/21/nearly-700000-jeep-dodge-suvs-recalled-over-electrical-issues/,True,"Jeep, Dodge"
20191121,New York Post,SpaceX's Starship prototype blows up during testing,https://nypost.com/2019/11/21/spacexs-starship-prototype-blows-up-during-testing/,True,SpaceX
20120710,New York Post,Doping bans for 3 Lance teammates,http://www.nypost.com/p/news/national/doping_bans_for_lance_teammates_Ef78bHHkJUj1icVbiFH7TL,True,Lance teammates
20171201,New York Post,Ex-NSA employee pleads guilty to taking classified info home,https://nypost.com/2017/12/01/ex-nsa-employee-pleads-guilty-to-taking-classified-info-home/,True,False
20171201,New York Post,Video shows punks robbing car salesman at gunpoint,https://nypost.com/2017/12/01/video-shows-punks-robbing-car-salesman-at-gunpoint/,True,False
20171201,New York Post,exclusive                   Mass firings at top digital currency investment bank,https://nypost.com/2017/12/01/mass-firings-at-top-digital-currency-investment-bank/,True,True
20191122,New York Post,Tony Robbins accused of sexually assaulting teen at summer camp,https://nypost.com/2019/11/22/tony-robbins-accused-of-sexually-assaulting-teen-at-summer-camp-in-1985/,True,False
20160121,New York Post,Sicko ex-cop gets 263 years for raping black women while on his beat         :0,http://nypost.com/2016/01/21/sicko-ex-cop-gets-263-years-for-raping-black-women-while-on-his-beat/,True,False
20160121,New York Post,"Horrifying video catches Petco supplier gassing, freezing pets         :0",http://nypost.com/2016/01/21/horrifying-video-catches-petco-supplier-gassing-freezing-pets/,True,Petco
20100921,New York Post,Man admits role in NJ schoolyard slayings,http://www.nypost.com/p/news/local/man_admits_role_in_nj_schoolyard_j0n77Vyf2monHHDJODrxrI,True,False
20211026,New York Post,TikTok star 'bugged' daughter's tablet to catch wife and friend together before alleged killings,https://nypost.com/2021/10/26/tiktoks-ali-abulaban-bugged-ipad-before-alleged-murders/,True,TikTok
20171202,New York Post,Two more arrests made in brutal MS-13 decapitation murder,https://nypost.com/2017/12/01/two-more-arrests-made-in-brutal-ms-13-decapitation-murder/,True,False
20100922,New York Post,"NYC pension information online, except for cops, firefighters",http://www.nypost.com/p/news/local/nyc_pension_information_online_except_WTuMoU9fyJVloxyFHGcUKJ,True,False
20140329,New York Post,Thieves’ iPhone bait and switch scam,http://nypost.com/2014/03/29/thieves-iphone-bait-and-switch-scam/,True,False
20120712,New York Post,"Trayvon Martin shooter George Zimmerman had cuts on head minutes after altercation, new documents reveal",http://www.nypost.com/p/news/national/documents_from_trayvon_martin_case_PjYavZahwYa8Va6r1umLyM,True,False
20120712,New York Post,"Yahoo confirms theft of 450,000 users' passwords",http://www.nypost.com/p/news/business/yahoo_investigating_reported_mass_5ClwaaR38hJmpRd7J63pPN,True,Yahoo
20211028,New York Post,Subway manager accused of stiffing workers out of $38M will leave company,https://nypost.com/2021/10/28/subway-manager-accused-of-stiffing-workers-out-of-38m-will-leave-company/,True,Subway
20191125,New York Post,exclusive   How the NYPD's fingerprint database got shut down by a computer virus,https://nypost.com/2019/11/24/how-the-nypds-fingerprint-database-got-shut-down-by-a-computer-virus/,True,False
20191125,New York Post,Uber loses license to operate in London,https://nypost.com/2019/11/25/uber-loses-london-license-over-safety-concerns/,True,Uber
20171204,New York Post,Golden Krust calls CEO's suicide a 'devastating loss' in note to workers,https://nypost.com/2017/12/04/golden-krust-calls-ceos-suicide-a-devastating-loss-in-note-to-workers/,True,Golden Krust
20100924,New York Post,More Madoff possessions headed for auction block,http://www.nypost.com/p/news/local/more_madoff_possessions_headed_for_Ant3WCzXa2q3YyJeIFriyH,True,Madoff
20160124,New York Post,exclusive   Hillary's team copied intel off top-secret server to email         :0,http://nypost.com/2016/01/24/hillarys-team-copied-intel-off-top-secret-server-to-email/,True,Hillary's team
20140331,New York Post,NSA infiltrated RSA security more deeply than thought,http://nypost.com/2014/03/31/nsa-infiltrated-rsa-security-more-deeply-than-thought/,True,RSA Security
20211029,New York Post,Disturbing video,https://nypost.com/2021/10/29/shocking-video-shows-nanny-force-feeding-2-year-old-boy/,True,False
20171205,New York Post,"Outbreak of vomiting, diarrhea strikes cruise ship passengers",https://nypost.com/2017/12/05/outbreak-of-vomiting-diarrhea-strikes-cruise-ship-passengers/,True,False
20120714,New York Post,JPMorgan traders may have tried to hide bad bets,http://www.nypost.com/p/news/business/london_hustle_GSrrdI2DO0kPTVD3Y4HvlO,True,JPMorgan
20171205,New York Post,"Mueller subpoenas Deutsche Bank for records on Trump, family",https://nypost.com/2017/12/05/mueller-subpoenas-deutsche-bank-for-records-on-trump-family/,True,Deutsche Bank
20171206,New York Post,Robber in high-end watch heist may have hit up another store,https://nypost.com/2017/12/06/robber-in-high-end-watch-heist-may-have-knocked-up-another-store/,True,false
20140402,New York Post,Deliveryman slain execution-style after being lured to dead end,http://nypost.com/2014/04/02/delivery-man-killed-execution-style-after-lured-to-dead-end-street/,True,False
20100927,New York Post,"NYC hospital: Info on 6,800 patients leaked online",http://www.nypost.com/p/news/local/nyc_hospital_info_on_patients_leaked_nOzrVpvb3ARnnnPq7JOaLJ,True,NYC hospital
20100927,New York Post,Thirteen drown in US Navy rescue in Gulf of Aden,http://www.nypost.com/p/news/international/thirteen_drown_in_us_navy_rescue_zqWFYHR4QRFwzahxoEGi6K,True,False
20171207,New York Post,Hackers steal $70M in bitcoins as price briefly hits $19K,https://nypost.com/2017/12/07/hackers-steal-70m-in-bitcoins-as-price-briefly-hits-19k/,True,False
20191129,New York Post,Steve Wynn will pay $20M to settle investor claims over sex scandals,https://nypost.com/2019/11/29/steve-wynn-will-pay-20m-to-settle-investor-claims-over-sex-scandals/,True,Steve Wynn
20100928,New York Post,Another Ramsay TV chef suicide,http://www.nypost.com/p/news/local/nd_gordon_goner_M7FpAxXd0NYvNRLknrHEhJ,True,Gordon Ramsay
20191130,New York Post,Costco loses millions in sales from website crash,https://nypost.com/2019/11/30/costco-loses-millions-in-sales-from-website-crash/,True,Costco
20211102,New York Post,'Storm of cocaine': 920 kilos headed to NYC found stashed in lawn equipment,https://nypost.com/2021/11/02/920-kilos-of-cocaine-headed-for-nyc-seized-dea-says/,True,False
20160129,New York Post,Hillary Clinton emails contained America's top secrets         :0,http://nypost.com/2016/01/29/hillary-clinton-emails-contained-americas-top-secrets/,True,Government
20171209,New York Post,Woman claims NYPD detectives discussed 'taking turns' raping her,https://nypost.com/2017/12/08/woman-claims-nypd-detectives-discussed-taking-turns-raping-her/,True,False
20120718,New York Post,Airport security scrutinized nationwide after Utah breach,http://www.nypost.com/p/news/national/nation_airport_security_scrutinized_zgafRirx2ds4uK9Ox23kBO,True,False
20211103,New York Post,"156 MPH! NFL star allegedly driving at remarkable speed, had double legal BAC before deadly crash",https://nypost.com/2021/11/03/henry-ruggs-was-driving-156-mph-before-deadly-crash-prosecutor/,True,False
20171210,New York Post,Celebrity publicist Max Clifford dies during sex crimes sentence,https://nypost.com/2017/12/10/celebrity-publicist-max-clifford-dies-during-sex-crimes-sentence/,True,False
20191202,New York Post,YouTube star PewDiePie burglarized in home invasion,https://nypost.com/2019/12/02/youtube-star-pewdiepie-and-wife-marzia-kjellberg-burglarized-in-home-invasion/,True,PewDiePie
20101001,New York Post,"Computer algorithm to blame for massive May stock crash, gov't finds",http://www.nypost.com/p/news/business/computer_algorithm_finds_blame_for_4HcmPzqxjXGF1f9PeBmI9N,True,False
20171211,New York Post,Daredevil falls to his death from 62-story building,https://nypost.com/2017/12/11/daredevil-falls-to-his-death-from-62-story-building/,True,False
20171211,New York Post,How bad guys get malware inside your smartphone,https://nypost.com/2017/12/11/how-bad-guys-get-malware-inside-your-smartphone/,True,False
20191203,New York Post,"NJ Little League ex-president, treasurer admit to stealing more than $100K",https://nypost.com/2019/12/03/nj-little-league-ex-president-treasurer-admit-to-stealing-more-than-100k/,True,False
20191203,New York Post,Dow drops 400 points after Trump says trade war could drag on,https://nypost.com/2019/12/03/dow-drops-400-points-after-trump-says-trade-war-could-drag-on/,True,False
20191203,New York Post,"FaceApp's links to Russia could make it a counterintelligence threat, FBI warns",https://nypost.com/2019/12/03/faceapps-links-to-russia-could-make-it-a-counterintelligence-threat-fbi-warns/,True,FaceApp
20120720,New York Post,'Dark Knight' shooting at Colo. theater shocks movie industry,http://www.nypost.com/p/news/national/shooting_at_colo_theater_shocks_MmTDf6px3enH8i1oD9Fi8J,True,false
20120720,New York Post,"Gunman claiming to be the 'Joker' kills 12 in Colorado theater, 70 injured",http://www.nypost.com/p/news/national/ten_killed_denver_shooting_at_dark_MC9Lk0WVbwjJyKCnsZ8DbM,True,False
20191204,New York Post,Google caught 'red-handed' using stolen lyrics: lawsuit,https://nypost.com/2019/12/04/google-caught-red-handed-using-stolen-genius-lyrics-lawsuit/,True,Google
20191204,New York Post,"Smart TVs can allow hackers into your home, bedroom: FBI",https://nypost.com/2019/12/04/smart-tvs-can-allow-hackers-into-your-home-bedroom-fbi/,True,False
20160202,New York Post,First instance of Zika transmission in US reported in Texas         :0,http://nypost.com/2016/02/02/first-instance-of-zika-transmission-in-us-reported-in-texas/,True,False
20211106,New York Post,At least 8 dead in 'mass casualty event' at Travis Scott Astroworld concert,https://nypost.com/2021/11/06/travis-scott-astroworld-festival-leaves-at-least-8-dead/,True,Travis Scott
20191205,New York Post,At least 5 people in NJ hospitalized amid romaine lettuce E. coli outbreak,https://nypost.com/2019/12/05/at-least-5-people-in-nj-hospitalized-amid-romaine-lettuce-e-coli-outbreak/,True,False
20101004,New York Post,Labor Dept. worried about jobless report leaks,http://www.nypost.com/p/news/business/labor_dept_worried_about_jobless_7F5l10dSTcVuq9eilu23eN,True,False
20101004,New York Post,'Slay witnesses' assassinated after leaving club,http://www.nypost.com/p/news/local/manhattan/gunned_into_silence_DhVbUedyKsiVySUzlex6eI,True,False
20191206,New York Post,Goldman Sachs may get $2B fine over star-studded 1MBD fraud: report,https://nypost.com/2019/12/06/goldman-sachs-may-get-2b-fine-over-star-studded-1mbd-fraud-report/,True,Goldman Sachs
20171214,New York Post,These hackers took down the internet for money and revenge,https://nypost.com/2017/12/14/these-hackers-took-down-the-internet-for-money-and-revenge/,True,False
20120723,New York Post,Minka Kelly sex tape reportedly for sale,http://www.nypost.com/p/pagesix/minka_kelly_sex_tape_reportedly_mnuPd8Yp6Prh2LtnLyMWSI,True,Minka Kelly
20101006,New York Post,Lohan sis ID hacked,http://www.nypost.com/p/news/national/lohan_sis_id_hacked_LzoubNkgIc6rOAyf5qTXMM,True,False
20140410,New York Post,Bank of America to pay $727M over credit card practices,http://nypost.com/2014/04/09/bank-of-america-to-pay-727m-over-credit-card-practices/,True,Bank of America
20140410,New York Post,Cuba investigating data leak in ZunZuneo case,http://nypost.com/2014/04/10/cuba-investigating-data-leak-in-zunzuneo-case/,True,Cuba
20140410,New York Post,What you need to know about the Heartbleed bug,http://nypost.com/2014/04/09/what-you-need-to-know-about-the-heartbleed-bug/,True,False
20191208,New York Post,"Arkansas cop 'ambushed, executed' in fatal shooting near station",https://nypost.com/2019/12/08/arkansas-cop-ambushed-executed-in-fatal-shooting-near-station/,True,False
20211109,New York Post,Disastrous TikTok egg hack leaves man with scrambled face,https://nypost.com/2021/11/09/microwave-egg-hack-backfires-destroys-mans-face/,True,False
20160205,New York Post,LinkedIn plummets 35% after disappointing forecast         :0,http://nypost.com/2016/02/05/linkedin-plummets-35-after-disappointing-forecast/,True,LinkedIn
20101007,New York Post,Pace University student shooters caught on tape (video),http://www.nypost.com/p/news/local/manhattan/pace_university_student_shooters_abygXUX98BP12HtM09B14N,True,Pace University
20101007,New York Post,Brooklyn bakery bread product recalled,http://www.nypost.com/p/news/local/brooklyn/brooklyn_bakery_bread_product_recalled_ouqtlQLiTGOCDVwYDygCXN,True,Brooklyn bakery
20101007,New York Post,"Bonkers for debt, Ben batters the buck",http://www.nypost.com/p/news/business/bonkers_for_debt_ben_batters_the_Kdn6O1yElZY7jE2xQL0gRJ,True,False
20211110,New York Post,Judge makes $68M decision in Jay-Z purfume lawusit,https://nypost.com/2021/11/10/jay-z-wont-pay-perfume-companys-68m-breach-of-contract-suit/,True,Jay-Z
20101008,New York Post,Bank of America halts foreclosures,http://www.nypost.com/p/news/national/bank_of_america_halts_foreclosures_tpKicElSHkHQrCW03kYyXJ,True,Bank of America
20101008,New York Post,Pistol shots preceded Kent St. shootings: report,http://www.nypost.com/p/news/national/pistol_shots_preceded_kent_st_shootings_V3hzovncbT7lbGNn25PnDM,True,False
20120725,New York Post,Chase $100M settlement,http://www.nypost.com/p/news/business/chase_settlement_KKcfoQJfiVEz76uvpHHPdI,True,Chase
20211111,New York Post,Court temporarily delays release of Trump's Jan. 6 records,https://nypost.com/2021/11/11/court-temporarily-delays-release-of-donald-trumps-jan-6-records/,True,Government
20101009,New York Post,A dozen girls sickened by date-rape drug spiked vodka,http://www.nypost.com/p/news/national/dozen_girls_sickened_by_date_rape_71nnHwznUh9WzRjsvUAWcL,True,False
20120726,New York Post,Bankers indicted in separate thefts from Manhattan customers,http://www.nypost.com/p/news/local/manhattan/bankers_indicted_in_separate_thefts_RQcBE098SjocuQqzz84OUO,True,True
20120726,New York Post,WATCH: Five people shot after Rucker Park basketball game ends in gunfire,http://www.nypost.com/p/news/local/manhattan/watch_gunfire_people_shot_after_HdxNrKw9a0JOSH3OISH4tL,True,False
20140413,New York Post,Shooter kills 3 at Jewish centers in Kansas,http://nypost.com/2014/04/13/shooter-kills-3-dead-at-jewish-centers-in-kansas/,True,False
20191211,New York Post,Video shows moment shooters open fire on Jersey City kosher market,https://nypost.com/2019/12/11/jersey-city-shooting-video-shows-moment-suspects-open-fire-on-kosher-market/,True,False
20211112,New York Post,Virginia pharmacy gives 112 kids wrong doses of COVID vax,https://nypost.com/2021/11/12/virginia-pharmacy-gives-112-kids-wrong-doses-of-covid-vaccine/,True,Virginia pharmacy
20211112,New York Post,"8 hurt, 2 critically, in at least 6 overnight NYC shootings",https://nypost.com/2021/11/12/overnight-nyc-shootings-leave-8-hurt-2-critically/,True,False
20191212,New York Post,Apple sees November iPhone sales plummet in China,https://nypost.com/2019/12/12/apple-sees-november-iphone-sales-plummet-in-china/,True,Apple
20191212,New York Post,Magazine subscription scammers ordered to pay over $16M,https://nypost.com/2019/12/12/magazine-subscription-scammers-ordered-to-pay-over-16m/,True,False
20101011,New York Post,NYPD Bomb Squad finds C-4 explosives at Lower East Side cemetery,http://www.nypost.com/p/news/local/manhattan/bomb_squad_checking_device_at_nd_Sdzwy2DQ2EWnW5mPHbSAaL,True,False
20101011,New York Post,Audit: $1M in errors in NY unemployment benefits,http://www.nypost.com/p/news/local/audit_in_errors_in_ny_unemployment_iP8S4XXMQcZV2eYOc85oEJ,True,False
20211113,New York Post,Suspect busted in horrific daytime Central Park rape previously arrested in Fla. assault,https://nypost.com/2021/11/13/suspect-paulie-velez-arrested-in-central-park-rape-case/,True,False
20171220,New York Post,5-year-old boy in Chicago shot twice within past year,https://nypost.com/2017/12/20/5-year-old-boy-in-chicago-shot-twice-within-past-year/,True,False
20171220,New York Post,Boy Scout leader allegedly had child porn depicting toddlers,https://nypost.com/2017/12/20/boy-scout-leader-allegedly-had-child-porn-depicting-toddlers/,True,False
20171220,New York Post,Chipotle shares tumble on report of another illness outbreak,https://nypost.com/2017/12/20/chipotle-shares-tumble-on-report-of-another-illness-outbreak/,True,Chipotle
20171220,New York Post,Russian trolls sprang into action during major events of 2016 election,https://nypost.com/2017/12/20/russian-trolls-sprung-into-action-during-major-events-of-2016-election/,True,Russia
20191213,New York Post,"Another creep hacks into family's camera, tells teen 'I see you'",https://nypost.com/2019/12/13/staten-island-creep-hacks-into-ring-security-camera-to-spy-on-teenager/,True,False
20101012,New York Post,Explosive discovery,http://www.nypost.com/p/news/local/manhattan/bomb_ingredients_in_east_village_Kg57a5UvHT06XrXb90OGrN,True,False
20171221,New York Post,'Oxy doc' prescribed opioids that killed man days later: cops,https://nypost.com/2017/12/21/oxy-doc-prescribed-opioids-that-killed-man-days-later-cops/,True,False
20171221,New York Post,US government requesting more and more user data from Facebook,https://nypost.com/2017/12/21/us-government-requesting-more-and-more-user-data-from-facebook/,True,Government
20171221,New York Post,Apple admits it's slowing down your old iPhone,https://nypost.com/2017/12/20/your-old-iphone-really-is-getting-slower/,True,Apple
20171221,New York Post,The first domino falls at 'toxic' NFL Network,https://nypost.com/2017/12/21/the-first-domino-falls-at-toxic-nfl-network/,True,NFL Network
20140416,New York Post,Bitcoin exchange Mt. Gox headed to bankruptcy,http://nypost.com/2014/04/16/bitcoin-exchange-mt-gox-headed-to-bankruptcy/,True,Mt. Gox
20101013,New York Post,44 people arrested in $100M national Medicare scheme: feds,http://www.nypost.com/p/news/local/dozens_arrested_in_nyc_la_in_medicare_K57n6TEc39i2tlsYk32r0O,True,False
20101013,New York Post,2 porn companies suspend production after adult film star tests positive for HIV: report,http://www.nypost.com/p/news/national/report_companies_suspend_production_IGcehsbxzwwLjd38mWMP0I,True,Porn companies
20171222,New York Post,Apple hit with class-action suits over slowed-down iPhones,https://nypost.com/2017/12/22/apple-hit-with-class-action-suits-over-slowed-down-iphones/,True,Apple
20191215,New York Post,Cell phone security breaches could wreak holiday havoc: study,https://nypost.com/2019/12/14/cell-phone-security-breaches-could-wreak-holiday-havoc-study/,True,False
20120730,New York Post,Colorado 'gunman' charged with 24 counts of murder,http://www.nypost.com/p/news/national/colo_gunman_charged_with_counts_0db4277lTz8VvKTApuYtDK,True,False
20101014,New York Post,CVS settles meth case for $75M,http://www.nypost.com/p/news/national/cvs_settles_meth_case_for_ZuMT36gdcz1ChWP8gH7i2J,True,CVS
20101014,New York Post,Rattner wreck,http://www.nypost.com/p/news/business/rattner_wreck_7H6M94bh0m0BZenGktLpgP,True,Rattner
