Date,Publication,Headline,URL
20120714,BBC,Latin America,http://www.bbc.co.uk/news/world/latin_america/
20141228,BBC,3 Deadliest US sniper is shot dead,http://www.bbc.co.uk/news/world-us-canada-21313208
20140329,New York Times,Vikings in London: Just Like Family,http://www.nytimes.com/2014/03/29/arts/design/vikings-in-london-glamorous-but-just-like-family.html?hpw&rref=arts
20120711,USA Today,3-D printing could remake manufacturing,http://www.usatoday.com/money/industries/manufacturing/story/2012-07-10/digital-manufacturing/56135298/1
20140506,Daily Mail,Missing fishermen are rescued 12 miles off Florida coast after clinging to capsized boat for 17 HOURS,http://www.dailymail.co.uk/news/article-2621666/Missing-fishermen-rescued-12-miles-Florida-coast-clinging-capsized-boat-17-HOURS.html
20130809,Daily Mail,Why going to bed can be BAD for back pain sufferers and they should start exercising instead,http://www.dailymail.co.uk/health/article-2388455/Why-going-bed-BAD-pain-sufferers-start-exercising-instead.html?ico=ushome^headlines
20111222,BBC,Self-healing electronics trialled,http://www.bbc.co.uk/news/technology-16291943
20121224,BBC,1: Piers Morgan faces US gun backlash,http://www.bbc.co.uk/news/entertainment-arts-20838729
20160126,FOX,Store clerk's incredible reaction after discovering homeless man is her father,http://www.foxnews.com/us/2016/01/26/clerk-discovers-homeless-man-is-her-father.html?intcmp=latestnews
20120829,Daily Mail,"The ex-partners of Honey Boo Boo's larger-than-life mom revealed A sex offender, an arsonist and a thief... are just some of Jane Shannon's exes",http://www.dailymail.co.uk/femail/article-2195277/A-sex-offender-arsonist-thief-The-ex-partners-Honey-Boo-Boos-larger-life-mom-revealed.html
20091206,New York Times,Letters: Food Stamps and the Tough Economy,http://www.nytimes.com/2009/12/06/opinion/l06food.html?hpw
20120819,CNBC,Brent Crude Oil Falls on Possibility of Reserves Release,http://www.cnbc.com/id/48697004
20160203,CNBC,Is this Europe’s most expensive classic  car?,http://www.cnbc.com/2016/02/03/is-this-ferrari-europes-most-expensive-classic-car.html
20150815,BBC,The dangers of trusting robots,http://www.bbc.com/future/story/20150812-how-to-tell-a-good-robot-from-the-bad
20120910,CNBC,Most Expensive NFL Tickets 2012,http://www.cnbc.com/id/48899958
20100329,Washington Post,A tour de force of intricate plotting,http://www.washingtonpost.com/wp-dyn/content/article/2010/03/28/AR2010032802212.html?hpid=sec-artsliving
20150309,New York Times,Two Teenagers From a Beach Town Lead Resurrection of U.S. Aerial Skiing,http://www.nytimes.com/2015/03/10/sports/skiing/two-teenagers-from-a-beach-town-lead-resurrection-of-us-aerial-skiing.html
20160701,BBC,Tennis,http://www.bbc.com/sport/tennis
20150930,Washington Post,Georgia executes Kelly Gissendaner after Supreme Court denies stay requests,https://www.washingtonpost.com/news/post-nation/wp/2015/09/29/georgia-considering-whether-the-state-will-execute-kelly-gissendaner-the-only-woman-on-its-death-row-as-pope-francis-asks-for-mercy/
20081031,The Guardian,Weiner's campaign manager quits,http://www.theguardian.com/world/2013/jul/28/anthony-weiner-campaign-manager-quits
20140701,New York Times,"Surfacing: Bees, Brews and Boutiques in Cape May, N.J.NYT Now",http://www.nytimes.com/2014/07/06/travel/bees-brews-and-boutiques-in-cape-may-nj.html
20130615,New York Post,"'You'll swear it's lobster': 'Trash' fish find way onto fine-dining menus as chefs experiment with sea slugs, tuna spines, and more",http://www.nypost.com/p/entertainment/food/menus_experiment_swear_dining_lobster_wHfXOLdnFUWvx4KzrSZPSK
20130226,BBC,Football,http://www.bbc.co.uk/sport/0/football/
20070603,CNBC,Power Lunch,http://www.cnbc.com/id/15837760
20150622,New York Times,Iraqi Families Return to Fragile Stability in Tikrit After Liberation From ISIS,http://www.nytimes.com/2015/06/23/world/middleeast/families-return-to-fragile-stability-in-iraqi-city-liberated-from-isis.html
20130401,New York Times,Ruling Sets Stage for Pension Battle in Bankrupt City,http://www.nytimes.com/2013/04/02/business/ruling-sets-stage-for-pension-battle-in-bankrupt-city.html?hpw
20091019,CNBC,LatAm Markets: All the Latest,http://www.cnbc.com/id/30032887/
20120109,CNBC,LIBOR,http://www.cnbc.com/id/43266422/
20151130,CNBC,"HotAfter-hours buzz: Mattress Firm, El Pollo Loco &  more",http://www.cnbc.com/2015/11/30/after-hours-buzz-mattress-firm-el-pollo-loco-more.html
20110330,The Guardian,Israel to release Palestinian prisoners,http://www.theguardian.com/world/2013/jul/28/israel-approves-release-palestinian-prisoners
20140520,BBC,Art: The diplomat’s secret weapon,http://www.bbc.com/culture/story/20140520-art-the-diplomats-secret-weapon
20130217,BBC,Economy,http://www.bbc.co.uk/news/2/hi/business/economy/default.stm
20100816,New York Times,Judge: Mo. Funeral Protests Ban Unconstitutional,http://www.nytimes.com/aponline/2010/08/16/us/AP-US-Funeral-Protest.html?hp
20130124,New York Post,NYPD hunts for 'killer' after fugitive escapes cops by telling them he had to use the bathroom,http://www.nypost.com/p/news/local/nypd_hunts_for_killer_after_escaping_ukq5CIGqeJL0kUNVaa4mGI
20121114,Washington Post,Michelle Singletary,http://www.washingtonpost.com/michelle-singletary/2011/02/24/ABWCMzI_page.html
20070516,The Guardian,Retirement nigh,http://www.theguardian.com/film/2013/jul/29/johnny-depp-retire-acting-soon
20120811,New York Times,More Analysis and Reaction,http://thecaucus.blogs.nytimes.com/2012/08/11/live-updates-romney-chooses-paul-ryan-as-running-mate/
20160310,FOX,Witney hub OK with sexy dance?,http://www.foxnews.com/entertainment/2016/03/10/dwts-dancer-witney-carson-says-new-husband-okay-with-sexy-dance-moves/
