Date,Publication,Headline,URL
20090305,New York Times,Cooking With Dexter: Beating Eggs,http://www.nytimes.com/2009/03/08/magazine/08food-t-000.html
20091123,New York Post,Candy showdown isn't sweet,http://www.nypost.com/p/pagesix/candy_showdown_isn_sweet_zMH17WuzTXNoYfrGbaU4vM
20120816,BBC,Wiggins takes time off to miss Tour of Denmark,http://www.bbc.co.uk/sport/0/cycling/19287670
20130315,New York Post,‘Jeopardy’ looking at Lauer as next host,http://www.nypost.com/p/entertainment/tv/jeopardy_looking_at_lauer_as_next_XuTx94RwSSe3I4tM74WMtO
20130413,New York Post,‘Kinky’ Keith,http://www.nypost.com/p/pagesix/kinky_keith_RUlfNyMsx1ieb3hU0gDj9K
20100105,The Guardian,Clinton & Obama,http://www.theguardian.com/world/2013/jul/29/hillary-clinton-obama-lunch-2016
20091215,CNBC,Citi Prices Stock Offer to Repay TARP at $3.15/Share,http://www.cnbc.com/id/34435773
20140909,CNN,Caged woman,http://www.cnn.com/2014/09/08/justice/mobile-home-captive-freed/index.html?hpt=hp_inthenews
20090202,FOX,Salazar Ditches Sale of Oil-And-Gas Leases in Utah,http://www.foxnews.com/politics/2009/02/04/salazar-ditches-sale-oil-gas-leases-utah/
20131027,BBC,"4: Get outside and go wild, kids urged",http://www.bbc.co.uk/news/education-24670232
20121205,The Guardian,Passport photos,http://www.theguardian.com/lifeandstyle/gallery/2013/jul/29/passport-photographs-celebrities-in-pictures
20110418,Washington Post,Iowa’s power,http://www.washingtonpost.com/opinions/iowa-begins-to-take-stock-of-the-gop-field/2011/04/18/AFmzej0D_story.html
20130712,USA Today,Confessed Boston Strangler’s corpse unearthed,http://www.usatoday.com/story/news/nation/2013/07/12/boston-strangler-remains-desalvo/2513931/
20141113,CNN,Could battle over immigration lead to a shutdown?,http://www.cnn.com/2014/11/13/politics/republicans-immigration-shutdown/index.html?hpt=hp_t1
20150321,Daily Mail,Man cleared of murder after 39 YEARS in jail gets just $2M payment - despite being longest-serving wrongfully convicted prisoner,http://www.dailymail.co.uk/news/article-3005581/Ricky-Jackson-receives-2million-compensation-wrongfully-imprisoned-39-years.html
20160118,BBC,Elon Musk: Bonkers but brilliant  By Rory Cellan-Jones,http://www.bbc.com/news/technology-35285321
20120525,USA Today,"Opposing view: Thoughts, not deed, punished",http://www.usatoday.com/news/opinion/story/2012-05-24/rutgers-webcam-case-prank/55195230/1
20120805,CNN,Privacy concern in the drone age,http://www.cnn.com/video/?hpt=hp_t3#/video/us/2012/08/05/thedrone-age2.cnn
20110507,Daily Mail,"My, what large teeth you have! Tiger's underwater pounce on her lunch at Six Flags",http://www.dailymail.co.uk/news/article-1384616/My-large-teeth-Akasha-swimming-tiger-enjoys-underwater-lunch-Six-Flags-Discovery-Kingdom.html
20080519,Washington Post,FDA Stresses Birth Defects With Two Drugs,http://www.washingtonpost.com/wp-dyn/content/article/2008/05/16/AR2008051602073.html?hpid=sec-health
20070324,New York Times,"Theater Review: Stagestruck Sleuth, Crazy for Clues and Cues",http://theater2.nytimes.com/2007/03/23/theater/reviews/23curt.html
20150525,New York Post,Inside the bizarre life of an Upper East Side housewife,http://nypost.com/2015/05/24/inside-the-bizarre-life-of-an-upper-east-side-housewife/
20140419,The Guardian,We've compiled a list of the most-viewed pieces of content since 2010,http://www.theguardian.com/news/datablog/2014/apr/17/the-guardians-top-100-which-articles-have-been-most-popular
20120722,New York Times,"Stymied at U.N., U.S. Refines Plan to Remove Assad",http://www.nytimes.com/2012/07/22/world/middleeast/us-to-focus-on-forcibly-toppling-syrian-government.html?hp
20090104,Washington Post,Essay Prize Earns Parade Seats for D.C. Kids,http://www.washingtonpost.com/wp-dyn/content/article/2009/01/03/AR2009010301743.html?hpid=sec-education
20130515,The Guardian,Chris Kelly's film about Vietnamese rubber firms,http://www.guardian.co.uk/world/video/2013/may/13/western-banks-financing-land-grabs-video
20081120,Daily Mail,The long farm of the law: Police force unveils its latest weapon against crime - a John Deere TRACTOR,http://www.dailymail.co.uk/news/article-1308297/Police-force-unveils-latest-weapon-crime--John-Deere-tractor.html
20141113,BBC,Taiwan’s most gruelling cycling challenge,http://www.bbc.com/travel/feature/20140724-in-taiwan-a-quest-to-reach-sun-moon-lake
20120107,Washington Post,Why twins are multiplying,http://www.washingtonpost.com/blogs/on-parenting/post/twins-are-multiplying-raising-new-questions-for-the-nature-vs-nurture-debate/2012/01/05/gIQALYOAdP_blog.html
20100213,New York Times,Op-Art: One Week of Missed Connections,http://www.nytimes.com/interactive/2010/02/14/opinion/20100214logan.html
20130914,Daily Mail,Pictured: The horrifying moment a family's pet Siberian husky is killed by a 10ft PYTHON which slithered into their yard,http://www.dailymail.co.uk/news/article-2417574/PYTHON-killed-pet-Siberian-husky-family-reportedly-related-accused-murderer-Jose-R-Rojas.html?ico=ushome^mostread
20101016,CNBC,Symbol Lookup,http://www.cnbc.com/id/15837272
20100526,New York Post,Mike rips alien policy,http://www.nypost.com/p/news/local/mike_rips_alien_policy_qdw9MNQpCfXq0yNlkO3ykL
20140601,Daily Mail,4 comments,http://www.dailymail.co.uk/news/article-2645415/Magical-dawn-light-clouds-creates-incredible-rainbow-like-arc-ancient-Chinese-archway.html#comments
20160115,Washington Post,"2   Clinton’s lead is evaporating, and anxious Democrats see 2008 all over again",https://www.washingtonpost.com/politics/clintons-lead-is-evaporating-and-anxious-democrats-see-2008-all-over-again/2016/01/15/ebd8db3c-bacc-11e5-99f3-184bc379b12d_story.html?tid=pm_pop_b
20080314,Daily Mail,Prince Harry faces animal cruelty claim over polo pony's stab wound from his spur,http://www.dailymail.co.uk/news/article-1308528/Prince-Harry-faces-animal-cruelty-claim-polo-ponys-stab-wound-spur.html
20141101,New York Post,"Miley lands MAC deal, ELLE goes feminist and more",http://nypost.com/2014/10/30/miley-lands-mac-deal-elle-goes-feminist-and-more/
20080628,New York Times,Waistlines Expand Into a  Workplace Issue,http://www.nytimes.com/2008/06/22/jobs/22mgmt.html
20141227,USA Today,Minnesota family acquires Polaroid majority,http://www.usatoday.com/story/money/business/2014/12/27/pohlads-polaroid/20948459/
20131026,The Guardian,US official calls for 'greater focus' in surveillance,http://www.theguardian.com/world/2013/oct/25/white-house-op-ed-nsa-foreign-surveillance
20120411,Daily Mail,Tatt's not good enough for the cover then: Megan Fox's back inking is airbrushed from front of magazine Was edited off the cover,http://www.dailymail.co.uk/tvshowbiz/article-2128365/Photoshop-victim-Megan-Foxs-tattoo-airbrushed-magazine-cover-picture.html
20090615,The Guardian,Fire and blasts at propane depot in Tavares,http://www.theguardian.com/world/video/2013/jul/30/explosions-propane-plant-florida-video
20130728,BBC,Plastic fantastic,http://www.bbc.com/culture/story/20130726-strange-and-stunning-pictures
20150812,CNBC,OPEC just kicked oil into the  $30s,http://www.cnbc.com/2015/08/11/opec-just-kicked-oil-into-the-30s.html
20120830,FOX,'Jersey Shore' Canceled!,http://www.foxnews.com/entertainment/2012/08/30/mtv-announces-end-jersey-shore-after-sixth-season/
20150402,USA Today,Jeff Samardzija: Ace with no place to call home,http://www.usatoday.com/story/sports/mlb/2015/04/02/jeff-samardzija-chicago-white-sox-opening-day-free-agent/70854296/
20111114,Washington Post,Washington’s new Episcopal bishop,http://www.washingtonpost.com/local/washingtons-new-episcopal-bishop/2011/11/12/gIQA86W7FN_gallery.html
20110712,The Guardian,Just a fad?,http://www.theguardian.com/lifeandstyle/wordofmouth/2013/jul/29/artisan-food-urban-peasants-foodie-fad
20090424,Washington Post,,http://www.washingtonpost.com/wp-dyn/content/video/2008/07/07/VI2008070700889.html?hpid=specialreports
20151224,USA Today,Bristol Palin gives birth to second child,http://www.usatoday.com/story/life/people/2015/12/24/bristol-palin-gives-birth-second-child/77892440/
20090328,New York Times,"No. 3 Louisville 56, No. 2 Baylor 39: Louisville Women Gain Their First Round of 8",http://www.nytimes.com/2009/03/29/sports/ncaabasketball/29louisville.html?hpw
20121221,The Guardian,John Patterson: Only God Forgives this level of tedium,http://www.theguardian.com/film/2013/jul/29/patterson-only-god-forgives
20141210,Daily Mail,93 comments,http://www.dailymail.co.uk/news/article-2868379/Explosive-Senate-torture-report-open-floodgates-costly-lawsuits-against-United-States-Britain-allies-complicit-programme-experts-warn.html#comments
20130730,BBC,Tax charge for Bayern Munich chief,http://www.bbc.com/news/world-europe-23507750
20120820,Washington Post,PostScript: Readers respond,http://www.washingtonpost.com/blogs/post-partisan/post/postscript-todd-akin-and-legitimate-rape/2012/08/20/06ef1d86-eaf7-11e1-b811-09036bcb182b_blog.html
20140203,New York Post,US board allows gynecologists to treat more men,http://nypost.com/2014/01/31/us-board-allows-gynecologists-to-treat-more-men/
20120105,New York Post,NYC employee arrested for allegedly selling drugs in front of residential building in Queens,http://www.nypost.com/p/news/local/queens/queens_employee_arrested_for_allegedly_DxE8ISKOZcwwMwWmpl2ZVM
20140309,Daily Mail,"Yours for £200,000: Nuclear bunker built for £30 MILLION in 1990 with its own hospital, workshop commercial kitchen and BBC recording studio goes on the market",http://www.dailymail.co.uk/news/article-2575623/Yours-200-000-Nuclear-bunker-built-30-MILLION-1990-hospital-workshop-commercial-kitchen-BBC-TV-studio-goes-market.html
20080224,CNBC,MERGERS & ACQUISITIONS,http://www.cnbc.com/id/15837548/site/14081545/?site=14081545&cid=97051
20121211,FOX,"US recognizes Syria's main rebel group, Obama says",http://www.foxnews.com/world/2012/12/11/us-recognizes-syria-main-rebel-group-obama-says/
20111126,New York Post,LI 'drunk' driver crashes taking shooting victim to hospital,http://www.nypost.com/p/news/local/li_drunk_driver_crashes_taking_shooting_BTDpaysRyFqCIn7Y9aO1NI
20090214,CNBC,HOME,http://www.cnbc.com/id/15839285
20160314,The Guardian,He was a guiding light,http://www.theguardian.com/artanddesign/2016/mar/14/ed-ruscha-marcel-duchamp-retrospective-los-angeles
20150723,Daily Mail,"Cheating husband pleads guilty to burning down his in-law's house with his wife, her parents and three kids inside",http://www.dailymail.co.uk/news/article-3172637/Cheating-husband-pleads-guilty-burning-law-s-house-wife-parents-three-kids-inside.html
20111023,The Guardian,Political partners (and rivals) lunched at the White House on Monday,http://www.theguardian.com/world/2013/jul/29/hillary-clinton-obama-lunch-2016
20160609,The Guardian,Stanford     Witness who stopped sexual assault speaks out,http://www.theguardian.com/us-news/video/2016/jun/08/stanford-rape-brock-turner-witness-speaks-out-video
20120415,Washington Post,"At least 14 officers, nine civilians wounded",http://www.washingtonpost.com/world/taliban-hits-kabul-other-afghanistan-cities-in-rare-coordinated-attack/2012/04/15/gIQAWcheJT_gallery.html
20070323,CNBC,Full Story,http://www.cnbc.com/id/17595710
20131211,CNBC,Desktop computers are not dead: HP's Whitman,http://www.cnbc.com/id/101263403
20151127,The Guardian,Thanksgiving  Leftover recipes that go beyond hitting 'reheat',http://www.theguardian.com/lifeandstyle/2015/nov/27/thanksgiving-leftover-recipes
20141008,Washington Post,Publix is looking for a crisis PR agency — just in case it gets hacked,http://www.washingtonpost.com/blogs/the-switch/wp/2014/10/08/publix-is-looking-for-a-crisis-pr-agency-just-in-case-it-gets-hacked/
20100405,CNBC,Europe,http://www.cnbc.com/id/19794221/site/14081545/
20150724,New York Post,Michael Conforto’s first words as a big leaguer,http://nypost.com/2015/07/24/michael-confortos-first-words-as-a-big-leaguer/
20120722,FOX,PHOTOS: Colorado Shooting Spree,http://www.foxnews.com/us/slideshow/2012/07/20/gunman-kills-at-least-14-after-opening-fire-at-colorado-batman-opening/#slide=1
20090304,Washington Post,Repair or Replace?,http://www.washingtonpost.com/wp-dyn/content/graphic/2009/03/04/GR2009030401436.html?hpid=smartliving
20120416,Washington Post,Happy Hour Roundup,http://www.washingtonpost.com/blogs/plum-line/post/happy-hour-roundup/2012/04/16/gIQAS10HMT_blog.html
20160619,New York Post,Staten Island man bites dog         :0,http://nypost.com/2016/06/19/man-bit-his-dog-so-hard-it-needed-surgery-to-repair-chomp/
20091126,FOX,United Nations,http://www.foxnews.com/world/unitednations/index.html
20101115,Washington Post,Recent Live Q&As,http://www.washingtonpost.com/wp-dyn/content/linkset/2005/05/18/LI2005051801255.html
20150403,BBC,The faces of prostitution in Australia,http://www.bbc.com/news/blogs-trending-32165949
20140217,BBC,UK's loneliest bus stops,http://www.bbc.co.uk/news/magazine-26036885
20110326,New York Post,Queens mom celebrating birthday gunned down by boyfriend: cops,http://www.nypost.com/p/news/local/queens/queens_woman_celebrating_birthday_EeiFVgQk4xPXMUwdsg3wMJ
20130305,BBC,Mini guide to drinking in Dublin,http://www.bbc.com/travel/feature/20130226-mini-guide-to-drinking-in-dublin
20070317,CNBC,Media,http://www.cnbc.com/id/15837548/cid/97118
20130604,New York Times,That Instrument Known as the Eiffel Tower,http://www.nytimes.com/2013/06/05/arts/music/tower-music-from-eiffel-tower-by-joseph-bertolozzi.html?hpw
20121030,BBC,Market Data,http://www.bbc.co.uk/news/2/shared/fds/hi/business/market_data/overview/default.stm
20141223,New York Post,Woman who makes $6K a month off Airbnb rental ordered to stop,http://nypost.com/2014/12/23/woman-who-made-61k-off-airbnb-rental-ordered-to-stop/
20131102,New York Post,Iraqi PM visits amid human rights tragedy US refuses to recognize,http://nypost.com/2013/11/01/iraqi-pm-visits-amid-human-rights-tragedy-us-refuses-to-recognize/
20121129,BBC,Mini guide to art in Berlin,http://www.bbc.com/travel/feature/20121107-mini-guide-to-art-in-berlin
20150913,CNBC,Germany hits the brakes on flood of  migrants,http://www.cnbc.com/2015/09/13/financial-times-germany-attempts-to-stem-tide-of-migrants.html
20130624,USA Today,"‘Family Ties’ creator Gary David Goldberg dies                             ‘Family Ties’ creator Gary David Goldberg dies                     He won two Emmys and two Golden Globes during his career.He won two Emmys and two Golden Globes during his career.                              People                                                           1 hour, 24 minutes ago",http://www.usatoday.com/story/life/people/2013/06/24/family-ties-creator-gary-david-goldberg-dies/2453845/
20151021,New York Times,"Keira Knightley, Making Her Broadway Debut, Is Not Afraid of the Dark",http://www.nytimes.com/2015/10/25/theater/keira-knightley-making-her-broadway-debut-is-not-afraid-of-the-dark.html
20070227,Daily Mail,'Hey pretty girl': American woman severely burned after acid-like liquid thrown into her face by stranger faces the world,http://www.dailymail.co.uk/news/worldnews/article-1308358/American-Bethany-Storro-burned-acid-like-liquid-thrown-face.html
20160618,CNBC,Does father know best when it comes to finances?  Sometimes,http://www.cnbc.com/2016/06/17/when-it-comes-to-money-does-father-know-best.html
20101212,FOX,Live Chat on Happening Now!,http://weather.blogs.foxnews.com/2010/12/10/live-chat-on-happening-now/
20121114,Daily Mail,Rihanna's battered face featured on Chris Brown concert posters as singer targeted in anti-domestic violence campaign Contains his gig details,http://www.dailymail.co.uk/tvshowbiz/article-2232923/Rihannas-battered-face-featured-Chris-Brown-concert-posters-singer-targeted-anti-domestic-violence-campaign.html
20150926,New York Post,London’s calling — and they want Poppy Delevingne’s outfit back,http://nypost.com/2015/09/25/londons-calling-and-they-want-poppy-delevingnes-outfit-back/
20080708,CNBC,International Oil Exploration Juniors Pile into Kurdistan,http://www.cnbc.com/id/25572370
20100603,The Guardian,Conservatives bashed me for speaking out about the Zimmerman verdict,http://www.theguardian.com/commentisfree/2013/jul/29/george-zimmerman-conservative-backlash
20080418,CNBC,EARNINGS,http://www.cnbc.com/id/15839135
20120331,The Guardian,Lunchtime,http://www.theguardian.com/world/2013/jul/29/hillary-clinton-obama-lunch-2016
20130201,Daily Mail,Pictured: Chris Brown sporting cast on hand... days after 'fight' with gay rapper Frank Ocean 'over parking space at studio' Known for his temper,http://www.dailymail.co.uk/tvshowbiz/article-2272018/Chris-Brown-brawl-Police-investigate-incident-Frank-Ocean-parking-space-studio.html
20070521,The Guardian,Joanna Moorhead: Will it translate into action?,http://www.theguardian.com/commentisfree/2013/jul/29/rhetoric-pope-francis-brazil-translate-action
20160302,New York Times,"Gil Hill, Detroit Detective and ‘Beverly Hills Cop’ Actor, Dies at 84",http://www.nytimes.com/2016/03/02/arts/gil-hill-detroit-detective-and-beverly-hills-cop-actor-dies-at-84.html
20130614,BBC,Lone pilot’s bold Arctic mission,http://www.bbc.com/future/story/20130522-lone-pilots-bold-arctic-mission
20091225,Daily Mail,Stuntwoman suffers serious head injuries on Transformers 3 set,http://www.dailymail.co.uk/news/worldnews/article-1308437/Stuntwoman-suffers-head-injuries-Transformers-3-set.html
20090609,Daily Mail,Jessica Simpson clowns around to help promote her fashion line in a Macy's commercial She says she plans to use 'real' people to model the line,http://www.dailymail.co.uk/tvshowbiz/article-1308451/Jessica-Simpson-clowns-help-promote-fashion-line-Macys-commercial.html
20160109,New York Post,Jennifer Gould Keil  Britney Spears’ old NYC penthouse is on the market for $7.6M         :0,http://nypost.com/2016/01/06/britney-spears-old-nyc-penthouse-is-on-the-market-for-7-6m/
20120625,FOX,Arizona Gov. Brewer Deems Ruling a 'Victory',http://www.foxnews.com/politics/2012/06/25/brewer-supreme-court-arizona-decision-victory-for-rule-law/
20100709,The Guardian,New claims of Apple mistreatment,http://www.theguardian.com/technology/2013/jul/29/apple-investugates-claims-china-factory
20091031,New York Times,A Good Appetite: Having My Cake and Eating It Too,http://www.nytimes.com/2009/11/04/dining/04appe.html?hpw
20130907,The Guardian,Egypt attacks suspected militants,http://www.theguardian.com/world/2013/sep/07/egypt-suspected-militants-sinai
20150301,FOX,Entertainment,//web.archive.orghttp://www.foxnews.com/entertainment/
20140630,FOX,McDaniel unveils strategy to seek another runoff against Sen. Cochran,http://www.foxnews.com/politics/2014/06/30/mcdaniel-unveils-another-strategy-against-thad-cochran/
20121029,New York Times,Oxen’s Fate Is Embattled as the Abattoir Awaits,http://www.nytimes.com/2012/10/29/us/oxens-possible-slaughter-prompts-fight-in-vermont.html
20150205,New York Times,Op-Ed Contributors: What Causes Girls to Enter Puberty Early? NYT Now,http://www.nytimes.com/2015/02/05/opinion/what-causes-girls-to-enter-puberty-early.html
20070515,CNBC,"Congratulations to Jonathan Tucker for winning Trading with the Stars.  Jonathan has won $55,000 for his charity the Pegasus Fund.",http://www.cnbc.com/id/18655400
20140521,FOX,U.S.,//web.archive.orghttp://www.foxnews.com/us/
20100304,New York Times,Getting the Most Out of Twitter,http://www.nytimes.com/2010/03/04/technology/04basics.html?hpw
20140308,New York Times,Auto Regulators Dismissed Defect Tied to 13 Deaths,http://www.nytimes.com/2014/03/09/business/auto-regulators-dismissed-defect-tied-to-13-deaths.html?hpw&rref=automobiles
20160427,Daily Mail,,http://www.dailymail.co.uk/femail/article-3560938/Mumitan-shows-famous-bunny-PuiPui-Instagram.html
20150115,BBC,Two die in Belgian anti-terror raid,http://www.bbc.com/news/world-europe-30840160
20141024,New York Times,"Feeling Ebola Anxiety, From Bellevue to Brooklyn",http://www.nytimes.com/2014/10/25/nyregion/from-bellevue-hospital-center-to-brooklyn-feeling-ebola-anxiety.html
20110823,New York Post,Paint of no return,http://www.nypost.com/p/news/local/paint_of_no_return_D2krSJO0SGxYVJNX1OvQMO
20151023,The Guardian,Drunk man accused of spraying graffiti on prehistoric carvings,http://www.theguardian.com/us-news/2015/oct/23/california-drunk-man-graffiti-prehistoric-carvings-forest
20140806,FOX,FBI joins search for missing Washington girl,http://www.foxnews.com/us/2014/08/06/fbi-joins-search-for-missing-washington-state-girl/?intcmp=latestnews
20150816,Daily Mail,272 comments,http://www.dailymail.co.uk/news/article-3199978/Hackers-access-call-message-send-world-moment-German-computer-experts-just-easy-eavesdrop-smartphone.html#comments
20070126,The Guardian,Weiner faces more woe in new poll,http://www.theguardian.com/world/2013/jul/29/anthony-weiner-majority-new-yorkers-race
20160212,New York Post,Trump surges in new poll,http://nypost.com/2016/02/12/trump-surges-in-new-poll/
20160618,BBC,Talking Business: Chinese brands of tomorrow,http://www.bbc.com/news/business-36558075
20120925,New York Post,Rich Lowry,http://www.nypost.com/p/news/opinion/opedcolumnists/where_nyc_schools_lead_the_world_TTxmzBPBKqCwqWoaYOhHaM
20120602,Washington Post,Windows 8 Release Preview,http://www.washingtonpost.com/business/technology/windows-8-consumer-preview-puts-apps-front-and-center/2012/06/01/gJQAVX5r6U_story.html
20090818,Daily Mail,Lady Gaga sexes up Lady Liberty for magazine cover shoot The controversial singer wore her Poker Face and little else,http://www.dailymail.co.uk/tvshowbiz/article-1308582/Lady-Gaga-sexes-Lady-Liberty-magazine-cover-shoot.html
20131219,New York Times,Jeremy Zimmer of United Talent Agency,http://www.nytimes.com/2013/12/15/business/jeremy-zimmer-of-united-talent-agency-on-accepting-ideas.html?hp
20100112,New York Times,,http://www.nytimes.com/adx/bin/adx_click.html?type=goto&opzn&page=homepage.nytimes.com/index.html&pos=Box1&sn2=5b35dc29/56a295e7&sn1=62f6b8f6/f9f5a95&camp=NYT2010_marketingmodule_News&ad=GN-D-I-NYT-MOD-MOD-M131-ROS-0110&goto=http://www.nytimes.com/2010/01/10/magazine/10florida-t.html%3Fex=1278392400%26en=b1a4ed9a8f812af5%26ei=5087%26WT.mc_id=GN-D-I-NYT-MOD-MOD-M131-ROS-0110-PH%26WT.mc_ev=click
20141113,Daily Mail,Charlize,http://www.dailymail.co.uk/tvshowbiz/article-2833568/Hiker-calls-police-finding-Charlize-Theron-s-son-screaming-picnic-mother-Sean-Penn.html
20111019,CNBC,Special Reports,http://www.cnbc.com/id/16903222
20090329,CNN,Family abducted in Mexico,http://www.cnn.com/video/#/video/crime/2009/03/26/kaye.abducted.near.border.cnn
20150729,USA Today,Hawaii Volcanoes: Lava flows put on good shows,http://www.usatoday.com/story/travel/destinations/2015/07/27/hawaii-volcanoes-national-park-lava/29811733/
20130923,FOX,Political Grapevine,http://www.foxnews.com/on-air/special-report-bret-baier/2013/09/23/grapevine-teacher-fired-bringing-heroin-jury-duty
20160528,The Guardian,"A letter to my late husband, an alcoholic",http://www.theguardian.com/lifeandstyle/2016/may/28/letter-alcoholic-husband-alcohol-acoholics-anonymous
20130204,The Guardian,Feast tweetnight,http://www.guardian.co.uk/stage/theatreblog/2013/feb/05/feast-tweetnight-post-questions
20100203,Daily Mail,ANDREW PIERCE: Soulmates who were such easy targets for innuendo,http://www.dailymail.co.uk/news/article-1308541/COMMENTARY-Soulmates-easy-targets-innuendo.html
20160701,New York Post,,http://nypost.com/2016/07/01/ibt-media-cuts-30-staffers-plans-to-split-up-newsweek/
20100731,Daily Mail,Is the 'biased' BBC now trying to cosy up to the Coalition? Corporation boss lets slip notes for meeting at No 10,http://www.dailymail.co.uk/news/article-1308561/Is-biased-BBC-trying-cosy-Coalition-No-10-meeting.html
20120626,New York Times,Op-Ed Columnist: Captain America?,http://www.nytimes.com/2012/06/26/opinion/is-obama-setting-or-following-the-course.html?hpw
20091017,New York Post,Be the damsel in this dress,http://www.nypost.com/p/news/local/be_the_damsel_in_this_dress_IPClPkYcqI7iM9x7swqIKO
20121030,CNBC,Riskier Than Syria,http://www.cnbc.com/id/49568612/
20130627,The Guardian,Glastonbury,http://www.guardian.co.uk/music/musicblog/2013/jun/28/glastonbury-2013-arctic-monkeys-portishead-and-chic-liveblog
20110822,Washington Post,The Buzz | Date Lab: You voted. He won.,http://www.washingtonpost.com/blogs/the-buzz/post/date-labs-pick-me-project-you-picked-anthony/2011/08/22/gIQAdU5BXJ_blog.html
20130730,The Guardian,Damages paid to Belle de Jour's ex,http://www.guardian.co.uk/media/2013/jul/29/sunday-times-pays-damages-belle-de-jour
20160201,New York Post,"Zika virus is an international emergency, WHO declares         :0",http://nypost.com/2016/02/01/world-heath-organization-declares-zika-virus-an-international-emergency/
20140923,CNN,UPS shooting,http://www.cnn.com/2014/09/23/justice/alabama-ups-shooting-deaths/index.html?hpt=hp_inthenews
20110316,New York Post,Knicks ticket hike prices out some fans,http://www.nypost.com/p/sports/knicks/tix_hike_prices_out_some_fans_6LJyuuEGxfIR0hsjOkmUqK
20160110,USA Today,3 reasons not to pay off your mortgage,http://www.usatoday.com/story/money/personalfinance/2016/01/09/3-reasons-not-pay-off-your-mortgage/78303736/
20140729,BBC,Technology,http://www.bbc.com/news/technology/
20100703,CNN,"Clerk's mistake gets her $250,000",http://www.cnn.com/video/#/video/us/2010/06/30/dnt.lotto.clerk.lucky.mistake.wbns?hpt=T2
20121110,BBC,Science & Environment,http://www.bbc.co.uk/news/2/hi/science/nature/default.stm
20140818,New York Post,Nicole Gelinas,http://nypost.com/2014/08/18/glorifying-graffiti-exhibit-teaches-new-yorks-kids-an-awful-lesson/
20150508,The Guardian,Great Plains  Tornado survivors brace for another round of severe weather,http://www.theguardian.com/world/2015/may/08/oklahoma-tornado-survivors-brace-another-round-of-severe-weather
20150324,The Guardian,The X-Files to return to TV after 13-year absence,http://www.theguardian.com/tv-and-radio/2015/mar/24/the-x-files-return-tv-david-duchovny-gillian-anderson
