Date,Publication,Headline,URL,BreachMentioned,CompanyMentioned,Unnamed: 0,name,domain,year founded,industry,size range,locality,country,linkedin url,current employee estimate,total employee estimate

20110204.0,New York Post,Al-Jazeera's offices torched amid Egypt unrest,http://www.nypost.com/p/news/international/al_jazeera_offices_torched_amid_VR8k8BtXlX0K0cSAbTfsfO,True,Al-Jazeera,2197770,al jazeera media network,aljazeera.com,2006.0,broadcast media,5001 - 10000,"doha, ad dawhah, qatar",qatar,linkedin.com/company/aljazeera,1986,4972
20120910.0,BBC,Al-Jazeera mobile service hacked,http://www.bbc.com/news/technology-19544290,True,Al-Jazeera,2197770,al jazeera media network,aljazeera.com,2006.0,broadcast media,5001 - 10000,"doha, ad dawhah, qatar",qatar,linkedin.com/company/aljazeera,1986,4972
20160618.0,FOX,Two Al-Jazeera employees sentenced to death in Egypt; Morsi gets 40 years,http://www.foxnews.com/world/2016/06/18/court-in-egypt-sentences-2-al-jazeera-employees-to-death-former-president-mohammed-morsi-to-40-years-in-prison.html?intcmp=latestnews,True,Al-Jazeera,2197770,al jazeera media network,aljazeera.com,2006.0,broadcast media,5001 - 10000,"doha, ad dawhah, qatar",qatar,linkedin.com/company/aljazeera,1986,4972
20191007.0,CNBC,Trump's updated China blacklist slams shares of chipmaker Ambarella,https://www.cnbc.com/2019/10/07/ambarella-falls-as-commerce-department-adds-hikvision-to-entity-list.html,True,Ambarella,6995529,ambarella inc,ambarella.com,2004.0,semiconductors,201 - 500,"santa clara, california, united states",united states,linkedin.com/company/ambarella,204,350
20080407.0,New York Times,"A.M.D., Citing a Slowdown, to Cut 1,650 Jobs",http://www.nytimes.com/2008/04/08/technology/08amd.html,True,A.M.D.,4498222,amd,amd.com,1969.0,semiconductors,10001+,"austin, texas, united states",united states,linkedin.com/company/amd,7243,23315
20110511.0,BBC,ACS:Law fined over data breach,http://www.bbc.co.uk/news/technology-13358896,Yes,ACS:Law,2965086,american constitution society,acslaw.org,2001.0,public policy,51 - 200,"washington, district of columbia, united states",united states,linkedin.com/company/american-constitution-society,50,201
20180904.0,FOX,Arby's apologizes for sign defaced with racist and misogynistic slurs,//web.archive.orghttps://www.foxnews.com/food-drink/2018/09/04/arbys-apologizes-for-sign-defaced-with-racist-and-misogynistic-slurs.html,True,Arby's,3865913,"arby's restaurant group, inc.",arbys.com,1964.0,restaurants,1001 - 5000,"atlanta, georgia, united states",united states,linkedin.com/company/arby's,1708,6989
20180903.0,Daily Mail,Arby's drive-thru sign is turned into a shocking n-word message in Minnesota to the horror of passers-by,http://www.dailymail.co.uk/news/article-6126543/Arbys-drive-sign-turned-shocking-n-word-message-Minnesota-horror-passers-by.html,True,Arby's,3865913,"arby's restaurant group, inc.",arbys.com,1964.0,restaurants,1001 - 5000,"atlanta, georgia, united states",united states,linkedin.com/company/arby's,1708,6989
20170210.0,FOX,Arby's faces big security hack,http://www.foxnews.com/food-drink/2017/02/10/arbys-investigates-credit-card-security-breach-at-hundreds-restaurants.html,True,Arby's,3865913,"arby's restaurant group, inc.",arbys.com,1964.0,restaurants,1001 - 5000,"atlanta, georgia, united states",united states,linkedin.com/company/arby's,1708,6989
20170211.0,FOX,Arby’s major security breach,http://www.foxnews.com/food-drink/2017/02/10/arbys-investigates-credit-card-security-breach-at-hundreds-restaurants.htm,True,Arby's,3865913,"arby's restaurant group, inc.",arbys.com,1964.0,restaurants,1001 - 5000,"atlanta, georgia, united states",united states,linkedin.com/company/arby's,1708,6989
20180904.0,FOX,"Arby's apologizes for sign defaced with racist, misogynistic slurs",http://www.foxnews.com/food-drink/2018/09/04/arbys-apologizes-for-sign-defaced-with-racist-and-misogynistic-slurs.html,True,Arby's,3865913,"arby's restaurant group, inc.",arbys.com,1964.0,restaurants,1001 - 5000,"atlanta, georgia, united states",united states,linkedin.com/company/arby's,1708,6989
20210307.0,Daily Mail,Austria SUSPENDS jabs with batch of Astra-Zeneca vaccine after one person died and another falls ill after taking the shot,https://www.dailymail.co.uk/news/article-9335317/Austria-suspends-AstraZeneca-COVID-19-vaccine-batch-death.html,True,Astra-Zeneca,761202,astrazeneca,astrazeneca.com,1999.0,pharmaceuticals,10001+,"london, greater london, united kingdom",united kingdom,linkedin.com/company/astrazeneca,29930,79360
20110725.0,Daily Mail,"Going for a burn: Driver watches in despair as £150,000 Lamborghini Gallardo bursts into flames",http://www.dailymail.co.uk/news/article-2018589/Going-burn-Driver-watches-despair-150-000-Lamborghini-Gallardo-bursts-flames.html,True,Lamborghini,725405,automobili lamborghini s.p.a.,lamborghini.com,1963.0,automotive,1001 - 5000,"provincia di bologna, emilia-romagna, italy",italy,linkedin.com/company/automobili-lamborghini-s-p-a-,1063,2079
20160923.0,CNBC,Axovant shares slammed after rival Alzheimer's treatment data disappoints,http://www.cnbc.com/2016/09/22/axovant-shares-slammed-after-competitor-releases-disappointing-trial-data.html,True,Axovant,2184195,axovant sciences,axovant.com,2014.0,biotechnology,51 - 200,"basel, basel-city, switzerland",switzerland,linkedin.com/company/axovant,41,86
20141205.0,Daily Mail,Fashion brand Bebe hit by data breach with potentially millions of customer bank details exposed,http://www.dailymail.co.uk/news/article-2862342/Bebe-discloses-data-breach.html,True,Bebe,1111643,bebe.com.py | tienda bebé asunción,bebe.com.py,2014.0,retail,1 - 10,"asuncion, central, paraguay",paraguay,linkedin.com/company/tienda-bebé-asunción,3,4
20211208.0,Daily Mail,Staffer fired in infamous Zoom call where Better.com CEO laid off 900 says company killed his work email and instant messaging within MINUTES of the decision,https://www.dailymail.co.uk/news/article-10289067/My-heart-just-sank-says-ex-employee-laid-900-employees-Better-com-Zoom-call.html,True,Better.com,4252009,better communications,bettercom.com,1978.0,professional training & coaching,51 - 200,"waltham, massachusetts, united states",united states,linkedin.com/company/better-communications,27,99
20220308.0,Daily Mail,"Controversial start-up Better.com fires HALF its 8,000 staff after accidentally revealing their fate by adding 'severance' tab to their browsers after CEO fired 900 over Zoom and branded workers 'lazy thieves'",https://www.dailymail.co.uk/news/article-10590573/Controversial-start-Better-com-set-lay-HALF-8-000-staff-week.html,True,Better.com,4252009,better communications,bettercom.com,1978.0,professional training & coaching,51 - 200,"waltham, massachusetts, united states",united states,linkedin.com/company/better-communications,27,99
20140629.0,CNBC,BNP board approves record $8.9B settlement Financial Times,http://www.cnbc.com/id/101798442?trknav=homestack:topnews:3,True,BNP,5105125,biblioteca nacional del peru,bnp.gob.pe,,government administration,201 - 500,,,linkedin.com/company/biblioteca-nacional-del-peru,134,339
20140606.0,CNBC,"As bank fines soar, US threatened $16B BNP penalty",http://www.cnbc.com/id/101737500,True,BNP,5105125,biblioteca nacional del peru,bnp.gob.pe,,government administration,201 - 500,,,linkedin.com/company/biblioteca-nacional-del-peru,134,339
20120405.0,CNBC,Oil Hedge Fund BlueGold to Liquidate,http://www.cnbc.com/id/46974216,True,BlueGold,4322999,blue gold,bluegold.es,2004.0,mechanical or industrial engineering,11 - 50,"el campello, valencia, spain",spain,linkedin.com/company/blue-gold,5,13
20120910.0,Washington Post,BlueToad says it was source of...,http://www.washingtonpost.com/blogs/post-tech/post/publisher-bluetoad-says-it-was-source-of-data-in-anonymous-fbi-hack-thecircuit/2012/09/10/a6958550-fb82-11e1-b153-218509a954e1_blog.html,True,BlueToad,4578538,bluetoad inc.,bluetoad.com,2007.0,publishing,11 - 50,"orlando, florida, united states",united states,linkedin.com/company/bluetoad-inc-_3,17,35
20140326.0,CNBC,BofA settles with Fannie/Freddie regulator for $9.3B,http://www.cnbc.com/id/101528427,True,BofA,3940977,bofa international ltd,bofa.co.uk,1987.0,machinery,51 - 200,"staunton, illinois, united states",united states,linkedin.com/company/bofa-international-ltd,62,93
20140916.0,CNBC,BofA loses $6 billion in consumer-friendly cuts,http://www.cnbc.com/id/102005575?trknav=homestack:mostpopular:3,True,BofA,3940977,bofa international ltd,bofa.co.uk,1987.0,machinery,51 - 200,"staunton, illinois, united states",united states,linkedin.com/company/bofa-international-ltd,62,93
20081002.0,CNBC,BofA and RBC Settle Auction-Rate Debt Probe,http://www.cnbc.com/id/27088065,True,BofA,3940977,bofa international ltd,bofa.co.uk,1987.0,machinery,51 - 200,"staunton, illinois, united states",united states,linkedin.com/company/bofa-international-ltd,62,93
20111005.0,CNBC,BofA Web Site Goes Down...Again,http://www.cnbc.com/id/44759325,True,BofA,3940977,bofa international ltd,bofa.co.uk,1987.0,machinery,51 - 200,"staunton, illinois, united states",united states,linkedin.com/company/bofa-international-ltd,62,93
20111002.0,CNBC,BofA Site Riddled With Problems For Fifth Day,http://www.cnbc.com/id/44776116,True,BofA,3940977,bofa international ltd,bofa.co.uk,1987.0,machinery,51 - 200,"staunton, illinois, united states",united states,linkedin.com/company/bofa-international-ltd,62,93
20090117.0,CNBC,BofA Gets $20 Billion Bailout,http://www.cnbc.com/id/28685240,True,BofA,3940977,bofa international ltd,bofa.co.uk,1987.0,machinery,51 - 200,"staunton, illinois, united states",united states,linkedin.com/company/bofa-international-ltd,62,93
20140424.0,CNBC,BofA in DOJ settlement talks for $10B+: Sources,http://www.cnbc.com/id/101582319,True,BofA,3940977,bofa international ltd,bofa.co.uk,1987.0,machinery,51 - 200,"staunton, illinois, united states",united states,linkedin.com/company/bofa-international-ltd,62,93
20120921.0,CNBC,"BofA to Cut 16,000 Jobs by Year-End: Report",http://www.cnbc.com/id/49098399,True,BofA,3940977,bofa international ltd,bofa.co.uk,1987.0,machinery,51 - 200,"staunton, illinois, united states",united states,linkedin.com/company/bofa-international-ltd,62,93
20101029.0,New York Post,Informer: BofA hawked risky deals to customers,http://www.nypost.com/p/news/business/informer_bofa_hawked_risky_deals_9AR9iRb1nf2ndz6F4nMO0O,True,BofA,3940977,bofa international ltd,bofa.co.uk,1987.0,machinery,51 - 200,"staunton, illinois, united states",united states,linkedin.com/company/bofa-international-ltd,62,93
20140806.0,CNBC,"BofA, DOJ near $17B mortgage-probe settlement",http://www.cnbc.com/id/101884082?trknav=homestack:topnews:6,True,BofA,3940977,bofa international ltd,bofa.co.uk,1987.0,machinery,51 - 200,"staunton, illinois, united states",united states,linkedin.com/company/bofa-international-ltd,62,93
20140709.0,CNBC,"DoJ, BofA mortgage talks stall: Sources",http://www.cnbc.com/id/101824071?trknav=homestack:topnews:16,True,BofA,3940977,bofa international ltd,bofa.co.uk,1987.0,machinery,51 - 200,"staunton, illinois, united states",united states,linkedin.com/company/bofa-international-ltd,62,93
20130909.0,CNBC,"BofA to cut 2,100 jobs as loan demand weakens",http://www.cnbc.com/id/101020210,True,BofA,3940977,bofa international ltd,bofa.co.uk,1987.0,machinery,51 - 200,"staunton, illinois, united states",united states,linkedin.com/company/bofa-international-ltd,62,93
20220826.0,USA Today,Thieves stole millions in jewelry while Brink's driver…,https://www.usatoday.com/story/news/nation/2022/08/26/driver-fell-asleep-thieves-steal-millions-jewelry/7903313001/,True,Brink's,2680880,brink’s,brinks.com,1859.0,logistics and supply chain,5001 - 10000,"richmond, virginia, united states",united states,linkedin.com/company/brinks,2657,8400
20220813.0,New York Post,"Brink’s contends multiple jewel companies undervalued the gems ripped off last month on its watch during the California heist, according to a Manhattan Federal Court lawsuit.",https://nypost.com/2022/08/13/brinks-doubts-gems-were-150m-in-jewel-heist-lawsuit/,True,Brink's,2680880,brink’s,brinks.com,1859.0,logistics and supply chain,5001 - 10000,"richmond, virginia, united states",united states,linkedin.com/company/brinks,2657,8400
20111229.0,Daily Mail,"Build-A-Bear recalls 300,000 Chinese-made toys over choking fears as firm is hit by THIRD safety scandal in a year",http://www.dailymail.co.uk/news/article-2079704/Build-A-Bear-recalls-300-000-Chinese-toys-choking-fears-firm-hit-THIRD-safety-scandal-year.html,True,Build-A-Bear,2956825,build-a-bear workshop,buildabear.com,1997.0,retail,1001 - 5000,"st. louis, missouri, united states",united states,linkedin.com/company/build-a-bear-workshop,1086,4741
20111228.0,CNN,"Build-A-Bear recalls 300,000 teddy bears",http://www.cnn.com/2011/12/28/us/teddy-bear-recall/index.html,True,Build-A-Bear,2956825,build-a-bear workshop,buildabear.com,1997.0,retail,1001 - 5000,"st. louis, missouri, united states",united states,linkedin.com/company/build-a-bear-workshop,1086,4741
20120816.0,Washington Post,Bumbo recall,http://www.washingtonpost.com/business/4-million-bumbo-infant-floor-seats-recalled-following-skull-fractures/2012/08/15/db64d2fa-e6c8-11e1-9739-eef99c5fb285_story.html,True,Bumbo,613880,bumbo international,bumbo.com,1997.0,consumer goods,51 - 200,"rosslyn, gauteng, south africa",south africa,linkedin.com/company/bumbo-international,25,49
20121218.0,Daily Mail,Is this the start of the gun backlash? Private equity firm sells company that makes Bushmaster as stores pull deadly semi-automatic rifles from their shelves,http://www.dailymail.co.uk/news/article-2250036/Private-equity-firm-Cerberus-selling-stake-firearms-company-makes-Bushmaster-stores-pull-Sandy-Hook-weapon-shelves.html,True,Bushmaster,4087045,"bushmaster firearms, llc",bushmaster.com,1973.0,defense & space,1 - 10,"ilion, new york, united states",united states,linkedin.com/company/bushmaster-firearms-llc,5,34
20190314.0,USA Today,"Butterball recalls 78,000 pounds of ground turkey1 hour, 9 minutes | Money",https://www.usatoday.com/story/money/2019/03/14/butterball-recalls-78-000-pounds-ground-turkey-over-salmonella-risk/3160523002/,True,Butterball,1140100,"butterball, llc",butterball.com,1954.0,food production,1001 - 5000,"mountain home, north carolina, united states",united states,linkedin.com/company/butterball-llc,688,1273
20211014.0,USA Today,"Butterball recalls 14,000 pounds of ground turkey for plastic bits",https://www.usatoday.com/story/money/business/2021/10/14/recall-14-k-pound-butterball-ground-turkey-blue-plastic-pieces/8458604002/,True,Butterball,1140100,"butterball, llc",butterball.com,1954.0,food production,1001 - 5000,"mountain home, north carolina, united states",united states,linkedin.com/company/butterball-llc,688,1273
20190426.0,Daily Mail,Kentucky woman claims E.coli-infected beef gave her kidney failure as she sues top meat producer K2D amid nationwide recall of tainted patties,https://www.dailymail.co.uk/health/article-6965197/Kentucky-woman-claims-E-coli-infected-beef-gave-kidney-failure.html,True,K2D,1818319,cabinet k2d expertises,k2d.fr,2004.0,real estate,1 - 10,"la nerthe, bouches-du-rhône, france",france,linkedin.com/company/cabinet-k2d-expertises-immobilier,2,2
20171228.0,CNBC,Claire's pulls makeup popular with girls amid asbestos allegations,https://www.cnbc.com/2017/12/28/claires-pulls-glittery-products-amid-asbestos-allegations.html,True,Claire's,1076655,claire's inc.,claires.com,1960.0,retail,1001 - 5000,"hoffman estates, illinois, united states",united states,linkedin.com/company/claire's-accessories,2225,10909
20170828.0,The Guardian,The far right is losing its ability to speak freely online. Should the left defend it?,https://www.theguardian.com/technology/2017/aug/28/daily-stormer-alt-right-cloudflare-breitbart,True,Cloudflare,1983486,"cloudflare, inc.",cloudflare.com,2009.0,information technology and services,501 - 1000,"san francisco, california, united states",united states,linkedin.com/company/cloudflare-inc-,432,563
20220903.0,Washington Post,"Under pressure, security firm Cloudflare drops Kiwi Farms site where stalkers organize",https://www.washingtonpost.com/technology/2022/09/03/cloudflare-drops-kiwifarms/,True,Cloudflare,1983486,"cloudflare, inc.",cloudflare.com,2009.0,information technology and services,501 - 1000,"san francisco, california, united states",united states,linkedin.com/company/cloudflare-inc-,432,563
20161021.0,New York Times,Websites Face Disruptions After Attack on Internet Firm,http://www.nytimes.com/2016/10/22/business/internet-problems-attack.html,True,Cloudflare,1983486,"cloudflare, inc.",cloudflare.com,2009.0,information technology and services,501 - 1000,"san francisco, california, united states",united states,linkedin.com/company/cloudflare-inc-,432,563
20210510.0,CNBC,Cloudflare sees rise in cyber incidents as hackers unleash 'everything': CEO,https://www.cnbc.com/2021/05/10/cloudflare-ceo-on-uptick-in-cyber-incidents-colonial-pipeline-attack.html,True,Cloudflare,1983486,"cloudflare, inc.",cloudflare.com,2009.0,information technology and services,501 - 1000,"san francisco, california, united states",united states,linkedin.com/company/cloudflare-inc-,432,563
20201218.0,CNBC,Cloudflare CEO says 'zero-trust architecture' is an answer to U.S. government breach,https://www.cnbc.com/2020/12/18/cloudflare-ceo-says-zero-trust-structure-is-answer-to-government-hack.html,True,Cloudflare,1983486,"cloudflare, inc.",cloudflare.com,2009.0,information technology and services,501 - 1000,"san francisco, california, united states",united states,linkedin.com/company/cloudflare-inc-,432,563
20170224.0,BBC,Cloudflare bug data leak exposed,http://www.bbc.com/news/technology-39077611,True,Cloudflare,1983486,"cloudflare, inc.",cloudflare.com,2009.0,information technology and services,501 - 1000,"san francisco, california, united states",united states,linkedin.com/company/cloudflare-inc-,432,563
20180409.0,The Guardian,Company suspends Cubeyou over harvesting data claims,https://www.theguardian.com/technology/2018/apr/09/facebook-suspends-cubeyou-over-harvesting-data-claims,True,Cubeyou,3432392,cubeyou inc,cubeyou.com,2010.0,computer software,11 - 50,"redwood city, california, united states",united states,linkedin.com/company/cubeyou-s-r-l-,19,65
20210616.0,CNBC,CureVac shares tank 50% after preliminary data shows Covid vaccine is only 47% effective,https://www.cnbc.com/2021/06/16/curevac-covid-vaccine-only-47percent-effective-in-early-data-shares-tank.html,True,CureVac,4266152,curevac ag,curevac.com,2000.0,biotechnology,201 - 500,,,linkedin.com/company/curevac,86,115
20190426.0,The Guardian,Daimler says it has no idea how country got hold of limousines,https://www.theguardian.com/world/2019/apr/26/daimler-says-it-has-no-idea-how-north-korea-got-hold-of-limousines,True,Daimler,3564434,daimler ag,daimler.com,1886.0,automotive,10001+,,,linkedin.com/company/daimler,12239,31670
20100606.0,CNN,Chrysler recalls vehicles,http://money.cnn.com/2010/06/06/autos/chrysler_recall_minivan/index.htm?hpt=T3,True,Chrysler,1982583,daimler chrysler,chrysler.com,,automotive,1001 - 5000,"auburn hills, michigan, united states",united states,linkedin.com/company/daimlerchrysler,834,9103
20071102.0,Washington Post,"Chrysler to Cut Up to 12,000 Jobs",http://www.washingtonpost.com/wp-dyn/content/article/2007/11/01/AR2007110100693.html?hpid=topnews,True,Chrysler,1982583,daimler chrysler,chrysler.com,,automotive,1001 - 5000,"auburn hills, michigan, united states",united states,linkedin.com/company/daimlerchrysler,834,9103
20150303.0,Daily Mail,"Chrysler recalls over 2,000 Dodge Hellcats after a fuel leak is discovered by dealer during pre-delivery inspection",http://www.dailymail.co.uk/news/article-2978176/Chrysler-recalls-2-000-Dodge-Hellcats-fuel-leak-discovered-dealer-pre-delivery-inspection.html,True,Chrysler,1982583,daimler chrysler,chrysler.com,,automotive,1001 - 5000,"auburn hills, michigan, united states",united states,linkedin.com/company/daimlerchrysler,834,9103
20141219.0,CNN,Chrylser recall jumps to 3.3 million,http://money.cnn.com/2014/12/19/autos/chrysler-takata-recall/index.html?hpt=hp_t2,True,Chrysler,1982583,daimler chrysler,chrysler.com,,automotive,1001 - 5000,"auburn hills, michigan, united states",united states,linkedin.com/company/daimlerchrysler,834,9103
20141203.0,USA Today,Chrysler expands Takata airbag fix to more states,http://www.usatoday.com/story/money/cars/2014/12/03/chryselr-ram-takata-airbag-recall-expand/19857925/,True,Chrysler,1982583,daimler chrysler,chrysler.com,,automotive,1001 - 5000,"auburn hills, michigan, united states",united states,linkedin.com/company/daimlerchrysler,834,9103
20100118.0,CNN,Chrysler recall over brakes,http://money.cnn.com/2010/01/18/autos/chrysler_recall/index.htm,True,Chrysler,1982583,daimler chrysler,chrysler.com,,automotive,1001 - 5000,"auburn hills, michigan, united states",united states,linkedin.com/company/daimlerchrysler,834,9103
20090511.0,CNN,Chrysler's sorry state revealed,http://money.cnn.com/2009/05/11/autos/chrysler_bankruptcy_filing.fortune/index.htm?cnn=yes,True,Chrysler,1982583,daimler chrysler,chrysler.com,,automotive,1001 - 5000,"auburn hills, michigan, united states",united states,linkedin.com/company/daimlerchrysler,834,9103
20120507.0,CNN,"Chrysler recalling 119,000 cars",http://money.cnn.com/2012/05/07/autos/chrysler-300-dodge-charger-recall/index.htm?source=cnn_bin,True,Chrysler,1982583,daimler chrysler,chrysler.com,,automotive,1001 - 5000,"auburn hills, michigan, united states",united states,linkedin.com/company/daimlerchrysler,834,9103
20100607.0,CNN,"Chrysler recalling 365,000 vehicles",http://money.cnn.com/2010/06/07/autos/wrangler_recall/index.htm?source=cnn_bin,True,Chrysler,1982583,daimler chrysler,chrysler.com,,automotive,1001 - 5000,"auburn hills, michigan, united states",united states,linkedin.com/company/daimlerchrysler,834,9103
20140722.0,CNN,"Chrysler recalls 792,000 Jeeps",http://money.cnn.com/2014/07/22/news/companies/chrysler-jeep-recall/index.html?hpt=hp_t2,True,Chrysler,1982583,daimler chrysler,chrysler.com,,automotive,1001 - 5000,"auburn hills, michigan, united states",united states,linkedin.com/company/daimlerchrysler,834,9103
20131109.0,CNN,Chrysler recalls 1.2 million trucks,http://cnnmoney.mobi/primary/article?url=http://money.cnn.com/mobile/json/2013/11/08/autos/chrysler-truck-recall.json,True,Chrysler,1982583,daimler chrysler,chrysler.com,,automotive,1001 - 5000,"auburn hills, michigan, united states",united states,linkedin.com/company/daimlerchrysler,834,9103
20100118.0,CNN,Chrysler vehicles recalled for possible brake failure,http://money.cnn.com/2010/01/18/autos/chrysler_recall/,True,Chrysler,1982583,daimler chrysler,chrysler.com,,automotive,1001 - 5000,"auburn hills, michigan, united states",united states,linkedin.com/company/daimlerchrysler,834,9103
20100607.0,Washington Post,"Chrysler to recall about 600,000 Jeeps, minivans",http://www.washingtonpost.com/wp-dyn/content/article/2010/06/07/AR2010060701531.html?hpid=moreheadlines,True,Chrysler,1982583,daimler chrysler,chrysler.com,,automotive,1001 - 5000,"auburn hills, michigan, united states",united states,linkedin.com/company/daimlerchrysler,834,9103
20130705.0,CNN,Chrysler recalls half-million vehicles,http://www.cnn.com/2013/07/05/us/chrysler-recall/index.html?hpt=hp_t2,True,Chrysler,1982583,daimler chrysler,chrysler.com,,automotive,1001 - 5000,"auburn hills, michigan, united states",united states,linkedin.com/company/daimlerchrysler,834,9103
20140928.0,CNBC,Chrysler recalls 350K cars for ignition issues,http://www.cnbc.com/id/102033574?trknav=homestack:mostpopular:15,True,Chrysler,1982583,daimler chrysler,chrysler.com,,automotive,1001 - 5000,"auburn hills, michigan, united states",united states,linkedin.com/company/daimlerchrysler,834,9103
20150403.0,BBC,Chrysler to pay $149m for crash death,http://www.bbc.com/news/business-32172500,True,Chrysler,1982583,daimler chrysler,chrysler.com,,automotive,1001 - 5000,"auburn hills, michigan, united states",united states,linkedin.com/company/daimlerchrysler,834,9103
20071207.0,CNN,"Chrysler recalls 600,000 vehicles",http://money.cnn.com/2007/12/07/autos/chrysler.ap/index.htm,True,Chrysler,1982583,daimler chrysler,chrysler.com,,automotive,1001 - 5000,"auburn hills, michigan, united states",united states,linkedin.com/company/daimlerchrysler,834,9103
20140722.0,CNBC,Chrysler recalls Jeep SUVs for ignition switches,http://www.cnbc.com/id/101846544?trknav=homestack:topnews:8,True,Chrysler,1982583,daimler chrysler,chrysler.com,,automotive,1001 - 5000,"auburn hills, michigan, united states",united states,linkedin.com/company/daimlerchrysler,834,9103
20100605.0,Washington Post,Chrysler recalls Dodge Caliber over sticky pedals,http://www.washingtonpost.com/wp-dyn/content/article/2010/06/04/AR2010060403236.html?hpid=sec-business,True,Chrysler,1982583,daimler chrysler,chrysler.com,,automotive,1001 - 5000,"auburn hills, michigan, united states",united states,linkedin.com/company/daimlerchrysler,834,9103
20140722.0,USA Today,Chrysler recalling up to 792K SUVs over switches,http://www.usatoday.com/story/money/cars/2014/07/22/chrysler-suvs-ignition-switch-recall/13008453/,True,Chrysler,1982583,daimler chrysler,chrysler.com,,automotive,1001 - 5000,"auburn hills, michigan, united states",united states,linkedin.com/company/daimlerchrysler,834,9103
20140716.0,USA Today,Chrysler answers due on slow pace of Jeep recall,http://www.usatoday.com/story/money/cars/2014/07/16/chrysler-jeep-fire-recall-nhtsa/12744885/,True,Chrysler,1982583,daimler chrysler,chrysler.com,,automotive,1001 - 5000,"auburn hills, michigan, united states",united states,linkedin.com/company/daimlerchrysler,834,9103
