Date,Publication,Headline,URL,BreachMentioned,CompanyMentioned,Unnamed: 0,name,domain,year founded,industry,size range,locality,country,linkedin url,current employee estimate,total employee estimate
20140903.0,Daily Mail,"Prostate cancer charity gives back Reddit donations after online forum offering advice on how to share hacked celebrity photos raises $6,000 'in honor of Jennifer Lawrence'",http://www.dailymail.co.uk/news/article-2740481/How-Reddit-one-stop-shop-celebrity-iCloud-photos.html,True,Reddit,4987904,"reddit, inc.",reddit.com,2005.0,internet,501 - 1000,"san francisco, california, united states",united states,linkedin.com/company/reddit-com,274,403
20210225.0,CNBC,Data firm that monitors Reddit says GameStop mentions were spiking days ago,https://www.cnbc.com/2021/02/25/firm-that-monitors-reddit-saw-gamestop-mentions-spiking-days-ago.html,True,Reddit,4987904,"reddit, inc.",reddit.com,2005.0,internet,501 - 1000,"san francisco, california, united states",united states,linkedin.com/company/reddit-com,274,403
20121015.0,Daily Mail,Internet troll behind Reddit 'Creepshot' forum where users post sexual pictures of unsuspecting girls is FIRED from his job after identity is revealed,http://www.dailymail.co.uk/news/article-2218204/Michael-Brutsch-Internet-troll-Reddit-Creepshot-forum-fired.html,True,Reddit,4987904,"reddit, inc.",reddit.com,2005.0,internet,501 - 1000,"san francisco, california, united states",united states,linkedin.com/company/reddit-com,274,403
20150710.0,Daily Mail,Ellen Pao steps down as millionaire Reddit CEO - little more than a week after site 'revolt' by her unpaid moderators over firing of popular employee,http://www.dailymail.co.uk/news/article-3156930/Ellen-Pao-Reddit-CEO-just-eight-days-dismissal-popular-site-moderator-led-thousands-users-calling-firing.html,True,Reddit,4987904,"reddit, inc.",reddit.com,2005.0,internet,501 - 1000,"san francisco, california, united states",united states,linkedin.com/company/reddit-com,274,403
20201009.0,The Guardian,Regeneron Demand surges for drug Trump claims ‘cures’ Covid,https://www.theguardian.com/world/2020/oct/09/regeneron-drug-demand-surges-trump-claims-cures-covid,True,Regeneron,6165404,"regeneron pharmaceuticals, inc.",regeneron.com,1988.0,biotechnology,5001 - 10000,"tarrytown, new york, united states",united states,linkedin.com/company/regeneron-pharmaceuticals,4382,6654
20201231.0,CNBC,42 people mistakenly get Regeneron Covid treatment instead of vaccine in WV,https://www.cnbc.com/2020/12/31/west-virginia-mistakenly-gives-42-peoplegiven-regeneron-iv-covid-treatment-instead-of-vaccine-shot-west-virginia-national-guard-says-.html,True,Regeneron,6165404,"regeneron pharmaceuticals, inc.",regeneron.com,1988.0,biotechnology,5001 - 10000,"tarrytown, new york, united states",united states,linkedin.com/company/regeneron-pharmaceuticals,4382,6654
20201030.0,Daily Mail,Trial using Regeneron's antibody drug - which was given to Trump - to treat severely ill COVID-19 patients paused over 'potential safety concern',https://www.dailymail.co.uk/health/article-8897961/2nd-study-testing-COVID-19-antibody-drug-setback.html,True,Regeneron,6165404,"regeneron pharmaceuticals, inc.",regeneron.com,1988.0,biotechnology,5001 - 10000,"tarrytown, new york, united states",united states,linkedin.com/company/regeneron-pharmaceuticals,4382,6654
20201231.0,Daily Mail,42 people are mistakenly injected with the Regeneron antibody treatment instead of Moderna's COVID-19 vaccine in blunder at West Virginia clinic,https://www.dailymail.co.uk/news/article-9102937/Review-launched-42-injected-Regeneron-instead-COVID-19-vaccine-West-Virginia.html,True,Regeneron,6165404,"regeneron pharmaceuticals, inc.",regeneron.com,1988.0,biotechnology,5001 - 10000,"tarrytown, new york, united states",united states,linkedin.com/company/regeneron-pharmaceuticals,4382,6654
20201123.0,The Guardian,US Antibody cocktail Trump received to be distributed,https://www.theguardian.com/world/2020/nov/23/regeneron-us-distribution-trump-coronavirus-antibody-cocktail-treatment,True,Regeneron,6165404,"regeneron pharmaceuticals, inc.",regeneron.com,1988.0,biotechnology,5001 - 10000,"tarrytown, new york, united states",united states,linkedin.com/company/regeneron-pharmaceuticals,4382,6654
20210112.0,Washington Post,6:55PMU.S. buys 1.25 million doses of Regeneron’s monoclonal antibody treatment,https://www.washingtonpost.com/nation/2021/01/12/coronavirus-covid-live-updates-us/#link-2B24N2LF6BDMNHP5FIWCR775JQ,True,Regeneron,6165404,"regeneron pharmaceuticals, inc.",regeneron.com,1988.0,biotechnology,5001 - 10000,"tarrytown, new york, united states",united states,linkedin.com/company/regeneron-pharmaceuticals,4382,6654
20111023.0,USA Today,At least 138 dead after Turkey quake,http://www.usatoday.com/news/world/story/2011-10-23/turkey-earthquake/50880238/1?csp=hf,True,Turkey,4758235,republic of turkey,turkey.org,1923.0,international affairs,51 - 200,,,linkedin.com/company/republic-of-turkey,18,26
20180815.0,FOX,"Turkey braces for hard times amid currency crisis, US spat",//web.archive.orghttps://www.foxnews.com/world/2018/08/15/turkey-braces-for-hard-times-amid-currency-crisis-us-spat.html,True,Turkey,4758235,republic of turkey,turkey.org,1923.0,international affairs,51 - 200,,,linkedin.com/company/republic-of-turkey,18,26
20180810.0,CNBC,Dow drops about 200 points as financial crisis in Turkey spooks global markets,https://www.cnbc.com/2018/08/10/us-markets-political-concerns-keep-investors-on-edge.html,True,Turkey,4758235,republic of turkey,turkey.org,1923.0,international affairs,51 - 200,,,linkedin.com/company/republic-of-turkey,18,26
20161124.0,CNBC,Turkey raises rates for first time since 2014 amid lira plunge,http://www.cnbc.com/2016/11/24/turkey-raises-rates-for-time-since-2014-amid-lira-plunge.html,True,Turkey,4758235,republic of turkey,turkey.org,1923.0,international affairs,51 - 200,,,linkedin.com/company/republic-of-turkey,18,26
20170310.0,New York Times,Flynn Was Paid to Represent Turkey During Campaign,https://www.nytimes.com/2017/03/10/us/politics/michael-flynn-turkey.html,True,Turkey,4758235,republic of turkey,turkey.org,1923.0,international affairs,51 - 200,,,linkedin.com/company/republic-of-turkey,18,26
20140327.0,Washington Post,The alleged leak behind Turkey’s YouTube ban,http://www.washingtonpost.com/blogs/worldviews/wp/2014/03/27/by-banning-youtube-has-turkey-revealed-just-how-damning-todays-leaked-recording-is/,True,Turkey,4758235,republic of turkey,turkey.org,1923.0,international affairs,51 - 200,,,linkedin.com/company/republic-of-turkey,18,26
20180810.0,CNBC,Turkish lira plunges 14% versus dollar after Trump authorizes doubling metals tariffs on Turkey,https://www.cnbc.com/2018/08/10/turkish-lira-loss-deepens-as-pm-erdogan-calls-for-citizens-to-convert-.html,True,Turkey,4758235,republic of turkey,turkey.org,1923.0,international affairs,51 - 200,,,linkedin.com/company/republic-of-turkey,18,26
20180818.0,CNBC,S&P cuts Turkey credit rating deeper into junk territory                              Kate Rooney,https://www.cnbc.com/2018/08/17/sp-cuts-turkey-credit-rating-deeper-into-junk-territory.html,True,Turkey,4758235,republic of turkey,turkey.org,1923.0,international affairs,51 - 200,,,linkedin.com/company/republic-of-turkey,18,26
20211213.0,BBC,1 Turkish lira slumps further to new record low,https://www.bbc.com/news/business-59636957,True,Turkey,4758235,republic of turkey,turkey.org,1923.0,international affairs,51 - 200,,,linkedin.com/company/republic-of-turkey,18,26
20180813.0,CNBC,"Turkish lira collapse continues, hits new record low as central bank takes steps to ease pain",https://www.cnbc.com/2018/08/13/turkish-lira-turkey-currency-hits-new-record-low.html,True,Turkey,4758235,republic of turkey,turkey.org,1923.0,international affairs,51 - 200,,,linkedin.com/company/republic-of-turkey,18,26
20181222.0,Washington Post,Turkey recall,https://www.washingtonpost.com/health/2018/12/22/usda-recalls-more-than-pounds-ground-turkey-widening-salmonella-outbreak/,True,Turkey,4758235,republic of turkey,turkey.org,1923.0,international affairs,51 - 200,,,linkedin.com/company/republic-of-turkey,18,26
20180813.0,CNBC,Turkey's crashing currency likely to unleash wave of bad loans in region,https://www.cnbc.com/2018/08/13/turkeys-crashing-currency-likely-to-unleash-wave-of-bad-loans-in-regi.html,True,Turkey,4758235,republic of turkey,turkey.org,1923.0,international affairs,51 - 200,,,linkedin.com/company/republic-of-turkey,18,26
20180813.0,New York Times,"Turkish Currency Hits a New Low, Fanning Fears of Wider Meltdown",https://www.nytimes.com/2018/08/13/business/turkey-stock-markets.html,True,Turkey,4758235,republic of turkey,turkey.org,1923.0,international affairs,51 - 200,,,linkedin.com/company/republic-of-turkey,18,26
20211123.0,CNBC,Lira crisis,https://www.cnbc.com/2021/11/23/turkish-lira-plummets-to-historic-low-after-erdogan-sparks-selloff-.html,True,Turkey,4758235,republic of turkey,turkey.org,1923.0,international affairs,51 - 200,,,linkedin.com/company/republic-of-turkey,18,26
20161104.0,CNBC,"Turkey blocks access to Twitter, Facebook",http://www.cnbc.com/2016/11/04/turkey-blocks-access-to-twitter-facebook-whatsapp-internet-monitoring-group.html,True,Turkey,4758235,republic of turkey,turkey.org,1923.0,international affairs,51 - 200,,,linkedin.com/company/republic-of-turkey,18,26
20190708.0,CNBC,Turkish currency and stocks drop after President Erdogan fires top central bank official,https://www.cnbc.com/2019/07/08/turkish-currency-and-stocks-drop-after-president-erdogan-fires-top-central-bank-official.html,True,Turkey,4758235,republic of turkey,turkey.org,1923.0,international affairs,51 - 200,,,linkedin.com/company/republic-of-turkey,18,26
20211123.0,Washington Post,Turkish lira hits record low as Erdogan doubles down on economic policy dubbed ‘insane’,https://www.washingtonpost.com/world/2021/11/23/turkey-lira-inflation/,True,Turkey,4758235,republic of turkey,turkey.org,1923.0,international affairs,51 - 200,,,linkedin.com/company/republic-of-turkey,18,26
20201027.0,CNBC,Turkish lira hits yet another record low against the dollar amid France row,https://www.cnbc.com/2020/10/27/turkish-lira-hits-another-record-low-against-dollar-amid-france-row-.html,True,Turkey,4758235,republic of turkey,turkey.org,1923.0,international affairs,51 - 200,,,linkedin.com/company/republic-of-turkey,18,26
20210828.0,The Guardian,"Republicans  Partisan election audits have led to voting system breaches, experts say",https://www.theguardian.com/us-news/2021/aug/28/republican-election-audits-have-led-to-voting-system-breaches-experts-say,True,Republicans,1257298,republican party of georgia,republicans.ge,1978.0,political organization,1 - 10,"tbilisi, dushet'is raioni, georgia",georgia,linkedin.com/company/rpg,1,3
20200504.0,Daily Mail,New coronavirus antibody test that promises ZERO false negatives gets emergency FDA approval as company promises kits will be available 'immediately',https://www.dailymail.co.uk/health/article-8284915/FDA-gives-emergency-approval-Roches-coronavirus-antibody-blood-test.html,True,Roches,329119,roches chartered accountants,roches.co.uk,1998.0,accounting,1 - 10,"fareham, hampshire, united kingdom",united kingdom,linkedin.com/company/roches-chartered-accountants,4,6
20151102.0,Washington Post,Vatican arrests 2 advisers in probe of leaked documents,https://www.washingtonpost.com/world/vatican-arrests-two-advisers-over-alleged-links-to-leaked-documents/2015/11/02/b154ba46-816d-11e5-a7ca-6ab6ec20f839_story.html,True,Vatican,2376547,roman catholic church,vatican.va,,religious institutions,1001 - 5000,,,linkedin.com/company/roman-catholic-church,1056,1180
20140129.0,Daily Mail,Angry Birds come crashing down: Rovio's site hacked after NSA spy scandal revealed it was a 'leaky app' used to gather data on users,http://www.dailymail.co.uk/sciencetech/article-2548134/Angry-Birds-come-crashing-Maker-Rovios-site-hacked-NSA-spy-scandal-revealed-leaky-app-used-gather-data-users.html,True,Rovio,7155756,rovio entertainment ltd.,rovio.com,2003.0,entertainment,501 - 1000,"espoo, uusimaa, finland",finland,linkedin.com/company/rovio,322,1161
20220714.0,Washington Post,"Russian strikes in Vinnytsia kill at least 23, including three children",https://www.washingtonpost.com/world/2022/07/14/russia-ukraine-war-putin-news-live-updates/#link-DSZG5E5QYFDL5B5YNQEPVFR2IQ,True,Russia,1353599,russia local schools,russia.k12.oh.us,,education management,51 - 200,,,linkedin.com/company/russia-local-schools,30,38
20161230.0,New York Post,Russian compound shut down over election hack         :0,http://nypost.com/2016/12/30/russian-compound-shut-down-over-election-hack/,True,Russia,1353599,russia local schools,russia.k12.oh.us,,education management,51 - 200,,,linkedin.com/company/russia-local-schools,30,38
20171230.0,USA Today,Russian tankers accused of supplying fuel to North Korea,https://www.usatoday.com/story/news/world/2017/12/30/russia-denies-north-korea-sanctions-breach/992466001/,True,Russia,1353599,russia local schools,russia.k12.oh.us,,education management,51 - 200,,,linkedin.com/company/russia-local-schools,30,38
20180207.0,New York Post,Russian cyberspies stole sensitive US defense technology,https://nypost.com/2018/02/07/russian-cyberspies-stole-sensitive-us-defense-technology/,True,Russia,1353599,russia local schools,russia.k12.oh.us,,education management,51 - 200,,,linkedin.com/company/russia-local-schools,30,38
20220930.0,CNBC,Russian pipeline leaks spark climate fears as huge volumes of methane spew into the atmosphere,https://www.cnbc.com/2022/09/30/climate-nord-stream-gas-leaks-sees-methane-spew-into-the-atmosphere.html,True,Russia,1353599,russia local schools,russia.k12.oh.us,,education management,51 - 200,,,linkedin.com/company/russia-local-schools,30,38
20140806.0,USA Today,Russian data breach coincides with big security conference,http://www.usatoday.com/story/tech/2014/08/06/russian-crime-ring-cybersecurity/13658595/,True,Russia,1353599,russia local schools,russia.k12.oh.us,,education management,51 - 200,,,linkedin.com/company/russia-local-schools,30,38
20220209.0,Daily Mail,"Russian figure skating starlet, 15, 'tests POSITIVE for a banned chest pain drug' after gold medal ceremony for her team was put on hold for 'legal reasons' (with country already banned for doping)",https://www.dailymail.co.uk/news/article-10493719/Has-Beijing-Olympics-hit-doping-scandal-Medal-ceremony-event-won-Russia-delayed.html,True,Russia,1353599,russia local schools,russia.k12.oh.us,,education management,51 - 200,,,linkedin.com/company/russia-local-schools,30,38
20221119.0,FOX,"Russian gas pipeline explodes near St. Petersburg, video shows",//web.archive.orghttps://www.foxnews.com/world/russian-gas-pipeline-explodes-st-petersburg-video-shows,True,Russia,1353599,russia local schools,russia.k12.oh.us,,education management,51 - 200,,,linkedin.com/company/russia-local-schools,30,38
20180211.0,FOX,Russian plane crash outside Moscow leaves 71 dead,//web.archive.orghttp://www.foxnews.com/world/2018/02/11/russian-plane-crash-outside-moscow-leaves-71-dead.html,True,Russia,1353599,russia local schools,russia.k12.oh.us,,education management,51 - 200,,,linkedin.com/company/russia-local-schools,30,38
20181019.0,USA Today,Russian national charged in election conspiracy,https://www.usatoday.com/story/news/politics/2018/10/19/russian-national-charged-election-interference/1698255002/,True,Russia,1353599,russia local schools,russia.k12.oh.us,,education management,51 - 200,,,linkedin.com/company/russia-local-schools,30,38
20180607.0,New York Post,Russian malware attack is way worse than we thought,https://nypost.com/2018/06/07/russian-malware-attack-is-way-worse-than-we-thought/,True,Russia,1353599,russia local schools,russia.k12.oh.us,,education management,51 - 200,,,linkedin.com/company/russia-local-schools,30,38
20201219.0,USA Today,"Russian hack: We need strong action, not wrist slaps",https://www.usatoday.com/story/opinion/2020/12/19/russia-hack-attack-threatens-american-safety-democracy-column/3965580001/,True,Russia,1353599,russia local schools,russia.k12.oh.us,,education management,51 - 200,,,linkedin.com/company/russia-local-schools,30,38
20161217.0,Washington Post,"Russian hacking presents problem for Trump, who touts ‘America first’",https://www.washingtonpost.com/politics/for-a-president-elect-that-touts-america-first-russian-hacking-poses-a-problem/2016/12/17/d18bedd4-c46f-11e6-8422-eac61c0ef74d_story.html,True,Russia,1353599,russia local schools,russia.k12.oh.us,,education management,51 - 200,,,linkedin.com/company/russia-local-schools,30,38
20111205.0,BBC,Russian poll sites 'are hacked',http://www.bbc.co.uk/news/technology-16032402,True,Russia,1353599,russia local schools,russia.k12.oh.us,,education management,51 - 200,,,linkedin.com/company/russia-local-schools,30,38
20220511.0,New York Post,Russian hackers increasing efforts after cyberattack shut down Ukraine internet,https://nypost.com/2022/05/11/russian-hackers-increasing-efforts-after-cyberattack-shut-down-ukraine-internet/,True,Russia,1353599,russia local schools,russia.k12.oh.us,,education management,51 - 200,,,linkedin.com/company/russia-local-schools,30,38
20220412.0,CNBC,Ukraine says Russian cyberattack sought to shut down energy grid,https://www.cnbc.com/2022/04/12/ukraine-says-russian-cyberattack-sought-to-shut-down-energy-grid.html,True,Russia,1353599,russia local schools,russia.k12.oh.us,,education management,51 - 200,,,linkedin.com/company/russia-local-schools,30,38
20171205.0,New York Times,Russian Team Barred From 2018 Winter Olympics,https://www.nytimes.com/2017/12/05/sports/olympics/ioc-russia-winter-olympics.html,True,Russia,1353599,russia local schools,russia.k12.oh.us,,education management,51 - 200,,,linkedin.com/company/russia-local-schools,30,38
20201013.0,New York Post,Russia reports record high daily coronavirus cases and deaths,https://nypost.com/2020/10/13/russia-reports-record-high-daily-coronavirus-cases-and-deaths/,True,Russia,1353599,russia local schools,russia.k12.oh.us,,education management,51 - 200,,,linkedin.com/company/russia-local-schools,30,38
20151118.0,BBC,Russia ruled in breach of doping code,http://www.bbc.com/sport/athletics/34860136,True,Russia,1353599,russia local schools,russia.k12.oh.us,,education management,51 - 200,,,linkedin.com/company/russia-local-schools,30,38
20171110.0,Washington Post,Russia says it will retaliate after RT was ‘forced’ to register as a foreign agent,https://www.washingtonpost.com/world/moscow-plans-new-restrictions-on-us-media-working-in-russia/2017/11/10/2174d81a-c5fa-11e7-a441-3a768c8586f1_story.html,True,Russia,1353599,russia local schools,russia.k12.oh.us,,education management,51 - 200,,,linkedin.com/company/russia-local-schools,30,38
20190129.0,Washington Post,"Russia secretly offered North Korea a nuclear power plant, officials say",https://www.washingtonpost.com/world/national-security/russia-secretly-offered-north-korea-a-nuclear-power-plant-officials-say/2019/01/29/d1872588-a99b-4b68-ba34-9ce1bc95b573_story.html,True,Russia,1353599,russia local schools,russia.k12.oh.us,,education management,51 - 200,,,linkedin.com/company/russia-local-schools,30,38
20150818.0,New York Post,Russia selling missiles to Iran that ‘can bring down US aircraft’,http://nypost.com/2015/08/18/russia-selling-missiles-to-iran-that-can-bring-down-us-aircraft/,True,Russia,1353599,russia local schools,russia.k12.oh.us,,education management,51 - 200,,,linkedin.com/company/russia-local-schools,30,38
20160728.0,CNN,Russia stages games for the banned,http://www.cnn.com/2016/07/28/sport/russia-doping-alternate-games-for-expelled-drug-cheats/index.html,True,Russia,1353599,russia local schools,russia.k12.oh.us,,education management,51 - 200,,,linkedin.com/company/russia-local-schools,30,38
20220501.0,Washington Post,"Russia struggles under unprecedented wave of hacking, puncturing myth of its cyber-superiority",https://www.washingtonpost.com/technology/2022/05/01/russia-cyber-attacks-hacking/,True,Russia,1353599,russia local schools,russia.k12.oh.us,,education management,51 - 200,,,linkedin.com/company/russia-local-schools,30,38
20200418.0,Daily Mail,Russia suffers record coronavirus rise in cases as Moscow mayor says he has enough beds for two weeks but cannot make promises beyond this - despite giant new hospital,https://www.dailymail.co.uk/news/article-8232713/Russia-suffers-record-rise-coronavirus-cases.html,True,Russia,1353599,russia local schools,russia.k12.oh.us,,education management,51 - 200,,,linkedin.com/company/russia-local-schools,30,38
20210316.0,Washington Post,"Russia targeted people close to Trump in bid to influence 2020 election, U.S. intelligence says",https://www.washingtonpost.com/national-security/intelligence-assessment-2020-election-russia-iran/2021/03/16/a2650478-8662-11eb-bfdf-4d36dab83a6d_story.html,True,Russia,1353599,russia local schools,russia.k12.oh.us,,education management,51 - 200,,,linkedin.com/company/russia-local-schools,30,38
20161228.0,Daily Mail,Russia threatens response to Obama 'provocation' as White House readies punishment for election meddling 'lie' and Republican senator warns sanctions will hit Putin personally,http://www.dailymail.co.uk/news/article-4071090/Obama-poised-punish-Putin-U-S-election-meddling-Republican-senator-warns-sanctions-hit-Russian-president-personally.html,True,Russia,1353599,russia local schools,russia.k12.oh.us,,education management,51 - 200,,,linkedin.com/company/russia-local-schools,30,38
20171117.0,Daily Mail,Russia to retaliate after U.S. brands Moscow-controlled 'RT' television network a 'foreign agent' - preparing to do the same to NINE American news outlets including Voice of America and Radio Free Europe,http://www.dailymail.co.uk/news/article-5090657/Russia-names-9-U-S-backed-news-outlets-likely-labelled-foreign-agents.html,True,Russia,1353599,russia local schools,russia.k12.oh.us,,education management,51 - 200,,,linkedin.com/company/russia-local-schools,30,38
20170613.0,Daily Mail,Russia tried to delete or alter voter data during cyber attacks that affected virtually EVERY state before the election,http://www.dailymail.co.uk/news/article-4601070/Russian-cyber-attacks-affected-states-election.html,True,Russia,1353599,russia local schools,russia.k12.oh.us,,education management,51 - 200,,,linkedin.com/company/russia-local-schools,30,38
20200811.0,Washington Post,"Russia unveils possible vaccine, claiming victory before final testing is complete",https://www.washingtonpost.com/world/russia-unveils-coronavirus-vaccine-claiming-victory-in-global-race-before-final-testing-is-complete/2020/08/11/792f8a54-d813-11ea-a788-2ce86ce81129_story.html,True,Russia,1353599,russia local schools,russia.k12.oh.us,,education management,51 - 200,,,linkedin.com/company/russia-local-schools,30,38
20220510.0,New York Times,"Russia was behind the cyberattack that disrupted communications in Ukraine before the invasion, an investigation found.",https://www.nytimes.com/2022/05/10/us/politics/russia-cyberattack-ukraine-war.html,True,Russia,1353599,russia local schools,russia.k12.oh.us,,education management,51 - 200,,,linkedin.com/company/russia-local-schools,30,38
20220324.0,New York Post,Russia will likely default with April 4 payment due of $2.2B: experts,https://nypost.com/2022/03/24/russia-will-likely-default-on-its-debt-with-april-4-payment-due-of-2-2b-experts/,True,Russia,1353599,russia local schools,russia.k12.oh.us,,education management,51 - 200,,,linkedin.com/company/russia-local-schools,30,38
20220811.0,Daily Mail,Russia wipes out ENTIRE Ukrainian fortress town of Pisky using banned thermobaric 'vacuum' bombs: Soldiers gloat as  supercharged warheads rain down on apartment blocks,https://www.dailymail.co.uk/news/article-11102731/The-moment-Russians-obliterated-apartment-blocks-thermobaric-bomb.html,True,Russia,1353599,russia local schools,russia.k12.oh.us,,education management,51 - 200,,,linkedin.com/company/russia-local-schools,30,38
20131030.0,FOX,Russia's goodie bag gifts 'bugged' G-20 delegates,http://www.foxnews.com/politics/2013/10/30/russias-goodie-bag-gifts-bugged-g-20-delegates/,True,Russia,1353599,russia local schools,russia.k12.oh.us,,education management,51 - 200,,,linkedin.com/company/russia-local-schools,30,38
20201030.0,FOX,"Russia's reputation, Olympic status on trial for doping",//web.archive.orghttps://www.foxnews.com/sports/russias-reputation-olympic-status-on-trial-for-doping,True,Russia,1353599,russia local schools,russia.k12.oh.us,,education management,51 - 200,,,linkedin.com/company/russia-local-schools,30,38
20160617.0,New York Post,Russia's track team banned from Olympics         :0,http://nypost.com/2016/06/17/russias-track-team-banned-from-olympics/,True,Russia,1353599,russia local schools,russia.k12.oh.us,,education management,51 - 200,,,linkedin.com/company/russia-local-schools,30,38
20161216.0,BBC,Russia: US poll hack claims 'indecent',http://www.bbc.com/news/world-us-canada-38341569,True,Russia,1353599,russia local schools,russia.k12.oh.us,,education management,51 - 200,,,linkedin.com/company/russia-local-schools,30,38
20171229.0,CNBC,Russian tankers fueled North Korea via transfers at sea,https://www.cnbc.com/2017/12/29/russian-tankers-fueled-north-korea-via-transfers-at-sea-reuters.html,True,Russia,1353599,russia local schools,russia.k12.oh.us,,education management,51 - 200,,,linkedin.com/company/russia-local-schools,30,38
20141205.0,The Guardian,Russian Athletics considering legal action over doping exposé,http://www.theguardian.com/sport/2014/dec/05/russia-athletics-federations-legal-action-tv-documentary-doping,True,Russia,1353599,russia local schools,russia.k12.oh.us,,education management,51 - 200,,,linkedin.com/company/russia-local-schools,30,38
