Date,Publication,Headline,URL,BreachMentioned,CompanyMentioned,Unnamed: 0,name,domain,year founded,industry,size range,locality,country,linkedin url,current employee estimate,total employee estimate
20140107.0,CNBC,JPMorgan 'failed and failed miserably': Bharara,http://www.cnbc.com/id/101313757,True,JPMorgan,2769600,j.p. morgan,jpmorgan.com,,financial services,10001+,"new york, new york, united states",united states,linkedin.com/company/j-p-morgan,37431,98722
20090126.0,CNBC,JPMorgan Exited Madoff-Linked Funds Last Fall,http://www.cnbc.com/id/28912487,True,JPMorgan,2769600,j.p. morgan,jpmorgan.com,,financial services,10001+,"new york, new york, united states",united states,linkedin.com/company/j-p-morgan,37431,98722
20131015.0,New York Times,JPMorgan Expected to Admit Fault in Trading Loss,http://dealbook.nytimes.com/2013/10/15/jpmorgan-said-to-reach-deal-with-trading-regulator/?hp,True,JPMorgan,2769600,j.p. morgan,jpmorgan.com,,financial services,10001+,"new york, new york, united states",united states,linkedin.com/company/j-p-morgan,37431,98722
20120521.0,CNBC,JPMorgan Halts Buybacks in Wake of Trading Loss,http://www.cnbc.com/id/47503768,True,JPMorgan,2769600,j.p. morgan,jpmorgan.com,,financial services,10001+,"new york, new york, united states",united states,linkedin.com/company/j-p-morgan,37431,98722
20120510.0,CNBC,JPMorgan Hit by 'Egregious' Trading Loss of $2 Billion,http://www.cnbc.com/id/47377555,True,JPMorgan,2769600,j.p. morgan,jpmorgan.com,,financial services,10001+,"new york, new york, united states",united states,linkedin.com/company/j-p-morgan,37431,98722
20120511.0,CNBC,JPMorgan Reels From Turmoil,http://www.cnbc.com/id/47386604,True,JPMorgan,2769600,j.p. morgan,jpmorgan.com,,financial services,10001+,"new york, new york, united states",united states,linkedin.com/company/j-p-morgan,37431,98722
20120526.0,CNBC,JPMorgan Trading Loss: Did Regulators Overlook the Risk?,http://www.cnbc.com/id/47578527,True,JPMorgan,2769600,j.p. morgan,jpmorgan.com,,financial services,10001+,"new york, new york, united states",united states,linkedin.com/company/j-p-morgan,37431,98722
20131017.0,New York Post,JPMorgan agrees to $100M settlement with CFTC,http://nypost.com/2013/10/17/jpmorgan-agrees-to-100m-settlement-with-cftc/,True,JPMorgan,2769600,j.p. morgan,jpmorgan.com,,financial services,10001+,"new york, new york, united states",united states,linkedin.com/company/j-p-morgan,37431,98722
20131025.0,CNN,JPMorgan agrees to pay $5.1 billion,http://money.cnn.com/2013/10/25/investing/jpmorgan-settlement/index.html?hpt=hp_t1,True,JPMorgan,2769600,j.p. morgan,jpmorgan.com,,financial services,10001+,"new york, new york, united states",united states,linkedin.com/company/j-p-morgan,37431,98722
20131020.0,CNN,JPMorgan,http://money.cnn.com/2013/10/19/investing/jpmorgan-settlement/index.html?hpt=hp_inthenews,True,JPMorgan,2769600,j.p. morgan,jpmorgan.com,,financial services,10001+,"new york, new york, united states",united states,linkedin.com/company/j-p-morgan,37431,98722
20141002.0,Washington Post,76 million households affected by JPMorgan breach,http://www.washingtonpost.com/business/economy/jpmorgan-says-76-million-households-affected-by-cyber-breach/2014/10/02/4c18330a-4a79-11e4-a046-120a8a855cca_story.html,True,JPMorgan,2769600,j.p. morgan,jpmorgan.com,,financial services,10001+,"new york, new york, united states",united states,linkedin.com/company/j-p-morgan,37431,98722
20150619.0,CNBC,Jeni's reopens stores after listeria  discovery,http://www.cnbc.com/id/102774316?trknav=homestack:topnews:11,True,Jeni's,3782944,jeni's splendid ice creams,jenis.com,2002.0,food production,201 - 500,"columbus, ohio, united states",united states,linkedin.com/company/jeni's-splendid-ice-creams,144,567
20181223.0,Daily Mail,Salmonella outbreak linked to raw turkey leaves over 200 sick across U.S. and prompts a fresh recall of Jennie-O products,https://www.dailymail.co.uk/news/article-6522263/Salmonella-outbreak-linked-raw-turkey-leaves-200-sick-U-S.html,True,Jennie-O,6496884,jennie-o turkey store,jennieo.com,1940.0,food production,501 - 1000,"austin, minnesota, united states",united states,linkedin.com/company/jennie-o-turkey-store,371,658
20140919.0,CNN,Airliner's engine 'exploded',http://www.cnn.com/2014/09/18/us/jetblue-emergency-landing/index.html?hpt=hp_t2,True,JetBlue,2708551,jetblue airways,jetblue.com,1999.0,airlines/aviation,10001+,"long island city, new york, united states",united states,linkedin.com/company/jetblue-airways,6463,10075
20131022.0,New York Post,JetBlue’s secret new FDNY plane leaks online,http://nypost.com/2013/10/22/jetblues-secret-new-fdny-plane-leaks-online/,True,JetBlue,2708551,jetblue airways,jetblue.com,1999.0,airlines/aviation,10001+,"long island city, new york, united states",united states,linkedin.com/company/jetblue-airways,6463,10075
20100922.0,Daily Mail,JetBlue lands with parking brake on and bursts into flames injuring seven passengers,http://www.dailymail.co.uk/news/article-1314618/JetBlue-lands-parking-brake-bursts-flames-injuring-seven-passengers.html,True,JetBlue,2708551,jetblue airways,jetblue.com,1999.0,airlines/aviation,10001+,"long island city, new york, united states",united states,linkedin.com/company/jetblue-airways,6463,10075
20180507.0,Daily Mail,JetBlue flight from Puerto Rico to Tampa is forced to make an emergency landing after an outer windshield of the cockpit shattered in midair,http://www.dailymail.co.uk/news/article-5700733/JetBlue-flight-Puerto-Rico-Tampa-makes-emergency-landing-windshield-shatters-midair.html,True,JetBlue,2708551,jetblue airways,jetblue.com,1999.0,airlines/aviation,10001+,"long island city, new york, united states",united states,linkedin.com/company/jetblue-airways,6463,10075
20131002.0,Daily Mail,JetBlue flight attendant 'caught smuggling heroin disguised as candy into Florida before going undercover to bust Colombian drugs lord',http://www.dailymail.co.uk/news/article-2441893/Flight-attendant-Carla-Alvarado-caught-smuggling-heroin-helps-police-arrest-drug-lord.html,True,JetBlue,2708551,jetblue airways,jetblue.com,1999.0,airlines/aviation,10001+,"long island city, new york, united states",united states,linkedin.com/company/jetblue-airways,6463,10075
20130908.0,The Guardian,JetBlue employee held in DR,http://www.theguardian.com/world/2013/sep/07/jetblue-employee-arrested-dominican-republic,True,JetBlue,2708551,jetblue airways,jetblue.com,1999.0,airlines/aviation,10001+,"long island city, new york, united states",united states,linkedin.com/company/jetblue-airways,6463,10075
20191203.0,USA Today,"Man breaches security, sneaks into plane's cargo…",https://www.usatoday.com/story/travel/airline-news/2019/12/03/jetblue-man-entered-planes-cargo-hold-boston-logan-airport/2598132001/,True,JetBlue,2708551,jetblue airways,jetblue.com,1999.0,airlines/aviation,10001+,"long island city, new york, united states",united states,linkedin.com/company/jetblue-airways,6463,10075
20110115.0,Daily Mail,Investigation launched as JetBlue pilot loses his handgun in major airport security breach,http://www.dailymail.co.uk/news/article-1347432/JetBlue-pilot-loses-handgun-major-airport-security-breach.html,Yes,JetBlue,2708551,jetblue airways,jetblue.com,1999.0,airlines/aviation,10001+,"long island city, new york, united states",united states,linkedin.com/company/jetblue-airways,6463,10075
20190602.0,Daily Mail,"Johnsonville is recalling 95,393 pounds of its ready-to-eat jalapeño cheddar smoked sausages that may contain green plastic",https://www.dailymail.co.uk/news/article-7097069/Johnsonville-recalling-95-393-pounds-ready-eat-jalape-o-cheddar-smoked-sausages.html,True,Johnsonville,214780,johnsonville sausage,johnsonville.com,1945.0,food production,501 - 1000,"sheboygan falls, wisconsin, united states",united states,linkedin.com/company/johnsonville-sausage,474,946
20211105.0,BBC,3 China property fears grow as Kaisa misses payment,https://www.bbc.com/news/business-59159371,True,Kaisa,2902224,kaisa consulting,kaisa.com,2005.0,information technology and services,201 - 500,"manila, manila, philippines",philippines,linkedin.com/company/kaisa-consulting,96,304
20140310.0,Washington Post,"SEC probing KBR, whistleblower’s lawyer says",http://www.washingtonpost.com/world/national-security/sec-has-opened-investigation-into-kbr-whistleblowers-lawyer-says/2014/03/10/d09ed14e-a883-11e3-8d62-419db477a0e6_story.html,True,KBR,2048870,"kbr, inc.",kbr.com,1919.0,construction,10001+,"houston, texas, united states",united states,linkedin.com/company/kbr-inc,9338,33116
20110929.0,Daily Mail,"KBR contractor who claimed she was raped by colleagues in Baghdad ordered to pay $145,000 in court costs after losing case",http://www.dailymail.co.uk/news/article-2043039/Jamie-Leigh-Jones-Rape-claimant-ordered-pay-KBRs-145k-court-costs.html,True,KBR,2048870,"kbr, inc.",kbr.com,1919.0,construction,10001+,"houston, texas, united states",united states,linkedin.com/company/kbr-inc,9338,33116
20180615.0,New York Post,Kellogg issues massive Honey Smacks recall over salmonella risk,https://nypost.com/2018/06/15/kellogg-issues-massive-honey-smacks-recall-over-salmonella-risk/,True,Kellogg,2815331,kellogg community college,kellogg.edu,,higher education,501 - 1000,"battle creek, michigan, united states",united states,linkedin.com/company/kellogg-community-college,359,665
20161130.0,The Guardian,Breitbart declares war on Kellogg's after cereal brand pulls advertising from site,https://www.theguardian.com/media/2016/nov/30/breitbart-news-kelloggs-advertising-boycott-alt-right,True,Kellogg's,4408484,kellogg's brasil,kelloggs.com.br,,food & beverages,11 - 50,"paulo, amapa, brazil",brazil,linkedin.com/company/kellogg's-brasil,6,14
20160314.0,The Guardian,Urine trouble  FDA investigates video of Kellogg's worker relieving self on food,http://www.theguardian.com/world/2016/mar/14/kelloggs-video-urinating-cereal-rice-krispie-fda-criminal-investigation,True,Kellogg's,4408484,kellogg's brasil,kelloggs.com.br,,food & beverages,11 - 50,"paulo, amapa, brazil",brazil,linkedin.com/company/kellogg's-brasil,6,14
20100625.0,CNN,Kellogg's recalls cereals,http://money.cnn.com/2010/06/25/news/companies/kellogg_recall/index.htm?hpt=T2,True,Kellogg's,4408484,kellogg's brasil,kelloggs.com.br,,food & beverages,11 - 50,"paulo, amapa, brazil",brazil,linkedin.com/company/kellogg's-brasil,6,14
20130221.0,Daily Mail,"Kellogg's recalls 36,000 boxes of Special K Red Berries cereal over GLASS fragments",http://www.dailymail.co.uk/news/article-2282384/Kelloggs-recalls-36-000-boxes-Special-K-Red-Berries-cereal-GLASS-fragments.html,True,Kellogg's,4408484,kellogg's brasil,kelloggs.com.br,,food & beverages,11 - 50,"paulo, amapa, brazil",brazil,linkedin.com/company/kellogg's-brasil,6,14
20150805.0,CNBC,Keurig plunges 27% as brewer sales  collapse,http://www.cnbc.com/2015/08/05/keurig-drops-20-will-cut-workforce-amid-declining-sales.html?trknav=homestack:topnews:1,True,Keurig,160558,keurig canada,keurig.ca,,consumer goods,1001 - 5000,"montréal, quebec, canada",canada,linkedin.com/company/keurig-canada,508,1119
20141223.0,Daily Mail,Keurig recalls more than SEVEN MILLION brewers because malfunction causes coffee-maker to spray users with scalding hot liquids,http://www.dailymail.co.uk/news/article-2884932/Keurig-recalls-Mini-Plus-coffee-makers.html,True,Keurig,160558,keurig canada,keurig.ca,,consumer goods,1001 - 5000,"montréal, quebec, canada",canada,linkedin.com/company/keurig-canada,508,1119
20141223.0,CNBC,Keurig recalls nearly 7 million coffee makers,http://www.cnbc.com/id/102276862?trknav=homestack:trending:8,True,Keurig,160558,keurig canada,keurig.ca,,consumer goods,1001 - 5000,"montréal, quebec, canada",canada,linkedin.com/company/keurig-canada,508,1119
20141223.0,USA Today,Burn risk: Keurig recalls over 7.2M coffee makers,http://www.usatoday.com/story/news/nation-now/2014/12/23/keurig-recalls-coffee-makers/20801483/,True,Keurig,160558,keurig canada,keurig.ca,,consumer goods,1001 - 5000,"montréal, quebec, canada",canada,linkedin.com/company/keurig-canada,508,1119
20150630.0,New York Post,KKR to pay $30M for years of wrongly charging investors,http://nypost.com/2015/06/29/kkr-to-pay-30m-for-years-of-wrongly-charging-investors/,True,KKR,3466565,kkr & co. l.p.,kkr.com,1976.0,financial services,1001 - 5000,"new york, new york, united states",united states,linkedin.com/company/kkr,1125,2180
20160405.0,Daily Mail,Syria's Assad used Panama law firm to get round international sanctions by setting up shadow companies to help fund his war while his UK fixer bought $10million of luxury flats,http://www.dailymail.co.uk/news/article-3524255/Syria-s-Assad-used-Panama-law-firm-round-international-sanctions-setting-shadow-companies-help-fund-war.html,True,Assad,3261922,l'accumulateur tunisien assad,assad.com.tn,,automotive,201 - 500,,,linkedin.com/company/l'accumulateur-tunisien-assad,77,119
20221025.0,Daily Mail,"'My dreams of becoming a mom are gone': Missouri woman, 32, sues L'Oreal over claims its chemical hair straighteners caused her womb cancer",https://www.dailymail.co.uk/health/article-11352571/First-woman-sues-LOreal-claims-chemical-hair-straighteners-caused-womb-cancer.html,True,L'Oreal,323766,l'oréal,loreal.com,,cosmetics,10001+,"paris, île-de-france, france",france,linkedin.com/company/loreal,37319,107296
20110726.0,CNBC,Debt Default to Trigger Lehman-Like Market Ripple?,http://www.cnbc.com/id/43901999,True,Lehman,1367414,lehman brothers,lehman.com,,capital markets,5001 - 10000,,,linkedin.com/company/lehman-brothers,2049,28571
20080910.0,Washington Post,Lehman Shares Plunge on Questions of Survival,http://www.washingtonpost.com/wp-dyn/content/article/2008/09/11/AR2008091101525.html?hpid=moreheadlines,True,Lehman,1367414,lehman brothers,lehman.com,,capital markets,5001 - 10000,,,linkedin.com/company/lehman-brothers,2049,28571
20080909.0,CNBC,Lehman Plunges On Doubts The Firm Will Find a Buyer,http://www.cnbc.com/id/26676458,True,Lehman,1367414,lehman brothers,lehman.com,,capital markets,5001 - 10000,,,linkedin.com/company/lehman-brothers,2049,28571
20100313.0,Washington Post,Report: Lehman used gimmicks to hide troubles,http://www.washingtonpost.com/wp-dyn/content/article/2010/03/11/AR2010031103027.html?hpid=topnews,True,Lehman,1367414,lehman brothers,lehman.com,,capital markets,5001 - 10000,,,linkedin.com/company/lehman-brothers,2049,28571
20080606.0,CNBC,"Lehman May Pre-Announce Results, Raise Capital",http://www.cnbc.com/id/24992575,True,Lehman,1367414,lehman brothers,lehman.com,,capital markets,5001 - 10000,,,linkedin.com/company/lehman-brothers,2049,28571
20080828.0,CNBC,"Struggling Lehman Plans to Lay Off 1,500 Workers",http://www.cnbc.com/id/26439996,True,Lehman,1367414,lehman brothers,lehman.com,,capital markets,5001 - 10000,,,linkedin.com/company/lehman-brothers,2049,28571
20090801.0,CNBC,Billions in Lehman Claims Could Bury an Elusive Insurer,http://www.cnbc.com/id/32235392,True,Lehman,1367414,lehman brothers,lehman.com,,capital markets,5001 - 10000,,,linkedin.com/company/lehman-brothers,2049,28571
20090920.0,CNBC,Learning from the Lehman Collapse┬?,http://www.cnbc.com/id/15840232?video=1267542870&play=1,True,Lehman,1367414,lehman brothers,lehman.com,,capital markets,5001 - 10000,,,linkedin.com/company/lehman-brothers,2049,28571
20100419.0,Washington Post,Questionable accounting unnoticed at Lehman,http://www.washingtonpost.com/wp-dyn/content/article/2010/04/19/AR2010041904370.html?hpid=topnews,True,Lehman,1367414,lehman brothers,lehman.com,,capital markets,5001 - 10000,,,linkedin.com/company/lehman-brothers,2049,28571
20080915.0,CNBC,Risky Real Estate Deals Helped Doom Lehman,http://www.cnbc.com/id/26758811,True,Lehman,1367414,lehman brothers,lehman.com,,capital markets,5001 - 10000,,,linkedin.com/company/lehman-brothers,2049,28571
20160927.0,CNBC,Shares of Ligand plunge 12% after Amgen drug misses study goal,http://www.cnbc.com/2016/09/27/shares-of-ligand-plunge-13-percent-after-amgen-drug-misses-study-goal.html,True,Ligand,5611552,ligand pharmaceuticals,ligand.com,1987.0,pharmaceuticals,51 - 200,"san diego, california, united states",united states,linkedin.com/company/ligand-pharmaceuticals,49,630
20130817.0,BBC,Lonmin sorry for South Africa deaths,http://www.bbc.com/news/world-africa-23730268,True,Lonmin,5199475,lonmin platinum,lonmin.com,,mining & metals,1001 - 5000,"johannesburg, gauteng, south africa",south africa,linkedin.com/company/lonmin-plc,1286,2235
20101217.0,Daily Mail,Tobacco company Lorillard ordered to pay $81m in damages to woman who died from cancer after 'being given free cigarettes at 13',http://www.dailymail.co.uk/news/article-1339421/Tobacco-company-Lorillard-ordered-pay-81m-punitive-damages-woman-died-cancer-began-smoking-13.html,True,Lorillard,2948279,lorillard tobacco company,lorillard.com,,tobacco,501 - 1000,"greensboro, north carolina, united states",united states,linkedin.com/company/lorillard-tobacco-company,472,1072
20110512.0,Daily Mail,Anger as Twitpic changes its terms so it can sell YOUR photos to whoever it wants,http://www.dailymail.co.uk/sciencetech/article-1386314/Twitpic-changes-terms-sell-YOUR-photos-wants.html,True,Twitpic,3587634,losrenderizantes,twitpic.com,,internet,1 - 10,"charleston, south carolina, united states",united states,linkedin.com/company/twitpic,2,6
20160105.0,CNBC,FTC: Lumosity to pay $2M for 'deceptive'  ads,http://www.cnbc.com/2016/01/05/ftc-lumosity-to-pay-2m-for-deceptive-advertising.html,True,Lumosity,1134304,lumos labs (lumosity),lumosity.com,2005.0,"health, wellness and fitness",51 - 200,"san francisco, california, united states",united states,linkedin.com/company/lumos-labs-lumosity-,94,268
20220729.0,CNBC,Space company Masten files for bankruptcy after struggle with NASA moon contract,https://www.cnbc.com/2022/07/29/masten-files-for-bankruptcy-after-nasa-moon-contract-struggle.html,True,Masten,3852920,masten space systems,masten.aero,2004.0,defense & space,11 - 50,"mojave, california, united states",united states,linkedin.com/company/masten-space-systems,11,62
20210204.0,The Guardian,McKinsey agrees $600m settlement over role in crisis,https://www.theguardian.com/us-news/2021/feb/04/mckinsey-agrees-settlement-opioids-crisis-role,True,McKinsey,5339583,mckinsey & company,mckinsey.com,,management consulting,10001+,,,linkedin.com/company/mckinsey,15771,42694
20210204.0,New York Post,McKinsey to pay $573 million over role in pushing opioid drugs,https://nypost.com/2021/02/04/mckinsey-to-pay-573-million-over-role-in-pushing-opioids/,True,McKinsey,5339583,mckinsey & company,mckinsey.com,,management consulting,10001+,,,linkedin.com/company/mckinsey,15771,42694
20110329.0,CNN,"34,000 Tylenol bottles recalled",http://money.cnn.com/2011/03/29/news/companies/new_tylenol_recall/index.htm?hpt=Sbin,True,Tylenol,2860336,mcneil consumer & specialty pharmaceuticals inc.,tylenol.com,,pharmaceuticals,1 - 10,"fort washington, pennsylvania, united states",united states,linkedin.com/company/mcneil-consumer-&-specialty-pharmaceuticals-inc.,0,12
20100117.0,CNN,"FDA recalls some Tylenol products,",http://money.cnn.com/2010/01/15/news/companies/over_the_counter_medicine_recall/?hpt=Sbin,True,Tylenol,2860336,mcneil consumer & specialty pharmaceuticals inc.,tylenol.com,,pharmaceuticals,1 - 10,"fort washington, pennsylvania, united states",united states,linkedin.com/company/mcneil-consumer-&-specialty-pharmaceuticals-inc.,0,12
20100708.0,CNN,Tylenol recall is expanded,http://money.cnn.com/2010/07/08/news/companies/tylenol_recall/index.htm?hpt=Sbin,True,Tylenol,2860336,mcneil consumer & specialty pharmaceuticals inc.,tylenol.com,,pharmaceuticals,1 - 10,"fort washington, pennsylvania, united states",united states,linkedin.com/company/mcneil-consumer-&-specialty-pharmaceuticals-inc.,0,12
20100505.0,CNN,FDA slams Tylenol factory conditions,http://money.cnn.com/2010/05/04/news/companies/tylenol_recall_fda_inspection_report/index.htm?source=cnn_bin,True,Tylenol,2860336,mcneil consumer & specialty pharmaceuticals inc.,tylenol.com,,pharmaceuticals,1 - 10,"fort washington, pennsylvania, united states",united states,linkedin.com/company/mcneil-consumer-&-specialty-pharmaceuticals-inc.,0,12
20090924.0,CNN,21 Tylenol children's meds recalled,http://money.cnn.com/2009/09/24/news/companies/tylenol_recall/index.htm?postversion=2009092415,True,Tylenol,2860336,mcneil consumer & specialty pharmaceuticals inc.,tylenol.com,,pharmaceuticals,1 - 10,"fort washington, pennsylvania, united states",united states,linkedin.com/company/mcneil-consumer-&-specialty-pharmaceuticals-inc.,0,12
20101019.0,CNN,Tylenol recall linked to shut  plant,http://money.cnn.com/2010/10/19/news/companies/new_tylenol_recall/index.htm?hpt=Sbin,True,Tylenol,2860336,mcneil consumer & specialty pharmaceuticals inc.,tylenol.com,,pharmaceuticals,1 - 10,"fort washington, pennsylvania, united states",united states,linkedin.com/company/mcneil-consumer-&-specialty-pharmaceuticals-inc.,0,12
20120603.0,CNBC,Merrill Losses Withheld Before Bank of America Deal,http://www.cnbc.com/id/47670136,True,Merrill,98312,merrill research,merrill.com,1986.0,market research,1 - 10,"san mateo, california, united states",united states,linkedin.com/company/merrill-research,4,12
20090413.0,Washington Post,SEC Reviews Omission of Merrill Bonuses,http://www.washingtonpost.com/wp-dyn/content/article/2009/04/13/AR2009041302745.html?hpid=moreheadlines,True,Merrill,98312,merrill research,merrill.com,1986.0,market research,1 - 10,"san mateo, california, united states",united states,linkedin.com/company/merrill-research,4,12
20111024.0,New York Post,US debt rating in peril: Merrill forecast,http://www.nypost.com/p/news/business/us_debt_rating_in_peril_merrill_ITDHciwm8jxQeyzMLegvQO,True,Merrill,98312,merrill research,merrill.com,1986.0,market research,1 - 10,"san mateo, california, united states",united states,linkedin.com/company/merrill-research,4,12
20071029.0,New York Times,Risk-Takers Reign at Merrill Ends With Swift Fall,http://www.nytimes.com/2007/10/29/business/29merrill.html,True,Merrill,98312,merrill research,merrill.com,1986.0,market research,1 - 10,"san mateo, california, united states",united states,linkedin.com/company/merrill-research,4,12
20080302.0,CNBC,"Merrill Quits Subprime Lending, Cuts 650 Jobs",http://www.cnbc.com/id/23488878,True,Merrill,98312,merrill research,merrill.com,1986.0,market research,1 - 10,"san mateo, california, united states",united states,linkedin.com/company/merrill-research,4,12
20080617.0,CNBC,Merrill Shares Hit By Rumor,http://www.cnbc.com/id/25280081,True,Merrill,98312,merrill research,merrill.com,1986.0,market research,1 - 10,"san mateo, california, united states",united states,linkedin.com/company/merrill-research,4,12
20071024.0,New York Times,Loss and Larger Write-Down at Merrill,http://www.nytimes.com/2007/10/24/business/24merrill-web.html,True,Merrill,98312,merrill research,merrill.com,1986.0,market research,1 - 10,"san mateo, california, united states",united states,linkedin.com/company/merrill-research,4,12
20080909.0,CNBC,Merrill shares drop as concerns over Lehman spread,http://www.cnbc.com/id/25737357/for/cnbc,True,Merrill,98312,merrill research,merrill.com,1986.0,market research,1 - 10,"san mateo, california, united states",united states,linkedin.com/company/merrill-research,4,12
20071006.0,New York Times,A Big Loss at Merrill Stirs Unease,http://www.nytimes.com/2007/10/06/business/06walls.html,True,Merrill,98312,merrill research,merrill.com,1986.0,market research,1 - 10,"san mateo, california, united states",united states,linkedin.com/company/merrill-research,4,12
20090311.0,CNBC,"Merrill Misled Congress on Bonus Decisions, Filing Says",http://www.cnbc.com/id/29642397,True,Merrill,98312,merrill research,merrill.com,1986.0,market research,1 - 10,"san mateo, california, united states",united states,linkedin.com/company/merrill-research,4,12
20070709.0,New York Times,Ex-Partner at Milberg Pleads Guilty to Conspiracy,http://www.nytimes.com/2007/07/10/business/10legal.html,True,Milberg,453505,milberg llp,milberg.com,1965.0,law practice,51 - 200,"new york, new york, united states",united states,linkedin.com/company/milberg-llp,58,262
20170707.0,CNBC,Cybersecurity stocks rally as global hackings start to impact corporate bottom lines,http://www.cnbc.com/2017/07/07/cybersecurity-stocks-rally-on-mondelez-hacking.html,True,Mondelez,4549080,mondelez brasil,mondelez.com.br,,utilities,1 - 10,"sao paulo, sao paulo, brazil",brazil,linkedin.com/company/mondelez-brasil,2,6
20170706.0,CNBC,Mondelez says cyber attack will cut into revenue growth,http://www.cnbc.com/2017/07/06/cyber-attack-will-cut-3-percent-from-mondelezs-second-quarter-revenue-growth.html,True,Mondelez,4549080,mondelez brasil,mondelez.com.br,,utilities,1 - 10,"sao paulo, sao paulo, brazil",brazil,linkedin.com/company/mondelez-brasil,2,6
20180810.0,The Guardian,Monsanto  Company ordered to pay $289m as jury rules weedkiller caused man's cancer,https://www.theguardian.com/business/2018/aug/10/monsanto-trial-cancer-dewayne-johnson-ruling,True,Monsanto,2002672,monsanto company,monsanto.com,2000.0,farming,10001+,"st. louis, missouri, united states",united states,linkedin.com/company/monsanto,14319,36162
20190319.0,The Guardian,"Monsanto  Roundup substantial factor in man’s cancer, jury finds in key verdict",https://www.theguardian.com/business/2019/mar/19/monsanto-trial-roundup-verdict-edwin-hardeman-cancer,True,Monsanto,2002672,monsanto company,monsanto.com,2000.0,farming,10001+,"st. louis, missouri, united states",united states,linkedin.com/company/monsanto,14319,36162
