Date,Publication,Headline,URL,BreachMentioned,CompanyMentioned,Unnamed: 0,name,domain,year founded,industry,size range,locality,country,linkedin url,current employee estimate,total employee estimate
20220906.0,Washington Post,"Russia buying weapons from North Korea, U.S. intelligence says",https://www.washingtonpost.com/world/2022/09/06/north-korea-russia-weapons-ukraine/,True,Russia,1353599,russia local schools,russia.k12.oh.us,,education management,51 - 200,,,linkedin.com/company/russia-local-schools,30,38
20220614.0,The Guardian,"Russia bans 29 UK journalists, including Guardian correspondents",https://www.theguardian.com/media/2022/jun/14/russia-bans-29-uk-journalists-including-guardian-correspondents,True,Russia,1353599,russia local schools,russia.k12.oh.us,,education management,51 - 200,,,linkedin.com/company/russia-local-schools,30,38
20221229.0,CNBC,"Russia fires barrage of missiles on Ukraine cities, energy grid",https://www.cnbc.com/2022/12/29/explosions-rock-ukrainian-cities-as-russia-launches-more-than-100-missiles.html,True,Russia,1353599,russia local schools,russia.k12.oh.us,,education management,51 - 200,,,linkedin.com/company/russia-local-schools,30,38
20201218.0,CNBC,Russia hack,https://www.cnbc.com/2020/12/18/suspected-russian-hack-on-us-is-much-worse-than-first-feared.html,True,Russia,1353599,russia local schools,russia.k12.oh.us,,education management,51 - 200,,,linkedin.com/company/russia-local-schools,30,38
20191209.0,FOX,"Russia banned from Tokyo Olympics, other major sports events for 4 years",//web.archive.orghttps://www.foxnews.com/sports/russia-banned-from-tokyo-olympics-other-major-sports-events-for-4-years,True,Russia,1353599,russia local schools,russia.k12.oh.us,,education management,51 - 200,,,linkedin.com/company/russia-local-schools,30,38
20171205.0,Washington Post,Russia banned from 2018 Olympics for widespread doping program,https://www.washingtonpost.com/sports/russia-banned-from-2018-olympics-following-doping-allegations/2017/12/05/9ab49790-d9d4-11e7-b859-fb0995360725_story.html,True,Russia,1353599,russia local schools,russia.k12.oh.us,,education management,51 - 200,,,linkedin.com/company/russia-local-schools,30,38
20210718.0,FOX,"Russia at Tokyo Olympics with new name, more doping disputes",//web.archive.orghttps://www.foxnews.com/sports/russia-at-tokyo-olympics-with-new-name-more-doping-disputes,True,Russia,1353599,russia local schools,russia.k12.oh.us,,education management,51 - 200,,,linkedin.com/company/russia-local-schools,30,38
20151119.0,Daily Mail,Russia and Cairo sign deal to build a NUCLEAR power plant in Egypt... just weeks after ISIS bomb brought down passenger jet bound for Moscow over Sinai,http://www.dailymail.co.uk/news/article-3325556/Russia-Cairo-sign-deal-build-NUCLEAR-power-plant-Egypt-just-weeks-ISIS-bomb-brought-passenger-jet-bound-Moscow-Sinai.html,True,Russia,1353599,russia local schools,russia.k12.oh.us,,education management,51 - 200,,,linkedin.com/company/russia-local-schools,30,38
20160516.0,Daily Mail,Russia admits it is 'ashamed' of its doping problem - but ignores accusations of state involvement - in a bid to return to athletics competitions,http://www.dailymail.co.uk/news/article-3591376/Russia-doping-problem-sorry-says-minister.html,True,Russia,1353599,russia local schools,russia.k12.oh.us,,education management,51 - 200,,,linkedin.com/company/russia-local-schools,30,38
20160814.0,Washington Post,Russia hack,https://www.washingtonpost.com/world/europe/alleged-russian-involvement-in-dnc-hack-gives-us-a-taste-of-kremlin-meddling/2016/08/13/8075eb60-5f03-11e6-84c1-6d27287896b5_story.html,True,Russia,1353599,russia local schools,russia.k12.oh.us,,education management,51 - 200,,,linkedin.com/company/russia-local-schools,30,38
20191209.0,Washington Post,Russia doping,https://www.washingtonpost.com/sports/2019/12/09/russia-banned-tokyo-olympics/,True,Russia,1353599,russia local schools,russia.k12.oh.us,,education management,51 - 200,,,linkedin.com/company/russia-local-schools,30,38
20151109.0,Washington Post,Russia accused of state-sponsored doping; ban on athletes urged,https://www.washingtonpost.com/sports/olympics/wada-deeply-rooted-culture-of-cheating-among-russian-athletes/2015/11/09/df776170-86f5-11e5-be8b-1ae2e4f50f76_story.html,True,Russia,1353599,russia local schools,russia.k12.oh.us,,education management,51 - 200,,,linkedin.com/company/russia-local-schools,30,38
20160718.0,New York Times,Russia May Face Olympics Ban as Doping Scheme Is Confirmed,http://www.nytimes.com/2016/07/19/sports/report-confirms-state-sponsored-doping-by-russia-at-olympics.html,True,Russia,1353599,russia local schools,russia.k12.oh.us,,education management,51 - 200,,,linkedin.com/company/russia-local-schools,30,38
20200811.0,The Guardian,Russia Sputnik V vaccine approved despite testing safety concerns,https://www.theguardian.com/world/2020/aug/11/russia-approves-coronavirus-vaccine-despite-testing-safety-concerns-vladimir-putin,True,Russia,1353599,russia local schools,russia.k12.oh.us,,education management,51 - 200,,,linkedin.com/company/russia-local-schools,30,38
20170206.0,The Guardian,Russia doping scandal  Ban extended to include world championships in London,https://www.theguardian.com/sport/2017/feb/06/russia-doping-scandal-london-world-championships,True,Russia,1353599,russia local schools,russia.k12.oh.us,,education management,51 - 200,,,linkedin.com/company/russia-local-schools,30,38
20180219.0,New York Times,Russia Backed Trump. But Was It the Difference?,https://www.nytimes.com/2018/02/18/us/politics/trump-election-russia.html,True,Russia,1353599,russia local schools,russia.k12.oh.us,,education management,51 - 200,,,linkedin.com/company/russia-local-schools,30,38
20171115.0,Daily Mail,"Russia lies on an 'industrial scale' about its 'hybrid warfare' as it parks tanks over its neighbours' borders and hacks computers in the West, Ukrainian foreign minister claims",http://www.dailymail.co.uk/news/article-5086299/Russia-lies-industrial-scale-hybrid-warfare.html,True,Russia,1353599,russia local schools,russia.k12.oh.us,,education management,51 - 200,,,linkedin.com/company/russia-local-schools,30,38
20220228.0,The Guardian,Russia launches multiple rocket attacks in Kharkiv and renews Kyiv assault,https://www.theguardian.com/world/2022/feb/28/russian-rocket-strikes-kill-dozens-in-kharkiv-as-ukraine-russia-talks-begin,True,Russia,1353599,russia local schools,russia.k12.oh.us,,education management,51 - 200,,,linkedin.com/company/russia-local-schools,30,38
20200822.0,Daily Mail,Russia launches a SECOND Covid vaccine: New jab developed at top-secret biological weapons plant 'avoids side-effects of first one' that Putin announced to widespread scepticism,https://www.dailymail.co.uk/news/article-8654223/Russia-launches-SECOND-Covid-vaccine-developed-former-biological-weapons-plant.html,True,Russia,1353599,russia local schools,russia.k12.oh.us,,education management,51 - 200,,,linkedin.com/company/russia-local-schools,30,38
20220622.0,New York Times,"Russia conducted more cyberattacks than was realized to bolster its initial invasion, but many  failed, a study showed.",https://www.nytimes.com/2022/06/22/us/politics/russia-ukraine-cyberattacks.html,True,Russia,1353599,russia local schools,russia.k12.oh.us,,education management,51 - 200,,,linkedin.com/company/russia-local-schools,30,38
20220416.0,New York Times,Russia is heading toward a major default on its foreign debt for the first time since the Bolshevik Revolution.,https://www.nytimes.com/2022/04/16/business/russia-debt-default.html,True,Russia,1353599,russia local schools,russia.k12.oh.us,,education management,51 - 200,,,linkedin.com/company/russia-local-schools,30,38
20200702.0,Washington Post,"Russia misses World Athletics payments, jeopardizing track athletes’ eligibility",https://www.washingtonpost.com/sports/2020/07/02/russia-misses-world-athletics-payments-jeopardizing-track-athletes-eligibility/,True,Russia,1353599,russia local schools,russia.k12.oh.us,,education management,51 - 200,,,linkedin.com/company/russia-local-schools,30,38
20200501.0,Daily Mail,"Russia BILLED US more than $600,000 for medical supplies sent on 'aid' flight Vladimir Putin offered to Donald Trump - and cargo plane brought military gas masks and useless ventilators",https://www.dailymail.co.uk/news/article-8279027/Russia-BILLED-600-000-medical-supplies-sent-aid-flight-Putin-offered-Trump.html,True,Russia,1353599,russia local schools,russia.k12.oh.us,,education management,51 - 200,,,linkedin.com/company/russia-local-schools,30,38
20200811.0,New York Times,"Russia Approves Coronavirus Vaccine Before Completing TestsThe country became the first in the world to approve a possible vaccine, despite warnings from the global authorities against cutting corners.",https://www.nytimes.com/2020/08/11/world/europe/russia-coronavirus-vaccine-approval.html,True,Russia,1353599,russia local schools,russia.k12.oh.us,,education management,51 - 200,,,linkedin.com/company/russia-local-schools,30,38
20160721.0,Daily Mail,Russia loses appeal against Olympic ban and now faces being kicked out the Rio games altogether,http://www.dailymail.co.uk/sport/sportsnews/article-3701009/Russia-loses-appeal-against-Olympic-ban-track-field-athletes-Court-Arbitration-Sport.html,True,Russia,1353599,russia local schools,russia.k12.oh.us,,education management,51 - 200,,,linkedin.com/company/russia-local-schools,30,38
20210730.0,Washington Post,"Russia is banned at the Tokyo Olympics for systemic doping, but Russians are everywhere",https://www.washingtonpost.com/sports/olympics/2021/07/30/russian-olympic-committee-tokyo-olympics/,True,Russia,1353599,russia local schools,russia.k12.oh.us,,education management,51 - 200,,,linkedin.com/company/russia-local-schools,30,38
20170330.0,BBC,Russia 'tried to hijack US election',http://www.bbc.com/news/world-us-canada-39442901,True,Russia,1353599,russia local schools,russia.k12.oh.us,,education management,51 - 200,,,linkedin.com/company/russia-local-schools,30,38
20180821.0,USA Today,Russia is back at it again for midterms: Talker,https://www.usatoday.com/story/opinion/2018/08/21/russia-again-hacking-time-midterms-talker/1050744002/,True,Russia,1353599,russia local schools,russia.k12.oh.us,,education management,51 - 200,,,linkedin.com/company/russia-local-schools,30,38
20160725.0,New York Times,Russia Is Accused of Playing in U.S. Politics,http://www.nytimes.com/2016/07/25/us/politics/donald-trump-russia-emails.html,True,Russia,1353599,russia local schools,russia.k12.oh.us,,education management,51 - 200,,,linkedin.com/company/russia-local-schools,30,38
20181217.0,BBC,Russia 'meddled in all big social media',http://www.bbc.com/news/technology-46590890,True,Russia,1353599,russia local schools,russia.k12.oh.us,,education management,51 - 200,,,linkedin.com/company/russia-local-schools,30,38
20151002.0,Daily Mail,Russia moves thermobaric warheads that INCINERATE targets into Ukraine while world's attention is on Syria,http://www.dailymail.co.uk/news/article-3257396/Russia-moves-deadly-new-weapons-equipped-thermobaric-warheads-Ukraine-world-s-attention-Syria.html,True,Russia,1353599,russia local schools,russia.k12.oh.us,,education management,51 - 200,,,linkedin.com/company/russia-local-schools,30,38
20221027.0,Daily Mail,Russia 'is setting up second line of troops behind the front line to SHOOT anyone fleeing combat' according to 'intercepted phone call' released by Ukraine,https://www.dailymail.co.uk/news/article-11361499/Russia-setting-second-line-troops-line-SHOOT-fleeing-combat.html,True,Russia,1353599,russia local schools,russia.k12.oh.us,,education management,51 - 200,,,linkedin.com/company/russia-local-schools,30,38
20220415.0,New York Post,"Russia on verge of default after making payments in rubles, Moody's warns",https://nypost.com/2022/04/15/russia-on-verge-of-default-after-making-payments-in-rubles-moodys-warns/,True,Russia,1353599,russia local schools,russia.k12.oh.us,,education management,51 - 200,,,linkedin.com/company/russia-local-schools,30,38
20201228.0,Daily Mail,"Russia 'is researching how to weaponise deadly Ebola virus as part of a catastrophic doomsday project', experts fear",https://www.dailymail.co.uk/news/article-9092509/Russia-researching-weaponise-deadly-Ebola-virus-catastrophic-doomsday-project.html,True,Russia,1353599,russia local schools,russia.k12.oh.us,,education management,51 - 200,,,linkedin.com/company/russia-local-schools,30,38
20160823.0,New York Times,Russia Is Shut Out of Paralympics Over Doping,http://www.nytimes.com/2016/08/24/sports/russia-paralympic-games-ban.html,True,Russia,1353599,russia local schools,russia.k12.oh.us,,education management,51 - 200,,,linkedin.com/company/russia-local-schools,30,38
20220627.0,The Guardian,Russia defaults on foreign debt for first time since 1917 – reports,https://www.theguardian.com/world/2022/jun/27/russia-defaults-on-foreign-debt-for-first-time-since-1917-revolution-reports,True,Russia,1353599,russia local schools,russia.k12.oh.us,,education management,51 - 200,,,linkedin.com/company/russia-local-schools,30,38
20120619.0,New York Post,Rutgers Web cam spy Dharun Ravi released from jail,http://www.nypost.com/p/news/local/rutgers_web_cam_spy_convict_released_YH5Yt3441GPLJjBloPD14K,True,Rutgers,1715092,rutgers university,rutgers.edu,,higher education,10001+,"new brunswick, new jersey, united states",united states,linkedin.com/company/rutgers-university,10717,30025
20181005.0,New York Times,"Where in the World Is Denmark’s $2 Billion?Officials say the country’s tax agency was swindled by a London-born financier who moved to Dubai. Now, Denmark wants the money back.The elaborate ruse ultimately cost taxpayers more than $2 billion—the equivalent of a $110 billion loss in the U.S. economy.",https://www.nytimes.com/2018/10/05/business/denmark-skat-tax-scandal.html,True,Denmark,1677849,shire of denmark,denmark.wa.gov.au,1911.0,government administration,1 - 10,"denmark, western australia, australia",australia,linkedin.com/company/shire-of-denmark,5,15
20201107.0,USA Today,Part of Denmark in lockdown over mutated…,https://www.usatoday.com/story/news/world/2020/11/07/denmark-mink-covid-mutation-northern-region-under-lockdown/6201830002/,True,Denmark,1677849,shire of denmark,denmark.wa.gov.au,1911.0,government administration,1 - 10,"denmark, western australia, australia",australia,linkedin.com/company/shire-of-denmark,5,15
20131101.0,BBC,'Anonymous' hack Singapore newspaper,http://www.bbc.com/news/technology-24768053,True,Singapore,7148241,singapore.com,singapore.com,2012.0,marketing and advertising,51 - 200,,,linkedin.com/company/singapore-com,17,20
20210625.0,New York Times,"Indonesia’s Doctors Got Vaccinated With Sinovac, and Got Sick",https://www.nytimes.com/2021/06/25/world/asia/indonesia-covid-sinovac.html,True,Sinovac,1300184,sinovac biotech co. ltd.,sinovac.com,2001.0,biotechnology,51 - 200,"peking, beijing, china",china,linkedin.com/company/sinovac-biotech-ltd.,31,60
20210628.0,The Guardian,Indonesia Covid deaths add to questions over Sinovac vaccine,https://www.theguardian.com/world/2021/jun/28/indonesian-covid-deaths-add-to-questions-over-sinovac-vaccine,True,Sinovac,1300184,sinovac biotech co. ltd.,sinovac.com,2001.0,biotechnology,51 - 200,"peking, beijing, china",china,linkedin.com/company/sinovac-biotech-ltd.,31,60
20210906.0,Washington Post,Brazil suspends use of millions of doses of China’s Sinovac coronavirus vaccine,https://www.washingtonpost.com/world/2021/09/06/brazil-coronavirus-vaccine-vaccination-rollout-sinovac/,True,Sinovac,1300184,sinovac biotech co. ltd.,sinovac.com,2001.0,biotechnology,51 - 200,"peking, beijing, china",china,linkedin.com/company/sinovac-biotech-ltd.,31,60
20201204.0,Washington Post,"CEO of China’s Sinovac, which aims to sell vaccine globally, paid bribes for other vaccine approvals",https://www.washingtonpost.com/world/asia_pacific/coronavirus-vaccine-china-bribery-sinovac/2020/12/04/7c09ae68-28c6-11eb-9c21-3cc501d0981f_story.html,True,Sinovac,1300184,sinovac biotech co. ltd.,sinovac.com,2001.0,biotechnology,51 - 200,"peking, beijing, china",china,linkedin.com/company/sinovac-biotech-ltd.,31,60
20130627.0,The Guardian,Chinese wind-turbine firm charged with stealing US trade secrets,http://www.guardian.co.uk/world/2013/jun/28/chinese-wind-turbine-sinovel-trade-secrets,True,Sinovel,2848306,"sinovel wind group co., ltd",sinovel.com,,renewables & environment,201 - 500,"peking, beijing, china",china,linkedin.com/company/sinovel-wind-group-co.-ltd,147,272
20130621.0,CNBC,Ex-Enron CEO Skilling's Sentence Cut to 14 Years,http://www.cnbc.com/id/100830977,True,Skilling,2242965,skilling  sas,skilling.fr,2010.0,internet,1 - 10,"limoges, limousin, france",france,linkedin.com/company/skilling-sas,1,2
20080324.0,CNBC,Hynix Shares Drop as US Jury Favors Rambus,http://www.cnbc.com/id/23820233,True,Hynix,7025806,sk海力士半导体（中国）有限公司,hynix.com,,semiconductors,1 - 10,,,linkedin.com/company/sk海力士半导体（中国）有限公司,1,2
20210309.0,The Guardian,US Smithsonian obtains vial from first Covid-19 vaccine dose,https://www.theguardian.com/us-news/2021/mar/09/smithsonian-vial-covid-vaccine-american-history,True,Smithsonian,7066545,smithsonian institution,smithsonian.org,1846.0,museums and institutions,5001 - 10000,"washington, district of columbia, united states",united states,linkedin.com/company/smithsonian-institution,2687,9623
20201001.0,Washington Post,Smithsonian lays off 237 as covid-19 continues to limit operations,https://www.washingtonpost.com/entertainment/museums/smithsonian-layoffs-pandemic/2020/10/01/8f2093ae-0418-11eb-a2db-417cddf4816a_story.html,True,Smithsonian,7066545,smithsonian institution,smithsonian.org,1846.0,museums and institutions,5001 - 10000,"washington, district of columbia, united states",united states,linkedin.com/company/smithsonian-institution,2687,9623
20180215.0,Daily Mail,"Dozens of dog food brands mainly owned by Smucker's are pulled from shelves after investigation triggered by a dead pug found they contained a EUTHANASIA drug used to put down canines, cats, and horses",http://www.dailymail.co.uk/news/article-5395825/Dozens-dog-food-brands-pulled-shelves-nationwide.html,True,Smucker's,3186584,smuckers inc,smuckers.com,,food production,11 - 50,"marengo, iowa, united states",united states,linkedin.com/company/smuckers-inc,18,39
20200130.0,BBC,2 Sonos sorry for revealing customer email addresses,https://www.bbc.com/news/technology-51315460,True,Sonos,1604785,"sonos, inc.",sonos.com,2002.0,consumer electronics,1001 - 5000,"santa barbara, california, united states",united states,linkedin.com/company/sonos-inc-,992,1854
20141115.0,New York Post,Soros hacks Herbalife holdings by 60%,http://nypost.com/2014/11/15/soros-hacks-herbalife-holdings-by-60/,True,Soros,3214288,soros foundation-kazakhstan,soros.kz,1995.0,civic & social organization,51 - 200,"almaty, almaty qalasy, kazakhstan",kazakhstan,linkedin.com/company/soros-foundation-kazakhstan,18,55
20090914.0,New York Post,SpongeTech client records spring leak,http://www.nypost.com/p/news/business/spongetech_client_records_spring_dw5hyBpvNxFyvS96Xmi5bN,True,SpongeTech,5021112,spongetech delivery systems inc (spngq),spongetech.com,,management consulting,1 - 10,"new york, new york, united states",united states,linkedin.com/company/spongetech-delivery-systems-inc-spngq-,1,1
20200715.0,Daily Mail,LA foodies are left feeling queasy after photos emerge of the city's trendiest brunch spot Sqirl storing buckets of MOLDY JAM which workers are told to 'scrape off' before serving to customers and selling in $14 jars,https://www.dailymail.co.uk/news/article-8525587/Los-Angeles-elite-arms-photos-emerge-trendy-brunch-spot-serving-MOLDY-JAM.html,True,Sqirl,2374250,sqirl capital,sqirl.ca,2016.0,information technology and services,1 - 10,"toronto, ontario, canada",canada,linkedin.com/company/sqirl-capital,3,5
20190325.0,Daily Mail,Cannabis-related ER visits TRIPLED in Colorado after legalization,https://www.dailymail.co.uk/health/article-6848905/Cannabis-related-ER-visits-TRIPLED-Colorado-legalization.html,True,Colorado,762063,state of colorado,colorado.gov,1876.0,government administration,5001 - 10000,"denver, colorado, united states",united states,linkedin.com/company/state-of-colorado,4214,6848
20160406.0,The Guardian,Delaware  It's easier to hide money in the US than almost anywhere,http://www.theguardian.com/us-news/2016/apr/06/panama-papers-us-tax-havens-delaware,True,Delaware,6684550,state of delaware,delaware.gov,,government administration,5001 - 10000,"dover, delaware, united states",united states,linkedin.com/company/state-of-delaware,4500,6043
20220906.0,Daily Mail,REVEALED: Moment Georgia election official led pro-Trump operatives into polling place before a voting machine was breached during 2020 election fallout,https://www.dailymail.co.uk/news/article-11186499/Video-shows-Georgia-official-taking-Trump-operatives-polling-place-voting-machine-breach.html,True,Georgia,2995031,state of georgia,georgia.gov,,government administration,5001 - 10000,,,linkedin.com/company/state-of-georgia,3115,4665
20220508.0,FOX,Michigan car owner sued after Jeep kills mechanic during oil change,//web.archive.orghttps://www.foxnews.com/us/michigan-man-sued-after-car-kills-mechanic-during-oil-change,True,Michigan,5321372,state of michigan,michigan.gov,1837.0,government administration,10001+,"lansing, michigan, united states",united states,linkedin.com/company/state-of-michigan,8963,14012
20200520.0,New York Times,"Floodwaters Breach Michigan Dams, Forcing EvacuationsThe disaster for towns on the Tittabawassee River was compounded by the effects of the coronavirus.",https://www.nytimes.com/2020/05/20/us/michigan-dams.html,True,Michigan,5321372,state of michigan,michigan.gov,1837.0,government administration,10001+,"lansing, michigan, united states",united states,linkedin.com/company/state-of-michigan,8963,14012
20200820.0,USA Today,Michigan to pay $600M in Flint water crisis settlement,https://www.usatoday.com/story/news/nation/2020/08/20/flint-water-crisis-lawsuit-settlement/5616583002/,True,Michigan,5321372,state of michigan,michigan.gov,1837.0,government administration,10001+,"lansing, michigan, united states",united states,linkedin.com/company/state-of-michigan,8963,14012
20210728.0,Daily Mail,Texas Governor Greg Abbott signs executive order BANNING ground transportation of migrants after border crossings caused a 'dramatic rise in COVID cases',https://www.dailymail.co.uk/news/article-9836785/Texas-Governor-Abbott-bans-ground-transportation-migrants-stop-spread-COVID-border.html,True,Texas,4456622,state of texas,texas.gov,,government administration,5001 - 10000,,,linkedin.com/company/state-of-texas,2351,3810
20210727.0,New York Post,‘Holy moly!’: Inside Texas’ fight against a ransomware hack,https://nypost.com/2021/07/26/inside-texas-fight-against-a-ransomware-hack/,True,Texas,4456622,state of texas,texas.gov,,government administration,5001 - 10000,,,linkedin.com/company/state-of-texas,2351,3810
20130418.0,The Guardian,Blast punctuates calm of West-comma-Texas,http://www.guardian.co.uk/world/2013/apr/18/texas-fertiliser-plant-explosion-texas,True,Texas,4456622,state of texas,texas.gov,,government administration,5001 - 10000,,,linkedin.com/company/state-of-texas,2351,3810
20190817.0,Daily Mail,Texas is hit with ransomware attack as at least 20 local governments come under 'coordinated' cyber assault,https://www.dailymail.co.uk/news/article-7366977/Texas-hit-ransomware-attacks-against-20-local-governments.html,True,Texas,4456622,state of texas,texas.gov,,government administration,5001 - 10000,,,linkedin.com/company/state-of-texas,2351,3810
20200717.0,CNBC,"Texas orders extra body bags, mortuary trucks as it braces for more coronavirus deaths",https://www.cnbc.com/2020/07/17/texas-officials-order-extra-body-bags-mortuary-trucks-as-state-braces-for-rising-coronavirus-deaths.html,True,Texas,4456622,state of texas,texas.gov,,government administration,5001 - 10000,,,linkedin.com/company/state-of-texas,2351,3810
20190126.0,FOX,"Texas says it found 95,000 non-citizens on voter rolls; 58,000 have voted",//web.archive.orghttps://www.foxnews.com/politics/texas-says-it-has-discovered-95000-non-citizens-on-voter-rolls-58000-have-voted,True,Texas,4456622,state of texas,texas.gov,,government administration,5001 - 10000,,,linkedin.com/company/state-of-texas,2351,3810
20210619.0,Daily Mail,Texas residents say the temperatures on their smart thermostats were RAISED  overnight without their permission after state's power operators warned of shortages amid a heat wave,https://www.dailymail.co.uk/news/article-9703747/Texas-residents-say-temperature-smart-thermostats-raised-remotely.html,True,Texas,4456622,state of texas,texas.gov,,government administration,5001 - 10000,,,linkedin.com/company/state-of-texas,2351,3810
20101205.0,New York Post,Ice-pick fiend hits StuyTown,http://www.nypost.com/p/news/local/manhattan/ice_pick_fiend_hits_stuytown_nB9m0wWbGcXPxWUHnsKH1L,True,StuyTown,6589736,stuytown - stuyvesant town/peter cooper village,stuytown.com,1947.0,real estate,51 - 200,"new york, new york, united states",united states,linkedin.com/company/stuytown,63,145
20110211.0,Daily Mail,Two million baby monitors recalled after deaths of infants strangled by electrical cords,http://www.dailymail.co.uk/news/article-1356138/Summer-Infant-baby-monitors-recalled-deaths-babies.html,True,Summer-Infant,5804927,summer infant,summerinfant.com,1985.0,consumer goods,201 - 500,"woonsocket, rhode island, united states",united states,linkedin.com/company/summer-infant,114,379
